title,author,score,num_reviewers,main genre,middle genre,subclass,introduction,review"EBS 수능특강 수학영역 수학2 2021학년도 수능연계 교재,2020",EBS교육방송 편집부,9.0점, 1,학습/참고서,고등학교,수능문제집,"2021학년도 대학수학능력시험 준비의 시작은 EBS 수능특강으로!2021학년도 수능 시험을 대비하는 수험생이라면 꼭 봐야 할 교재1. 새 교육과정(2015 개정 교육과정) 및 교과서 분석을 통한 핵심 내용 제시: 과목별 교육과정의 핵심 내용을 제시함으로써 2021학년도 수능에 대비한 탄탄한 기초 확보2. 수능형 연습 문제를 통한 수능 유형 익히기: 최근 수능의 트렌드와 특징, 신유형을 잘 반영한 엄선된 수능형 연습 문제를 통해 2021학년도 수능을 완벽하게 대비!3. 참신한 실전 문제를 통한 수능 대비 실력 점검: 교육과정에 따른 체계적인 교과 내용 분석과 이를 최적화한 필수 실전 문제를 통해 실력 점검·실전 감각 향상4. 잘 알고 있는 내용은 더욱 완벽하게 다듬고, 부족한 부분은 확실하게 보강!: 단원별로 확실한 개념 설명 및 적용 문제가 제공되어, 학습자 본인의 강·약점을 자연스럽게 파악하고, 이를 스스로 강화하고 보완하는 것이 가능5. 학습 편의성을 높이기 위한 학습 자료 서비스, 완벽 분석 무료 강의!한눈에 보는 정답 서비스, 영어영역 단어장부터 최고의 강사진이 함께하는 수능특강 강의까지 EBSI 홈페이지(WWW.EBSI.CO.KR)를 통해 제공+ 지문·문항·자료 분석력, 어휘력 UP 프로젝트 -  수능특강을 공부하는 가장 쉽고 빠른 방법: 수능특강 사용설명서 (13책), 수능연계교재의 VOCA 1800 동시 발행!",
"메가스터디 고등 문학 EBS 총정리 2021 수능 대비, EBS 수능특강+수능완성,2020",강선화,0.0점, 0,학습/참고서,고등학교,문제집,"수험생들의 학습 부담을 줄이면서도 EBS 학습의 효율성을 높이려는 취지에서 〈메가스터디 EBS 문학 총정리〉가 개발되었다. EBS 연계 출제의 체감도를 놓고 볼 때, 국어 영역에서 가장 체감도가 높은 부분이 문학이다. 문학 영역은 운문 문학의 경우에는 대부분 작품이 그대로 출제되고, 산문 문학의 경우에는 EBS 수록 부분과 일부 겹치거나 같은 작품의 다른 부분에서 출제되는 경우가 많다. 메가스터디㈜에서 개발한 〈메가스터디 EBS 문학 총정리〉는 이러한 수능 출제 경향을 반영하여 각 갈래별 특성에 맞는 지문 구성을 통해 해당 문학 작품을 충실히 정리할 수 있도록 하였다. 갈래 특성에 따라 전체 작품 혹은 작품의 중요 부분을 선정하여 수록하고 각각의 작품에서 수험생들이 꼭 알아 두어야 할 핵심 내용과 지문, 개념 등과 함께 실제 수능에서 출제될 가능성이 높은 문항들을 예언 정리하였다.수능에서 국어 영역과 연계되는 2종의 연계 교재(수능특강, 수능완성)에 수록된 많은 문학 작품들을 수험생들이 꼼꼼하게 공부하기란 쉽지 않다. 따라서 수험생들은 학습 부담을 줄이면서도 효율성을 높일 수 있는 EBS 교재의 학습 방법을 찾아야 한다. 수험생들이 이 교재를 자신만의 분석노트로 가지고 다니면서 학습한다면 EBS 연계 수능에 대한 부담감을 떨치고 효율적인 학습을 통해 좋은 성과를 거둘 수 있을 것이다.","(1) EBS 연계 교재인 〈수능특강〉과 〈수능완성〉에 수록된 모든 문학 작품과 적중 예언! 중요 작품을 한데 모아 분석하고, 변형 출제를 예상한다!2021학년도 수능의 EBS 연계 교재 〈수능특강〉과 〈수능완성〉에 실린 모든 문학 작품을 분석하여 그 핵심 내용을 정리하였다. 지문 연계의 원리에 따라 지문 전문을 수록하거나 재구성하였으며, 중요 문항에 대한 변형 유형과 출제 가능성이 높은 신규 유형을 예측하여 보다 효율적으로 수능 시험에 대비할 수 있도록 하였다. (2) 전문가들의 철저한 분석에 따른 제재의 중요도와 출제 가능성 여부를 확인한다!수능 전문가들의 철저한 분석을 통해 제재의 중요도와 출제 가능성이 높은 정도를 별도로 표시하여 학생들이 중요도에 따라 학습할 수 있도록 하였다. 또한 EBS 교재에 수록된 문항이 실제 수능에서 연계되어 출제된다면 어떻게 변형될 수 있는지, 또 새로운 문항이 출제된다면 어떤 유형으로 출제될 수 있는지를 예언하여 학습의 방향을 제시하였다. (3) 반드시 알아야 할 작품의 핵심 요소, 중요 〈보기〉나 선지 예시, 핵심 개념을 정리한다!작품을 이해하는 데 기본이 되는 핵심 요소를 지문 첨삭과 도식화 등을 통해 한눈에 파악할 수 있도록 정리하였다. 또한 해당 문항의 중요 〈보기〉나 선지 예시, 핵심 개념 등 반드시 학습해야 할 요소를 정리하여 효율적으로 학습할 수 있도록 하였다."
"개념원리 중학 수학 2-2 2019,중2 적용",이홍섭,0.0점, 0,학습/참고서,중학교,중2 문제집,"하나를 알면 10개, 20개를 풀 수 있고 어려운 수학에 흥미를 갖게 하여 쉽게 수학을 정복할 수 있다. 나선식 교육법을 채택하여 쉬운 것부터 어려운 것까지 단계적으로 혼자서도 충분히 공부할 수 있도록 하였으며, 페이지마다 문제를 푸는 방법과 틀리기 쉬운 부분을 체크하여 개념과 원리를 충실히 익히도록 하였다.","1. 하나를 알면 10개, 20개를 풀 수 있고 어려운 수학에 흥미를 갖게 하여 쉽게 수학을 정복할 수 있습니다.2. 나선식 교육법을 채택하여 쉬운 것부터 어려운 것까지 단계적으로 혼자서도 충분히 공부할 수 있도록 하였습니다.3. 페이지마다 문제를 푸는 방법과 틀리기 쉬운 부분을 체크하여 개념과 원리를 충실히 익히도록 하였습니다."
중등 영어 2-2 기말고사 기출문제집(동아 윤정미)(100발100중) 새 교과서 적용,에듀원 편집부,0.0점, 0,학습/참고서,중학교,중2 문제집,"1. 교과서 속 핵심 어휘 / 교과서 어휘 다지기 STEP 1, 2   : 교과서 핵심 어휘 및 표현 정리와 함께 단계별 확인 학습 문제를 제시함으로써 어휘를 완벽히 다질 수 있도록 함2. 교과서 속 핵심 대화 / 교과서 대화 모두 보기 / 교과서 대화 다지기 STEP 1, 2   : 교과서 핵심 의사소통 및 단원 내 모든 대화문의 꼼꼼한 분석과 함께 단계별 확인 학습 문제를 제시함으로써 의사소통 기능을 완벽히 다질 수 있도록 함3. 교과서 속 핵심 문법 / 교과서 문법 다지기 STEP 1, 2 / 서술형    : 교과서 핵심 문법과 확장된 개념을 통해 고난도 문항에 완벽히 대비하고, 다양한 쓰기 문제를 통해 서술형 문항에도 철저하게 대비할 수 있도록 함4. 교과서 속 핵심 본문 / 교과서 본문 다지기 / 교과서 속 기타 지문   : 끊어 읽기와 구문 분석, 단답형 문제, 빈칸 완성 문제를 통해 교과서 본문을 확실하게 학습할 수 있게 하고, 교과서 내 기타 지문들을 모두 수록하여 점검할 수 있도록 함5. 영역별 실력 굳히기: 어휘, 대화, 문법, 독해의 각 영역별로 서술형 및 논술형 문제를 포함한 다양한 문제들을 풀어봄으로써 학교시험에 적응 할 수 있도록 함6. 학교시험 100점 맞기 STEP 1, 2: 실전에 가까운 기출 유형 문제를 풀며 다시 한 번 실력을 점검함으로써 시험에 완벽 대비할 수 있도록 함7. 서술형으로 끝내기 / 창의 서술형: 다양한 유형의 서술형 문제 풀이를 통해 기본 서술형 문제뿐만 아니라 신경향 서술형 문제, 쓰기 수행평가까지 모두 대비할 수 있도록 함8. 교과서 본문 손으로 익히기  : 교과서 본문을 문장 단위로 다시 써봄으로써 자기주도적인 반복 학습이 가능하도록 함 9. X-10(특별부록)PART I(시험대비 암기노트) : 교과서 어휘 및 표현, 대화 2단계, 본문 5단계의 단계별 쓰기 강화 훈련 수록  시험에 나올 만한 교과서 핵심 문장 복습 코너 수록PART II(최종점검 모의고사) : 실제 기출 문제와 동일한 유형의 문제들을 단원별로 풀어봄으로써 실전에서 고득점을 받을 수 있도록 구성",1. 새 교과서 내용을 완벽히 반영한 최신 기출 유형의 예상문제 총 망라- 2019학년도 2학년 새 교과서(2015 개정 교육 과정) 내용을 완벽히 수록- 전국 중학교의 시험문제를 종합 분석하여 가장 높은 출제율의 예상문제 다량 수록 - 다양한 유형의 서술형 문제와 논술형 문제로 학교 시험과 수행평가 완벽 대비2. 학습에 최적화된 구성으로 설계 - 교과서의 모든 내용이 자연스럽게 각인되는 단계별 학습 설계 - 수업 또는 자기주도학습을 통해 학습 내용을 완벽하게 습득할 수 있는 구성 3. 출판사별 맞춤형 교재 제작 - 2학년 12종 영어 교과서별 특성과 내용을 심층 분석한 맞춤형 교재 제공 - 풍부한 예문과 자세한 설명을 통해 부족한 학습 보충 가능
자이스토리 고등 수학(하) 1131제 2020,김성남,0.0점, 2,학습/참고서,고등학교,수능문제집,"세밀한 유형 분류와 난이도순 문제 배열로 수학이 쉬워지는 유형 기본서1. 개념의 다각적인 분석과 촘촘한 유형분류로 수학의 완전 학습이    가능합니다. 2. 개념과 유형의 흐름에 맞춰 각 단원 내용을 체계적으로 학습할 수    있도록 개념순, 난이도 순으로 문제를 배열하였습니다.2. 내신은 물론 학력평가와 수능 대비를 위한 학력평가 + 수능 우수    기출문제를 수록하였습니다.  3. 내신+학평 대비 단원별 모의고사로 중간, 기말 학교 시험과 학력평가   시험에 대비할 수 있습니다.","학교시험과 학력평가 만점 대비를 위한 유형 완벽 훈련서1. 꼼꼼한 개념 정리와 개념 확인 문제로 핵심 개념 완벽히 이해2. 촘촘한 유형 분류로 실전 유형 감각 최대화  3. 개념 흐름 순서와 핵심 유형의 난이도 단계에 따른 문제 구성으로    체계적인 유형 학습 가능4. 최신 기출문제 분석을 바탕으로 내신+학력평가와 수능의 유형 및    출제 경향 마스터5. 문제를 분석하는 해결 단서가 수록된 입체 첨삭 해설 제공6. 입체 첨삭식 해설과 특별하고 다양한 풀이법 제시    [ 다른 풀이, 톡톡 풀이, 쉬운 풀이]"
"신사고 쎈 고등 수학 1 SSEN,새교육과정,2020",홍범준,0.0점, 1,학습/참고서,고등학교,문제집,"1. 2015 개정 교육과정을 충실히 반영한 개념 정리 및 유형 분류2. A, B, C 3단계 수준별 학습 체제를 보완하여 학습 효과 극대화3. 전국 내신 기출 문제를 수집, 분석하여 빈출 및 창의 문제 제시4. 서술형 출제 비중 강화에 따른 최적의 서술형 주관식 문항5. 자세한 해설로 문제 해결력 향상 기능 강화1. 내신과 수능의 모든 유형을 담은 문제기본서주제별로 꼭 알아야 할 개념을 정리하고 기본 유형을 충분히 연습할 수 있도록 구성하였습니다. 전국 고등학교 내신 기출 문제와 평가원, 수능 기출 문제 등을 분석하여 문제 해결에 필요한 개념, 해결 방법 등에 따라 유형을 분류해 놓은 교재로, 충분한 문제 연습이 가능합니다.2. A, B, C 3단계 난이도로 구성모든 문제를 3단계로 나누어 수준별로 구성하고, 유형 뽀개기에서는 이를 다시 하, 중, 상의 난이도로 세분하여 체계적으로 수학 실력을 키울 수 있도록 만들었습니다. 3. 수학적 사고력 강화수학적 사고력을 기르기 위해 우수한 문제를 엄선하여 C단계에 창의문제로 다루었습니다. ""","'2,500만부 돌파, 베스트셀러 문제기본서 쎈'내신과 수능에 나오는 모든 문제가 다 들어 있는 “문제 기본서 쎈”쎈은 개념 학습 이후의 수학 학습 방법으로 유형별 문제 학습을 선도적으로 제안하며 등장하여 최고의 자리를 지키고 있는 수학 문제 기본서의 대표 주자입니다. 문항 분석 방법, 보유하고 있는 방대한 데이터 베이스와 인프라를 바탕으로 한 쎈의 유형 분석과 문제 해결 방법은 어떤 유사 교재도 따라올 수 없는 특별함이 있습니다. 이것이 매년 유사 교재들이 범람하는 속에서도 쎈이 최고의 자리에 있는 이유입니다. 또 2015개정 교육과정을 철저하게 분석하여 새 교육과정에 꼭 맞는 문제를 제공하므로 바뀐 교육과정에서도 역시 쎈이 최고의 문제 기본서의 자리를 지켜나갈 것입니다."
"EBS 수능특강 수학영역 확률과 통계 2021학년도 수능연계 교재,2020",EBS교육방송 편집부,10.0점, 1,학습/참고서,고등학교,수능문제집,"2021학년도 대학수학능력시험 준비의 시작은 EBS 수능특강으로!2021학년도 수능 시험을 대비하는 수험생이라면 꼭 봐야 할 교재1. 새 교육과정(2015 개정 교육과정) 및 교과서 분석을 통한 핵심 내용 제시: 과목별 교육과정의 핵심 내용을 제시함으로써 2021학년도 수능에 대비한 탄탄한 기초 확보2. 수능형 연습 문제를 통한 수능 유형 익히기: 최근 수능의 트렌드와 특징, 신유형을 잘 반영한 엄선된 수능형 연습 문제를 통해 2021학년도 수능을 완벽하게 대비!3. 참신한 실전 문제를 통한 수능 대비 실력 점검: 교육과정에 따른 체계적인 교과 내용 분석과 이를 최적화한 필수 실전 문제를 통해 실력 점검·실전 감각 향상4. 잘 알고 있는 내용은 더욱 완벽하게 다듬고, 부족한 부분은 확실하게 보강!: 단원별로 확실한 개념 설명 및 적용 문제가 제공되어, 학습자 본인의 강·약점을 자연스럽게 파악하고, 이를 스스로 강화하고 보완하는 것이 가능5. 학습 편의성을 높이기 위한 학습 자료 서비스, 완벽 분석 무료 강의!한눈에 보는 정답 서비스, 영어영역 단어장부터 최고의 강사진이 함께하는 수능특강 강의까지 EBSI 홈페이지(WWW.EBSI.CO.KR)를 통해 제공+ 지문·문항·자료 분석력, 어휘력 UP 프로젝트 -  수능특강을 공부하는 가장 쉽고 빠른 방법: 수능특강 사용설명서 (13책), 수능연계교재의 VOCA 1800 동시 발행!",
중학영문법 3800제 2학년(2021)(새 교과서에 맞춘)(개정판 11판) 새 교과서에 맞춘 11차 개정판,마더텅 편집부,0.0점, 0,학습/참고서,,,"최신 개정 14종 교과서를 반영하고, 전국 중학교 중간, 기말고사에서 나온 문법문제를 철저히 분석하였다. 단답형, 선택형, 문장완성형, 서술형 3000제+중간, 기말고사대비문제 800제를 담았으며, 한 번에 한 가지 문제해결능력을 완전히 익히고 다음 단계로 넘어가는 PSS(Problem Solving Skill-유형별 문제해결능력) 개념을 도입하였다. 내신만점부터 특목고 진학을 위한 문법 사항을 완벽 대비할 수 있다.","1등은 1등인 이유가 있다!교보문고, YES24, 인터파크 영문법 부문 판매 1위! 2007년부터 2020년까지 14년간 총 402만부 판매!!1. 최신 개정 14종 교과서 반영2. 전국 중학교 중간, 기말고사에서 나온 문법문제를 철저히 분석3. 단답형, 선택형, 문장완성형, 서술형 3000제+중간, 기말고사대비문제 800제4. 한 번에 한 가지 문제해결능력을 완전히 익히고 다음 단계로 넘어가는 PSS(Problem Solving Skill-유형별 문제해결능력) 개념 도입5. 내신만점부터 특목고 진학을 위한 문법 사항 완벽 대비6. 필수 문법사항 암기표, 열공 진도표 제공 7. 무료제공: * 단어 암기장* 단어장 MP3 파일* 해석자료 홈페이지 제공 8. EBS 중학프리미엄 최고 인기 교재, 본사 직강 마더텅 중학영문법 3800제 동영상 강의 제공"
"EBS 뉴수능 스타트 고등 국어영역 국어 한국교육과정평가원 개편 수능 예시문항 최초 분석 교재,2022 수능대비,2020",EBS교육방송 편집부,0.0점, 1,학습/참고서,고등학교,수능문제집,"새로운 ""뉴수능"", 새로운 ""뉴수능 스타트""로 대비하자.한국교육과정평가원의 2022학년도 수능 예시 문항 EBS 최초 분석! 2015 개정 교과서와 2022학년도 수능 예시 문항 및 최근 기출 문제를 체계적으로 분석하여 2022학년도 수능 국어영역을 철저하게 대비할 수 있습니다.1. 새로운 수능에 딱 맞는 개념① 한눈에 보는 개념과 대표 유형해당 강에서 학습할 주요 개념과 대표 출제 유형을 한눈에 볼 수 있도록 제시하였습니다.② 핵심 개념핵심 개념을 설명하고, 개념 내용에 따라 핵심 개념을 쉽게 이해할 수 있도록 예시 작품을 수록하였습니다.③ 개념어 사전핵심 개념에 제시된 내용 중에서 보충이 필요한 개념어에 추가 설명을 제시하였습니다.2. 새로운 수능에 딱 맞는 유형별 문제① 개념의 대표 유형핵심 개념에 관련된 대표적인 기출 문제를 제시하였습니다. 2022학년도 수능 예시 문항도 다수 수록하였습니다.② 개념으로 대표 유형 잡기핵심 개념을 해당 문항에 어떻게 적용하여 해결할 수 있는지 제시하였습니다. 제시된 풀이를 순서대로 읽어 보면 문항을 쉽게 해결할 수 있습니다.3. 새로운 수능에 딱 맞는 실전 대비 문제① 실전 문제개념을 실전에 적용할 수 있는 문제를 제시합니다. ‘대표 유형’ 표시가 된 문항은 해당 강의 개념이 적용된 대표 유형입니다.② 어휘 풀이문제를 해결하는 데 필요한 어휘의 뜻풀이를 제공합니다.","새로운 ""뉴수능"", 새로운 ""뉴수능 스타트""로 대비하자.한국교육과정평가원의 2022학년도 수능 예시 문항 EBS 최초 분석! 2015 개정 교과서와 2022학년도 수능 예시 문항 및 최근 기출 문제를 체계적으로 분석하여 2022학년도 수능 국어영역을 철저하게 대비할 수 있습니다.1. 새로운 수능에 딱 맞는 개념① 한눈에 보는 개념과 대표 유형해당 강에서 학습할 주요 개념과 대표 출제 유형을 한눈에 볼 수 있도록 제시하였습니다.② 핵심 개념핵심 개념을 설명하고, 개념 내용에 따라 핵심 개념을 쉽게 이해할 수 있도록 예시 작품을 수록하였습니다.③ 개념어 사전핵심 개념에 제시된 내용 중에서 보충이 필요한 개념어에 추가 설명을 제시하였습니다.2. 새로운 수능에 딱 맞는 유형별 문제① 개념의 대표 유형핵심 개념에 관련된 대표적인 기출 문제를 제시하였습니다. 2022학년도 수능 예시 문항도 다수 수록하였습니다.② 개념으로 대표 유형 잡기핵심 개념을 해당 문항에 어떻게 적용하여 해결할 수 있는지 제시하였습니다. 제시된 풀이를 순서대로 읽어 보면 문항을 쉽게 해결할 수 있습니다.3. 새로운 수능에 딱 맞는 실전 대비 문제① 실전 문제개념을 실전에 적용할 수 있는 문제를 제시합니다. ‘대표 유형’ 표시가 된 문항은 해당 강의 개념이 적용된 대표 유형입니다.② 어휘 풀이문제를 해결하는 데 필요한 어휘의 뜻풀이를 제공합니다."
고등 사회탐구영역 사회 문화(2020)(2021 수능대비)(8절)(EBS Final 실전모의고사) 2015 개정 교육과정 첫 수능,편집부,0.0점, 0,학습/참고서,,,"〈FINAL 실전모의고사 사회탐구영역 사회·문화〉2015 개정 교육과정 첫 수능, 기출로는 부족하다!2021학년도 수능 완벽 대비는 EBS 모의고사 시리즈와 함께!EBS의 첫 번째 모의고사 시리즈 ""FINAL 실전모의고사“수능과 동일한 난이도의 신규 모의고사 ‘9회분’ 제공2021학년도 수능 리허설!작년 수능과 동일한 배점과 비슷한 난이도로 구성하되, 각 회 별로 고난도 문항을 포함시켜 2021학년도 수능 대비 실전력을 한층 강화시킬 수 있도록 하였습니다.명확한 해설!쉽고 상세한 해설을 선택지별로 제시함으로써 정답이 되는 이유와 오답이 되는 이유를 명확하게 파악하도록 하였습니다.EBSI 100% 무료강의 제공고교강의의 중심, EBSI에서 제공하는 100% 무료 강의를 인터넷 홈페이지 / 스마트폰 ‘EBS 고교강의’ 앱을 통해 들을 수 있습니다.","2015 개정 교육과정 첫 수능, 기출로는 부족하다!2021학년도 수능 완벽 대비는 EBS 모의고사 시리즈와 함께!EBS의 첫 번째 모의고사 시리즈 ""FINAL 실전모의고사“수능과 동일한 난이도의 신규 모의고사 ‘9회분’ 제공2021학년도 수능 리허설!작년 수능과 동일한 배점과 비슷한 난이도로 구성하되, 각 회 별로 고난도 문항을 포함시켜 2021학년도 수능 대비 실전력을 한층 강화시킬 수 있도록 하였습니다.명확한 해설!쉽고 상세한 해설을 선택지별로 제시함으로써 정답이 되는 이유와 오답이 되는 이유를 명확하게 파악하도록 하였습니다.EBSi 100% 무료강의 제공고교강의의 중심, EBSi에서 제공하는 100% 무료 강의를 인터넷 홈페이지 / 스마트폰 ‘EBS 고교강의’ 앱을 통해 들을 수 있습니다."
"EBS 중학 신입생 예비과정 국어 2020,예비 중1을 위한,새 교과서 반영",EBS 편집부,10.0점, 9,학습/참고서,중학교,중1 문제집,- 독자대상 : 예비 중학교 1학년- 구성 : 이론 + 문제- 특징 : ① 중학 교과 입문서② 새 교과서 반영,
"EBS 중학 뉴런 수학 1 (하) 2018,세상에 없던 새로운 공부법",EBS 편집부,10.0점, 7,학습/참고서,중학교,중1 문제집,"- 독자대상 : 중학생- 구성 및 특징 :① 중학교 교육과정의 학습개념을 모두 담아냄 개념서② 방송, 모바일 등 언제 어디서나 학습할 수 있어 자기주도학습 능력을 키움③ 예습, 복습 가능",
"EBS 수능특강 수학영역 수학1 2021학년도 수능연계 교재,2020",EBS교육방송 편집부,8.0점, 1,학습/참고서,고등학교,수능문제집,"2021학년도 대학수학능력시험 준비의 시작은 EBS 수능특강으로!2021학년도 수능 시험을 대비하는 수험생이라면 꼭 봐야 할 교재1. 새 교육과정(2015 개정 교육과정) 및 교과서 분석을 통한 핵심 내용 제시: 과목별 교육과정의 핵심 내용을 제시함으로써 2021학년도 수능에 대비한 탄탄한 기초 확보2. 수능형 연습 문제를 통한 수능 유형 익히기: 최근 수능의 트렌드와 특징, 신유형을 잘 반영한 엄선된 수능형 연습 문제를 통해 2021학년도 수능을 완벽하게 대비!3. 참신한 실전 문제를 통한 수능 대비 실력 점검: 교육과정에 따른 체계적인 교과 내용 분석과 이를 최적화한 필수 실전 문제를 통해 실력 점검·실전 감각 향상4. 잘 알고 있는 내용은 더욱 완벽하게 다듬고, 부족한 부분은 확실하게 보강!: 단원별로 확실한 개념 설명 및 적용 문제가 제공되어, 학습자 본인의 강·약점을 자연스럽게 파악하고, 이를 스스로 강화하고 보완하는 것이 가능5. 학습 편의성을 높이기 위한 학습 자료 서비스, 완벽 분석 무료 강의!한눈에 보는 정답 서비스, 영어영역 단어장부터 최고의 강사진이 함께하는 수능특강 강의까지 EBSI 홈페이지(WWW.EBSI.CO.KR)를 통해 제공+ 지문·문항·자료 분석력, 어휘력 UP 프로젝트 -  수능특강을 공부하는 가장 쉽고 빠른 방법: 수능특강 사용설명서 (13책), 수능연계교재의 VOCA 1800 동시 발행!",
