title,author,score,num_reviewers,main genre,middle genre,subclass,introduction,review전래동화 컬러링북 최경일 쌤과 함께 노는 창의력 도서관 놀이터,공귀영,0.0점, 5,어린이,,,"동화책도 읽고, 유튜브 영상도 보고, 색칠공부도 하다보면어느새 창의력과 집중력이 쑥쑥!!!아이들의 창의성 교육과 정서에 관심이 많은 최경일 선생님과 그림을 그리며 힐링의 시간을 즐기는 공귀영 일러스트레이터가 만나, 《전래동화 컬러링북》을 만들었습니다. 우리 아이들이 너무나 좋아하는 ‘흥부와 놀부’부터 ‘토끼전’, ‘도깨비 방망이’, ‘방귀쟁이 며느리’, ‘호랑이와 곶감’, ‘쇠붙이를 먹는 불가사리’ 등 14편의 전래동화를 읽고, 관련 영상(동영상 QR코드 탑재)도 보고, 색칠공부를 해보세요. 열심히 하다 보면, 어느새 창의력과 집중력이 쑥쑥 자라납니다! * 14편의 동화 장면 색칠공부를 마치면, 한 권의 컬러링북이 완성됩니다. * 부모님과 또 친구들과 함께 좋아하는 동화에 대해 이야기를 나눠보세요. * 우리들만의 힐링 세상이 펼쳐집니다.","* 14편의 동화 장면 색칠공부를 마치면, 한 권의 컬러링북이 완성됩니다. * 부모님과 또 친구들과 함께 좋아하는 동화에 대해 이야기를 나눠보세요. * 우리들만의 힐링 세상이 펼쳐집니다."
흔한 남매 4,흔한남매 (원작),10.0점, 24,,,,"지친 일상에 활력을 주는 토닥토닥 공감과 웃음!두근두근 새 학기를 맞이한 남매, 에이미의 연애 코치, 으뜸이의 기막힌 동생 사용 설명서, 달콤 살벌한 밸런타인데이, 만약 학교 공부가 슬라임이라면 벌어질 일들, 남매의 리코더 폭풍 연습 등 웃음과 공감이 가득한 흔한남매의 일상을 만나 보아요!유튜브 175만 구독 돌파! 인기 크리에이터 흔한남매‘흔한남매’는 유튜브 구독자 수가 175만 명, 누적 조회 수가 9억 회를 넘어서는 인기 크리에이터로, 샌드박스네트워크에 소속되어 있습니다. 상황극?콩트 등을 통해 어린이들에게 큰 사랑을 받고 있으며, 주로 남매 사이에서 일어날 수 있는 현실적인 에피소드를 코믹하게 그려 내어 웃음과 공감을 이끌어 내고 있습니다.흔한남매가 선사하는 유쾌한 우애와 순수한 웃음!《흔한남매 4》는 ‘흔한남매’ 유튜브 영상의 스토리를 앙증맞고 유머러스한 만화로 풀어 낸 코믹북입니다. 하루도 조용할 날이 없는 으뜸이와 에이미의 일상 스토리는 진짜 웃음이 필요한 어린이들에게 순수한 웃음과 유쾌한 우애를 선사할 것입니다.","[구성]웃음 폭탄 '에피소드'와 깨알 재미 '놀이'의 조합!어린이의 웃음 코드에 맞춰 엄선한 에피소드를 앙증맞고 유머러스한 만화로 풀어 냈습니다. 웃음을 유발하는 에이미와 으뜸이의 티격태격 일상은 물론이고, 두근두근 새 학기를 맞이한 남매,  에이미의 연애 코치, 으뜸이의 기막힌 동생 사용 설명서, 달콤 살벌한 밸런타인데이, 리코더 폭풍 연습 등 골라 읽는 재미가 가득한 에피소드 만화가 수록되어 있습니다. 또한 에피소드 만화 중간중간에는 유튜브에서는 만날 수 없었던 ‘소곤소곤 스트레스 해소하기’, ‘완전 인싸! 나만의 사인 만들기’, ‘요리 금손 으뜸이의 시크릿 레시피’ 등 깨알 재미가 가득한 놀이 페이지가 수록되어 있습니다."
"정재승의 인간 탐구 보고서 4 어린이를 위한 뇌과학 프로젝트,사춘기 땐 우리 모두 외계인",정재승,10.0점, 23,어린이,초등3~4학년,교양/취미,"천방지축, 예측 불가능한사춘기의 매력에 빠져 보자.인생의 가장 특별하고 소중한 시기를 지나고 있는 모든 10대들의 이야기!나를 발견하는 놀라운 경험《인간 탐구 보고서》4권 출간! 이번엔 사춘기다!--- 아무도 내 마음을 몰라주는 것 같아. --- 모두가 나만 보고 있는 게 아닐까?--- 제발 나를 가만히 내버려 둬!답은 ‘뇌’에 있다![줄거리]갑작스레 침투한 지구인 때문에 비상 감시 체제에 돌입한 아우린 본부! 하지만 이 지구인, 도대체 지구인 같지가 않다. 방에 콕 박혀서 나오지도 않고, 조용하게 자기 할 일만 하는 게… 꼭 아우린과 비슷하다! 수상한 소문만 무성한 이 지구인을 두고, 대원들의 의견도 엇갈린다. 과연 아우린들은 지구인들도 무서워하는 지구인, 아주아주 위험한 지구인이라는 사춘기 소년과 잘 지낼 수 있을까?멀고 먼 다른 은하계에서 웜홀을 뚫고 태양계의 지구까지 온 아우레 탐사대. 이들의 눈에 비친 지구인들은 어떤 모습일까? 아우린들, 투닥투닥 사춘기들의 진짜 마음을 알려 줘!"," 뇌과학은 내가 누구이고, 내 주변의 사람을 이해하는 데 있어 굉장히 중요한 이해의 실마리를 제공합니다저희 딸이 굉장히 어렸을 때, 인터넷 주소가 외워지지 않으니까 막 짜증을 낸 적이 있어요. 그래서 “원래 사람은 한 번에 7개 이상의 아이템을 기억하지 못한다.”라고 말해 줬더니, “내가 이걸 외우지 못하는 건 당연한 거구나.” 그러면서 이해를 하더라고요. 또 작은 아이가 자신이 부모님에게 언니에 비해 공평한 대우를 받지 못한다는 얘기를 해서, 두 아이를 불러 놓고 “우리 인간의 뇌에는 나와 내 형제들을 부모가 동등하게 대하는지를 비교하는 ‘뇌섬’이라는 곳이 따로 있다. 그래서 너희가 아무리 질투하지 않고 참으려고 해도, 원래 우리 뇌는 그렇게 작동하는 거니까 언니랑 동생이랑 비교하는 것에 대해서 죄책감을 느끼지 말고, 공평하지 않다고 생각하는 게 있다면 엄마아빠에게 말해라.” 그렇게 말했더니 아이들이 이 상황을 이해하며 서로 화해도 하더라고요.이러한 모습을 보며 아이들이 어렸을 때 아이들을 위한 어린이 책 또는 청소년 책을 한번 내 보고 싶다는 생각을 했습니다. 그래서 제가 만약에 단 한 권의 어린이 책을 내야 한다면 그 책은 우리의 마음을 헤아릴 수 있는 뇌과학을 아이들에게 가르쳐 줄 수 있는 책이었으면 했고요.우리는 뇌과학에 대해서 고등학교를 졸업할 때까지 한 번도 제대로 배우지 않아요. 그런데 내가 누구이고 내가 좋아하는 친구들은 왜 저렇게 행동하고 우리가 함께 사는 주변의 이웃들, 우리 사회는 왜 이렇게 돌아가는가를 이해하는 데 있어서 뇌과학은 굉장히 중요한 이해의 실마리를 제공합니다. 그렇기 때문에 아이들한테 뇌과학을 일찍부터 가르쳐 주면 자기 감정도 잘 다스릴 수 있고, 친구들이 왜 저렇게 행동하는지 이해심도 깊어질 거예요. 그래서 ‘아이들에게 뇌과학을 굉장히 재밌고 흥미롭게 가르쳐 주면 좋겠다.’ 라는 생각이 들어 이번 책을 기획하게 되었습니다.[인간 탐구 보고서]를 한마디로 정의하면…호기심의 주크박스 같은 거예요아이들이 어렸을 때 하는 고민들의 대부분은 사실 뇌를 잘 이해하면 해답을 얻을 수 있습니다. ‘나는 왜 이럴 때 이런 감정이 들지? 나는 왜 때로는 누군가와 싸우고, 내 충동을 억제하지 못하기도 하고, 하지 말라는 일을 더 하고 싶기도 할까? 저 친구는 왜 저렇게 행동하지? 부모님은 왜 우리한테 이런 얘기를 하지?’우리가 어렸을 때 갖는 질문들의 대부분은 아이들에게 마음과 또 그 마음을 담아내는 그릇인 뇌를 설명해 주면 꽤 많은 것들이 설명이 됩니다. 그래서 저는 [인간 탐구 보고서]가 우리가 진짜 궁금해하는 호기심과 질문들에 대한 주크박스라는 생각이 들어요. 평소에 가졌던 질문들을 책 안에 집어넣으면, 뇌과학을 통해서 근사한 답들이 튀어나오는 그런 주크박스인 거죠. 그래서 아이들도 ‘뇌과학이 어려운 학문이 아니라 나와 친구를 이해하는 지도 같은 거구나.’ 이렇게 받아들이면 좋겠습니다. 1권의 주제는 ‘외모’, 2~3권에는 ‘기억’과 ‘감정’ 등 흥미로운 주제들이 계속됩니다누구나 외모에 민감합니다. 사실은 너무 당연하다고 생각하지만 되게 신기한 일이기도 하거든요, 왜냐하면 우리 눈에는 원숭이나 고릴라들의 얼굴이 다 비슷하게 생겼잖아요. 그러나 그들 사이에서는 어떤 원숭이가 더 멋있고 근사한지를 서로 아주 섬세하게 파악하고 서로 비교도 하고 경쟁도 할 거예요. 우리도 마찬가지입니다. 외계인의 시선으로 본다면 눈, 코, 입이 비슷하게 생겼는데 누가 좀 더 예쁘고 누가 좀 더 근사하게 생겼는지를 왜 저토록 비교하고 집착하는지 굉장히 신기할 수도 있을 거예요. 물론 그것이 우리를 너무나 외모지상주의로 이끌기도 하지만, 또 그러는 과정에서 다른 사람의 감정을 섬세하게 읽어 내기도 하고, 표정을 통해서 그들을 이해하기도 하는 것들이 모두 외모 안에 담겨 있는 것 같아요. 그래서 인간이 왜 이렇게 외모에 집착하느냐를 통해서, 서로 상대를 이해하는 마음들이 어떻게 생겨나는지를 아이들이 이해할 수 있으면 좋겠다는 생각이 들어서 과감하게, 아이들이 너무나도 흥미로워할 내용이기도 한 외모를 1권의 주제로 삼았습니다.2권과 3권에서는 각각 ‘기억’과 ‘감정’을 다룹니다. 사실은 우리가 우리 스스로에 대해서 가장 궁금한 요소이기도 하죠. 우리가 누구에게 흥미를 느끼고, 누구랑 사랑에 빠지느냐 하는 내용들은 아주 흥미로운 내용들이거든요. 그래서 처음 이야기는 외모로 시작하지만, 이 이야기는 복잡하고 다양한 인간의 다양한 면들을 끊임없이 계속 다룰 예정입니다. 앞으로의 이야기를 더 흥미롭게 기대해 주셔도 좋습니다. [인간 탐구 보고서]는 우리 인간들에 대한 매력적이고 흥미로운 주제로 계속 이어질 예정입니다. 추천의 말한 권, 한 권 나올 때마다 더더욱 만족하며 읽게 되는 책 - 알라딘진짜 강추하니 어른도 꼭 읽어 보세요. - yes24아이가 3권 받자마자 읽고, 생각날 때마다 꺼내서 읽고, 학교에도 들고 가서 읽고…. - 교보문고아이가 스스로 찾아 읽는 책 - 교보문고말할 필요가 없죠. 아이가 계속해서 보는 책입니다! - 인터파크4권 특별부록- 뇌 말랑 보드 게임게임만 해도 뇌과학이 쏙쏙.뇌 말랑 보드 게임으로 사춘기 친구들에게 한 걸음 더!"
이상한 과자 가게 전천당 3,히로시마 레이코,8.75점, 29,어린이,초등1~2학년,어린이동화,"화제의 베스트셀러!어린이 판타지 1위!더욱 강력해진 과자로 돌아왔다!“오늘은 또 어떤 손님이 오실까나?”여전히 〈전천당〉은 소원을 들어주는 과자를 판다. 딸이 악몽에서 벗어나길 바라는 아빠, 가족들에게 귀염받는 동생이 되고픈 맏형, 주름살을 없애고픈 할머니 등 3권에서도 다양한 손님들이 각자의 소원을 가지고 전천당을 찾는다. 그러나 전천당과 손님들을 무서운 눈빛으로 노려보는 한 소녀가 있으니…. 소녀의 속셈은 무엇이고, 앞으로 전천당에서 어떤 일들이 벌어질까?","■ 화제의 베스트셀러, 국내외 어린이 판타지 1위《이상한 과자 가게 전천당》 시리즈는 2019년 한국에서 첫 출간을 하자마자 종합 베스트셀러 순위에 진입하고, 어린이 판타지 분야에서는 1위를 할 정도로 독자들에게 사랑을 받고 있다. 이 시리즈는 학원물과 탐정물이 주를 이루는 국내 어린이 판타지 시장에 마법과 환상, 스릴러 요소가 가미된 색다른 내용으로 한순간 독자들의 마음을 사로잡았다. 복잡하지 않은 이야기 구조와 매력적인 캐릭터, 과자 가게의 아이템, 그것을 운용하는 사람들의 이야기가 흥미진진하며 신선하게 다가온다.《이상한 과자 가게 전천당》에서 보여주는 인간의 욕심, 행복, 올바른 가치관을 추구하는 권선징악의 내용은 대중적이며 보편적인 주제라서 아이부터 어른까지 즐겁게 읽을 수 있다.  ■ 새로운 인물의 등장으로 풍성해진 전천당 이야기《이상한 과자 가게 전천당》 3권에서는 새로운 인물이 등장한다. 여덟 살 정도의 앳된 여자 아이. 그 소녀는 〈화앙당〉의 주인으로 전천당의 손님을 가로 채거나 전천당 손님과 화앙당 손님이 맞닥뜨리게 만들어 누구의 행운이 더 강한지 겨루게끔 한다. 평화로웠던 〈전천당〉에 의뭉스러운 이가 나타났음으로 인해 긴장감이 감돈다. 그 소녀는 누구이고, 왜 〈전천당〉과 주인 베니코 앞에 나타났을지 《이상한 과자 가게 전천당》 3권에서부터 새롭고 더욱 흥미진진한 이야기가 시작된다.  ■ 쉽고 빠른 전개, 흡입력 넘치는 스토리, 권선징악의 교훈까지 《이상한 과자 가게 전천당》은 문장 호흡이 짧고 군더더기 없이 깔끔한 문체를 가졌다. 옴니버스 형식으로 구성되어 있고, 전개가 빠르며 흡입력이 강해 단숨에 읽어 내려간다. 몰입도가 높고 내용은 흥미진진하여 마치 애니메이션을 보는 듯한 착각을 불러일으킬 정도다. 이 책이 갖고 있는 이야기의 힘은 독서력이 부족한 아이들에게 징검다리 역할을 한다. 또한 웹소설 및 모바일에 익숙한 아이들도 한 번 읽기 시작하면 뒷내용이 궁금하여 멈추지 않을 정도로 재미있게 읽는다. 《이상한 과자 가게 전천당》은 재미와 흥미, 그 이상의 가치를 남긴다. 행운의 과자를 손에 넣었어도 자신이 어떻게 활용하느냐에 따라 그 결말은 상당히 달라진다. 내가 바라는 행운, 그리고 그 행운을 둘러싼 나의 선택과 행동들에 권선징악의 결말이 더해져 독자들에게 교훈과 생각할 거리를 건넨다."
수상한 화장실(북멘토 가치동화 38),박현숙,9.6점, 15,어린이,,,"박현숙 작가의 훨씬 더 수상한 이야기이번엔 『수상한 화장실』로 돌아왔다!학교 화장실에서 시작된 무시무시한 소문 소문을 낸 범인은 누구일까?소홀해지기 쉬운 것에 관심을 쏟고, 누구보다 아이들의 성장을 응원하는 박현숙 작가의 ‘수상한 시리즈’가 돌아왔다. 이번엔 『수상한 화장실』이다.남들이 들을까 조심조심 비밀 이야기를 하기에 안성맞춤인 화장실! 그 화장실에서 은밀히 주고받은 이야기가 밖으로 새어 나간다면 어떤 일이 벌어질까? 전교 회장 선거를 앞두고 “전교 회장이 되는 사람은 큰일 난다. 이 말을 소문내는 사람도 큰일을 피하지 못한다.”라는 소문이 돌기 시작한다. 그러다 화장실 귀신의 저주가 시작되었다는 태풍급 소문까지! 동호는 정말 간절히 전교 회장이 되고 싶지만 소문이 무서워서 벌벌 떤다. 등 떠밀리듯 후보가 된 여진이는 과학적 근거가 없다며 애써 무시하지만 찜찜한 건 어쩔 수가 없다. 사퇴를 하자니 책임감 없는 사람이 될 것 같고, 과학적 근거도 없는 귀신을 믿는 것도 자존심 상한다. 이러다 후보들이 다 사퇴하고 덜컥 전교 회장이 되면 어떡하지? 여진이의 불안감도 쑥쑥 커진다. 여진이네 학교의 전교 회장 선거는 무사히 치를 수 있을까? 도대체 화장실 귀신 소문은 누가, 무슨 이유로 퍼뜨린 걸까?","소문의 진실과 거짓을 가려내는여진이의 지혜와 용기!여진이네 학교에 퍼진 소문은 3층 화장실에서 시작되었다. 누구 입에서 시작된 건지, 소문이 진실인지 거짓인지 아는 사람은 아무도 없었다. 그럼에도 파급력은 핵폭탄급이다.과학적인 근거를 앞세우며 귀신이 있다, 없다를 놓고 입씨름을 하던 아이들도 축구하다가 전교 회장 후보 세 명이 한꺼번에 다치자 겁을 집어먹는다. 그러던 중 발행되지도 않은 교내 신문에 ‘화장실 소문의 범인이 영호’라고 쓰였다는 소문이 돈다. 아무리 영호가 아니라고 해도 소용없다. 영호는 기사를 쓴 송진이를 직접 만나 따져 묻지만, 송진이는 제보자를 보호해야 한다며 입을 꾹 닫는다. 정말 영호가 소문을 낸 게 사실일까? 송진이는 영호가 범인이라는 정보를 누구한테 듣고 기사를 쓴 것일까?긴장감 넘치는 사건을 따라가다 보면 눈에 보이지 않는 ‘소문’이 어떻게 만들어지고, 어떤 과정을 통해 엄청난 힘을 갖게 되는지 알게 된다. ‘화장실 귀신’ 소문은 점점 부풀려져 의혹을 키우고, 결국 진실 공방으로 치닫게 된다. 여진이와 친구들의 치열한 진실 공방을 통해 어린이 독자들은 진실과 거짓을 가려내는 지혜의 나침반을 얻게 될 것이다. 아이들은 누군가 보내는 믿음을 통해 잘못된 것을 바로잡을 수 있는 용기를 얻고, 성장한다‘수상한 시리즈’는 긴장감 넘치는 사건과 흥미진진한 반전, 그리고 사건을 해결하는 아이들의 마음 성장을 지켜볼 수 있다는 게 가장 큰 장점이다. 『수상한 화장실』 역시 이 틀을 따라가며, 재미와 감동과 함께 ‘소문’이라는 주제를 풀어낸다. 소문은 한 번 돌기 시작하면 어마어마한 마력을 갖게 된다. 그 안에서 진실은 하나도 중요하지 않다. 자극적인 것만 남아서 사람들 사이를 할퀴고 상처를 낼 뿐이다. 그럼에도 불구하고 『수상한 화장실』은 마지막 장을 덮는 순간 마음에 따뜻한 위로와 치유를 남긴다. 쉽게 소문에 휩쓸리기도 하지만 그 안에서 진실을 찾기 위해 고민하고, 또 진실을 찾았을 때 바로잡기 위해 고군분투하는 여진이의 성장기는 어린이 독자들의 마음을 한 뼘 더 성장하게 할 것이다."
