title,author,score,num_reviewers,main genre,middle genre,subclass,introduction,review"EBS 수능특강 과학탐구영역 생명과학1 2021학년도 수능연계 교재,2020",EBS,0.0점, 0,학습/참고서,고등학교,수능문제집,"021학년도 대학수학능력시험 준비의 시작은 EBS 수능특강으로!2021학년도 수능 시험을 대비하는 수험생이라면 꼭 봐야 할 교재1. 새 교육과정(2015 개정 교육과정) 및 교과서 분석을 통한 핵심 내용 제시: 과목별 교육과정의 핵심 내용을 제시함으로써 2021학년도 수능에 대비한 탄탄한 기초 확보2. 수능형 연습 문제를 통한 수능 유형 익히기: 최근 수능의 트렌드와 특징, 신유형을 잘 반영한 엄선된 수능형 연습 문제를 통해 2021학년도 수능을 완벽하게 대비!3. 참신한 실전 문제를 통한 수능 대비 실력 점검: 교육과정에 따른 체계적인 교과 내용 분석과 이를 최적화한 필수 실전 문제를 통해 실력 점검·실전 감각 향상4. 잘 알고 있는 내용은 더욱 완벽하게 다듬고, 부족한 부분은 확실하게 보강!: 단원별로 확실한 개념 설명 및 적용 문제가 제공되어, 학습자 본인의 강·약점을 자연스럽게 파악하고, 이를 스스로 강화하고 보완하는 것이 가능5. 학습 편의성을 높이기 위한 학습 자료 서비스, 완벽 분석 무료 강의!한눈에 보는 정답 서비스, 영어영역 단어장부터 최고의 강사진이 함께하는 수능특강 강의까지 EBSI 홈페이지(WWW.EBSI.CO.KR)를 통해 제공+ 지문·문항·자료 분석력, 어휘력 UP 프로젝트 -  수능특강을 공부하는 가장 쉽고 빠른 방법: 수능특강 사용설명서 (13책), 수능연계교재의 VOCA 1800 동시 발행!",
고등 과학탐구영역 지구과학1 만점마무리 봉투모의고사(2020)(2021 수능대비)(EBS) 2021학년도 수능 대비 모의고사,EBS,0.0점, 0,학습/참고서,,,"수능 실전 대비는 완벽하게! 진짜 수능을 미리 경험한다!기출 학습으로는 부족한 2015 개정 교육과정 첫 수능에 맞는 100% 신규 문항 수록1. 수능 시험지와 동일한 시험지 형태로 실제 시험 현장을 그대로 경험하는 실전 학습!6월 모의평가 분석 결과 및 최신 출제 경향 반영으로, 9월 모의평가와 수능 대비 단기 실전 학습을 할 수 있습니다.2. OMR카드로 실전 감각 향상!OMR카드가 동봉되어 있어 마킹시간까지 체크해 보며 나만의 실전 감각을 익힐 수 있습니다.3. 모르거나 헷갈리는 문항은 EBSI 베테랑 선생님의 강의와 함께 쉽게 해결! 실제 수능과 가장 유사한 시험 직전 최종 모의고사 ‘만점마무리 봉투모의고사’국어, 영어, 수학 가형, 수학 나형, 한국사, 생활과 윤리, 사회·문화, 화학Ⅰ, 생명과학Ⅰ, 지구과학Ⅰ (10책)+실전 학습이 더 필요하다면 〈EBS 모의고사 시리즈〉를 만나보세요.① FINAL 실전모의고사 (5월 출시)② 만점마무리 봉투모의고사 (7월 출시)③ 고난도 시크릿X 봉투모의고사 (9월 출시)④ 만점마무리 봉투모의고사 RED EDITION (10월 출시)흔들리지 않는 수능 자신감, EBS가 함께합니다.","수능 실전 대비는 완벽하게! 진짜 수능을 미리 경험한다!기출 학습으로는 부족한 2015 개정 교육과정 첫 수능에 맞는 100% 신규 문항 수록1. 수능 시험지와 동일한 시험지 형태로 실제 시험 현장을 그대로 경험하는 실전 학습!6월 모의평가 분석 결과 및 최신 출제 경향 반영으로, 9월 모의평가와 수능 대비 단기 실전 학습을 할 수 있습니다.2. OMR카드로 실전 감각 향상!OMR카드가 동봉되어 있어 마킹시간까지 체크해 보며 나만의 실전 감각을 익힐 수 있습니다.3. 모르거나 헷갈리는 문항은 EBSi 베테랑 선생님의 강의와 함께 쉽게 해결! 실제 수능과 가장 유사한 시험 직전 최종 모의고사 ‘만점마무리 봉투모의고사’국어, 영어, 수학 가형, 수학 나형, 한국사, 생활과 윤리, 사회·문화, 화학Ⅰ, 생명과학Ⅰ, 지구과학Ⅰ (10책)+실전 학습이 더 필요하다면 [EBS 모의고사 시리즈]를 만나보세요.① FINAL 실전모의고사 (5월 출시)② 만점마무리 봉투모의고사 (7월 출시)③ 고난도 시크릿X 봉투모의고사 (9월 출시)④ 만점마무리 봉투모의고사 Red Edition (10월 출시)흔들리지 않는 수능 자신감, EBS가 함께합니다."
마더텅 수능기출 모의고사 33회 국어 영역 2021 수능대비,마더텅 편집부,0.0점, 1,학습/참고서,고등학교,수능문제집,"2020~2010학년도 최신 11개년 수능, 6 ㆍ9월 모의평가 33회 1485문항 수록전 문항 첨삭 해설 제공, 전 문항 정답률 표기, 자가 진단을 위한 회별 등급컷 제공1) 시험 당일 실제상황과 동일한 환경에서 33번 반복 연습 가능 - 실제 시험지 모양을 그대로 재현 - 실제와 똑같은 OMR 카드 제공 - 시험장 상황을 체험할 수 있는 안내방송 MP3 제공 2) 연도별(회별) 기출문제집 중 최다 구성 33회분!! - 11개년 수능 및 모의평가 기출문제 수록 - 지문 내용을 한눈에 요약·정리하는 모식도 및 시각 자료 제시- 전 문항 첨삭 해설 제공 - 전 문항 정답률 표기 - 오답률이 높았던 문항은 매력적 오답까지 표기- 자가 진단을 위한 회별 등급컷 제공",1) 시험 당일 실제상황과 동일한 환경에서 33번 반복 연습 가능 - 실제 시험지 모양을 그대로 재현 - 실제와 똑같은 OMR 카드 제공 - 시험장 상황을 체험할 수 있는 안내방송 MP3 제공 2) 연도별(회별) 기출문제집 중 최다 구성 33회분!! - 11개년 수능 및 모의평가 기출문제 수록 - 지문 내용을 한눈에 요약·정리하는 모식도 및 시각 자료 제시- 전 문항 첨삭 해설 제공 - 전 문항 정답률 표기 - 오답률이 높았던 문항은 매력적 오답까지 표기- 자가 진단을 위한 회별 등급컷 제공
"신사고 쎈 중등 수학 1 (하) 새교육과정,2018",홍범준,0.0점, 5,학습/참고서,중학교,중1 문제집,"- 독자대상 : 중학 수학1 학습자- 구성 및 특징 : 1. 전국 중학교 내신 기출 문제 총정리2. 2015 개정 교육과정 문제 수록3. 모든 문제를 A, B, C 3단계 난이도로 구성","1. 전국 중학교 내신 기출 문제 총정리2. 2015 개정 교육과정 문제 수록3. 모든 문제를 A, B, C 3단계 난이도로 구성 '2,500만부 돌파, 베스트셀러 문제기본서 쎈'내신에 나오는 모든 문제가 다 들어 있는 “문제 기본서 쎈”쎈은 개념 학습 이후의 수학 학습 방법으로 유형별 문제 학습을 선도적으로 제안하며 등장하여 항상 최고의 자리를 지키고 있는 수학 문제 기본서의 대표 주자입니다. 문항 분석 방법, 보유하고 있는 방대한 데이터 베이스와 인프라가 매년 유사 교재들이 범람하는 속에서도 쎈이 최고의 자리에 있는 이유입니다. 쎈의 유형 분석과 문제 해결 방법은 어떤 유사 교재도 따라올 수 없는 특별함이 있습니다. 특히 2015 개정 교육과정에서 강조하는 수학 역량을 기를 수 있는 “창의 문제”를 구성하여 새로운 교육과정에서도 문제 기본서로서의 입지를 공고히 하였습니다."
고등 수학 가형 이해원 봉투모의고사 시즌3(2021) 2021 수능대비,이해원,0.0점, 0,학습/참고서,,,시대인재북스&오*비북스 누적 독자 수 1위 수학모의고사2015 오*비북스 수학 모의고사 1위2016 오*비북스 수학 모의고사 1위 2017 오*비북스 수학 모의고사 1위 2018 오*비북스 수학 모의고사 1위 2019 시대인재북스 수학 모의고사 1위2020 시대인재북스 수학 모의고사 1위- 이해원 모의고사는 가장 많은 수험생들이 선택했던 모의고사입니다. - 이해원 수학연구소는 수학 및 수학교육 전문가로만 구성된 수학 컨텐츠 전문회사입니다.- 이해원 수학연구소는 끊임없는 연구를 통해 최고효율&최고퀄리티의 컨텐츠를 제작합니다,시대인재북스&오*비북스 누적 독자 수 1위 수학모의고사2015 오*비북스 수학 모의고사 1위2016 오*비북스 수학 모의고사 1위 2017 오*비북스 수학 모의고사 1위 2018 오*비북스 수학 모의고사 1위 2019 시대인재북스 수학 모의고사 1위2020 시대인재북스 수학 모의고사 1위- 이해원 모의고사는 가장 많은 수험생들이 선택했던 모의고사입니다. - 이해원 수학연구소는 수학 및 수학교육 전문가로만 구성된 수학 컨텐츠 전문회사입니다.- 이해원 수학연구소는 끊임없는 연구를 통해 최고효율&최고퀄리티의 컨텐츠를 제작합니다. - 모의고사 시리즈 안내 시즌1: 3회분 (6월 출간)시즌2: 3회분 (8월 출간)시즌3: 3회분 (9월 출간)FINAL: 2회분 (10월 출간) - 시즌 안내http://bitly.kr/nvfLNR5WF4K
"너를 영어1등급으로 만들어주마 재수시절 한맺힌 연구, 그 비밀 기록",서림,10.0점, 5,학습/참고서,고등학교,수능문제집,"추상적인 수능 영어 독해에 관한 해결책을 제시하다.""이 책은 그냥 공부법 책이 아니다. 수많은 1등급을 만들어낸 저자가 직접 당신에게 과외를 해주고자 만든 책이다. "" 〈너를 영어1등급으로 만들어주마〉는 저자가 재수시절 아무리 해도 오르지 않던 영어에 대해 한을 품고 연구했던 그 비밀노트의 기록이다. 어떤 스타강사의 인강으로도 해결되지 않는 ‘3등급의 굴레’를 절감하고, 영어를 정면으로 돌파하기로 마음먹은 저자는 독하게 영어를 연구하기 시작했다.   스무 살 그녀의 독방에서 이루어진 피땀 어린 통찰. 그리고 깨달은 해답은 두 가지였다. 첫째는 제대로 된 유형별 접근법을 익히는 것. 완전히 정형화되어 있다고 해도 무방한 수능 영어 문제들은 무턱대고 읽는 것이 아니라 유형별로 된 올바른 접근법이 필요했다. 이것은 수능 영어를 공부하는 누구나 생각했던 일이지만, 생각보다 제대로 접근법을 알려주는 사람도 책도 없었다. 저자는 ‘밑바닥까지’ 연구했고 9월 모의고사 이 후 직접 모든 유형에 대한 완벽한 바이블노트를 완성한다.   그런데 또 한 가지 더 큰 문제가 있었다. 바로 ‘안 읽힌다’는 문제. 단어를 외우고 문법을 공부해도 그것의 조합으로 해석하기엔 28문제 45분은 턱없이 부족한 시간이다. 미친 듯이 추상적이라 해석을 해도 모르겠다. 게다가 시간이 부족하니까 훑어 읽는다. 결국 시험시간엔 소설을 쓴 건지 해석을 한 건지 모르겠다는 느낌으로 풀어낸다. 그러면 계속 3등급이 나오는 것이다. 여기서 단어를 더 외우고, 구문독해를 더 공부해도 문제는 해결되지 않는다. ‘열심히 공부한 3등급’이 될 뿐이다.  영어 자체가 안 읽히고 다 튕겨져 나가는 것을 어떻게 막을 것인가? 수능이 채 50일도 남지 않았던 무렵, 우연인지 운명인지, 저자는 발견했다. 한 달 만에, 저자는 어떤 시험지든 풀었다 하면 1등급, 만점을 쟁취한다. 그리고 교대 입학. 저자는 본인과 같은 사례를 계속해서 만들어 낸다. 이제 누구든 영어 1등급을 만들어줄 자신이 생겼다.   수능 영어, 이제 어떻게 해야 할지 모르겠는가?  당신도 예전의 그녀처럼 어떤 굴레에 빠졌는가? 계속 인강을 들을 것인지 이 책을 읽을 것인지 잘 생각해보라. 이제 그 비밀 노트를 공개한다!","“종이책 출간 축하드립니다! 영어가 절대평가라 다행이에요, 상대평가였으면 이 책을 읽고 다 올랐을 생각에 마냥 축하드릴 수 없었을 거예요”   〈영일만〉은 전자책으로 시작한 책입니다. 세상에 없던 방법, 글로 전하는 이 영어 과외책에 대한 독자들의 반응은 어떨지 궁금한 마음에 시범판매를 시도한 것입니다. 그렇게 이 책은 정식 홍보도 없이 퍼져나갔습니다. 그렇게 한달 반, ‘영어를 읽는 것이 완전히 바뀌었다’, ‘구원자다’, ‘시간 없어서 하루 1지문밖에 못 따라 했는데 1등급이 나왔다’, ‘영어가 한글처럼 읽히는 느낌이다’, ‘서점에 정식으로 출간할 생각은 없느냐’ 등 예상하지 못했던 극찬 후기를 받았고, 성원에 힘입어 이렇게 종이책으로 정식 출간을 시작합니다.  그리고 또 한가지 철학이 있다면 영어를 1등급 만들어주겠다고 해놓고 영어만 공부하라는 무리한 것을 요구하지 않는 것입니다. 백과사전식으로 두껍게 만들어놓고 ‘모두 공부해봐’라고 하는 것도 아닙니다. 당신은 처음부터 끝까지 공부한 영어책이 있나요? 영일만은 최대한 얇게 만든 책입니다. 그러나 치밀하게 구성된 책입니다. 읽고 나면 하루만에도 영어를 읽는 것이 무엇인지, 제대로 된 문제풀이는 무엇인지 느끼실 수 있을 것입니다. 전체 1독 후, 2독부터 가지고 다니시며 적용 연습하는 것을 추천 드리며, 저는 2달 2시간을 제안합니다. 그러나 심리적인 것을 극복하게 해주기 때문에 1달도 안되어 1등급으로 오른 된 독자들도 많습니다.    성공의 과정은 투명해야 합니다. 노력에는 성과가 보상되어야 합니다. 메리포핀스 출판사는 ‘타고난 1등급’이 아닌 당신의 편에 설 것입니다. 우리 출판사의 첫 책 〈너를 영어1등급으로 만들어주마〉는 그 어떤 인강보다 실질적으로 당신의 수능 영어 영역을 바꿀 것입니다."
"EBS 중학 뉴런 수학 1 (상) 2020,세상에 없던 새로운 공부법",EBS 편집부,10.0점, 18,학습/참고서,중학교,중1 문제집,"- 독자대상 : 중학생- 구성 및 특징 :① 중학교 교육과정의 학습개념을 모두 담아냄 개념서② 방송, 모바일 등 언제 어디서나 학습할 수 있어 자기주도학습 능력을 키움③ 예습, 복습 가능",
닭치고 서울대 전공적합성 공부로 진로 찾은 아이들,봉쌤,0.0점, 1,인문,,,"★ 예약판매 첫날부터 온라인 서점 청소년 분야 베스트 ★★ 입소문으로 베스트셀러가 된 화제의 책! ★★ 수험생 시절을 먼저 보낸 선배들의 열렬한 추천! ★★ 예비 수험생 아빠 엄마들의 폭발적인 공감과 찬사! ★2020년 10월 15일부터 2주간 온라인 서점에서 《닭치고 서울대》 예약판매가 시작되었다. 그런데 예상치 못한 이변이 일어났다. 하루 만에 예스 24 청소년 분야 베스트에 진입하고, 뒤를 이어 알라딘과 교보문고에서도 판매량이 무섭게 치솟았다. 비결이 무엇일까? 예약판매 시작 전부터 저자의 제자들이 모여서 몇 군데의 교육 정보 커뮤니티에 뽕샘의 책이 출간된다고 글을 올렸다. 이후에는 한두 엄마가 입소문을 내기 시작하더니 금세 수십 명의 ‘뽕샘 응원 엄마 홍보단’이 결성되었다.   저자는 매우 고전적인 방법으로 이 책을 알렸다. 불닭 옷을 입고 거리로 나간 것이다. 주위 사람들의 만류에도 아랑곳하지 않고, 장난감 기타를 치며 “닭~치~고 서~울~대” 노래를 불렀다. 탑차 전면을 책 표지와 유사하게 도배하고, 제목을 세로로 새긴 현수막을 붙인 채 불닭 옷을 입고 전단을 나눠 주는 선생님. 왜 이렇게까지 하냐고 물었더니 “전공적합성을 알리려고요! 그래야 우리 애들이 행복해요!”라고 꿋꿋하게 대답하는 뽕샘. 엄마들은 이러한 저자의 진정성이 마음을 움직였다고 말했다.    이처럼 오로지 수험생 시절을 먼저 보낸 제자들과 학부모들의 입소문으로 출간 전부터 화제의 베스트셀러가 된 이 책. 《닭치고 서울대》에는 과연 어떤 이야기가 실렸을까?   입시 전문가이기도 한 뽕샘이 수험생의 건강 다음으로 강조하는 것이 전공적합성 공부다. 이전의 학생부 종합 전형은 학업 역량, 전공적합성, 발전 가능성, 인성의 네 가지를 다면평가 방식으로 진행해 왔다. 앞으로는 발전 가능성과 인성 부분은 약화되고 학업 역량과 전공적합성은 매우 강화된다. 기존에는 네 가지 영역이 모두 중요했는데 두 가지가 약화되었으니 전공적합성이 더욱 중요해진 것이다. 학업 역량은 내신 등급이라 숫자로 정확하게 나오는 것이며 평가 방법이 정해져 있다. 결과적으로 대학에서 요구하는 인재를 선발하는 가장 핵심적인 요소가 전공적합성이 된 것이다.  뽕샘은 전공적합성 공부를 하면 목표가 명확해져서 진로 찾는 과정이 재미있고 즐거워질 것이라고 설명한다. 자신의 진로적성을 탐색하여 전공과 관련한 분야에 집중하다 보면 내가 지금 이 공부를 왜 해야 하는지 이유가 분명해지기 때문이다. 당연히 관련 교과목에 더욱 흥미가 생겨서 스스로 공부하고 싶어진다.    이 책은 프롤로그에서 현재 대한민국 교육 정책에 발맞춘 전공적합성의 개념을 정리했다. PART 1에서는 학습 전반을 내 진로의 특성과 연계하는 공부법을 소개한다. PART 2에서는 원하는 대학과 학과에 합격할 수 있는 구체적인 방법을 속속들이 공개한다.   예비 수험생(초5~고2)은 물론 학부모와 진로 교사들에게 꼭 필요한 교육 정보서 역할을 톡톡히 할 것이다.","이 책을 꼭 청소년과 부모가 함께 읽어야 하는 이유!① 공부, 입시보다 중요한 건 건강! 지금 수험생의 몸 상태가 어떤지 살피게 한다.  ② ‘말만 들어도 가슴 설레는 그 무엇’을 발견해서 마음으로 공부하게 만든다.③ 대한민국 교육계의 흐름에 맞춘 전공적합성! 몰랐던 부분까지 낱낱이 공개했다.④ 전공적합성 응용 요령을 포함해 현실적인 공부법·대입 전략을 콕콕 짚었다. ⑤ 수험생은 물론 그 곁을 지키는 부모의 마음까지 따뜻하고 위트 있게 위로한다.  이 책을 먼저 읽은 한 엄마는 “‘잠은 잘 자니?’로 시작하는 프롤로그부터 찌릿찌릿하다고 했다. 아이들의 마음 쓰다듬기를 어떻게 해야 하는지 도입부에 바로 제시하고 있는 점이 전율을 일으켰다는 것이다. 뽕샘은 25년간 만나 온 수험생들을 관찰한 결과 뜻밖으로 성적 부진의 가장 큰 원인은 잠과 밥과 화장실 문제에 달려 있다고 밝혔다. 공교롭게도 전교 1등생들은 변비가 없다는 공통점이 있었다는 것. 짧게 자더라도 숙면을 취해서 피부도 좋고, 소식을 하기는 해도 굶거나 인스턴트식품만 먹는 일은 없었다. 그러니 수험생을 둔 부모는 최신 입시 정보와 공부법을 자녀에게 숙지시키려고 할 것이 아니라, “잠은 잘 자니?” “오늘 저녁엔 뭐 먹고 싶니?” “변비로 고생하고 있지는 않니?”부터 물어보는 것이라고 당부한다. 이 부분을 읽고 대다수의 부모는 오늘 저녁에 당장 수험생 자녀의 건강 상태를 체크하게 될 것이다.  스무 편의 에세이에 등장하는 스물세 명의 아이들은 뽕샘과 상담해서 말만 들어도 가슴 설레는 그 무엇을 발견해서 온 마음으로 공부할 수 있었고, 마침내 원하는 진로를 찾았다. 공부는 억지로 해서는 절대 기대하는 성과를 내기가 어렵다. 마음속에 맺힌 것을 풀고, 하고 싶다는 계기를 마련해 줄 때 비로소 시작되는 것이 공부다. 25년간 마음으로 공부하는 방법을 지도해 온 뽕샘은 PART 1의 경안이 이야기를 실례로 들며, 〈뽕샘의 공부법 콕콕-마음 안아 주기〉에서 어떻게 하면 마음속에 맺힌 걸 풀고 공부를 시작할 수 있는지 친절하게 안내한다.    전공적합성의 힘이 얼마나 대단할까? 닭이나 뱀을 좋아해도 얼마든지 명문대에 갈 수 있고, 원하는 진학을 수 있다. 몰입과 자기주도학습, 단순화 원리를 깨닫게 하고, 3단계 Why 공부법을 알려 준다. 이 책은 막연하게 알고 있던 전공적합성 공부의 힘을 느끼게 해 주어 결국 수험생인 나에게 적용하도록 유도한다. 또한, 흔히 알고 있는 전공적합성의 기본 개념에서 나아가 응용 요령까지 보여 준다. 일례로, PART 2의 해리의 사연 ‘심리학도가 사관학교를 만났을 때’는 대표적인 전공적합성 응용 사례다. 심리학에 미쳐 있던 해리가 심리전이 매우 중요한 여군의 길을 가게 된 과정은 전공적합성을 유효적절하게 이용한 매우 노련한 대입 전략이었음을 짚어 준다.   마지막으로 이 책은 먼저 읽어 본 많은 아빠 엄마들이 “단순히 공부법·입시 전략서인 줄 알고 읽었다가 눈시울을 적셨다”고 했을 만큼 감동적이다. 스물세 명의 주인공 옆에는 항상 그들의 부모가 있었다. 진로 찾기 위해 애쓰는 수험생보다 더 힘들고 애잔한 대한민국 수험생의 부모들을 뽕샘은 따뜻하고 위트 있게 위로한다.   미리 보기 카툰으로 재미 요소를 더하고  초판 한정 〈학습·진로 상담권〉 으로 뽕샘에게 상담 받을 기회까지!  이 책의 드라마틱한 진로 찾기 실화 중에서 다섯 아이의 사례로 예고편 〈미리 보기 카툰〉을 만들었다. 카툰으로 재탄생한 주인공들의 이야기는 보는 맛과 호기심을 유발한다. 사전에 몇몇 수험생들에게 선보였더니 반응이 좋아서 목소리를 직접 넣어 동영상으로도 만들었다. 짧지만 유독 기억에 남을 재미 요소다.   “10대 때, 뽕샘을 만나 내 삶에 혁명이 일어났다”고 말한 수험생 시절을 먼저 보낸 선배나, 일찌감치 전공적합성에 대해 자녀와 함께 준비해 온 학부모와 같은 분이 많아서 초판 한정 〈뽕샘의 학습·진로 상담권〉을 증정하기로 했다. 이 책의 띠지 뒷면에 상담권과 예약하는 방법이 적혀 있다. 상담을 받을 때는 반드시 이 띠지가 있는 책을 가지고 뽕샘을 만나야 한다. 예약 기간은 2021년 3월 31일까지! 특히 중3을 맞이하는 예비 수험생이라면, 이 책의 PART 2 정헌이의 이야기에서 짚은 〈뽕샘의 대입 전략 콕콕-중3 겨울방학을 놓치지 마라〉에서 당부한 내용을 읽어 보고 상담권을 적극적으로 활용할 것을 권한다. 현재 뽕샘은 자체적으로 운영하는 법인학원 수강생들에 한해서만 학습·진로 상담을 하고 있다. 이번에 《닭치고 서울대》 초판본을 구입한 독자에게까지 상담의 문이 열렸으니 망설이지 말고 이 기회를 꼭 잡자. 이 이벤트는 초판에 한정하며 2쇄부터는 띠지가 사라진다."
EBS 수능완성 과학탐구영역 지구과학 1 (2020년) 2021학년도 수능 연계교재,EBS(한국교육방송공사),0.0점, 0,학습/참고서,,,"2021학년도 대학수학능력시험 연계율 70%!서울 소재 대학교에 진학한 선배들 중 정시 98%, 수시 92.4%가 선택한 EBS 수능완성!*합격한 선배들이 데이터로 입증한 연계교재 'EBS 수능완성'의 힘12월 3일 수능, 직접 느낄 수 있습니다. 1. [유형편]으로 영역별 유형 이해를 점검2015 개정 교육과정 첫 수능에 맞추어 영역별 기본적으로 알아 두어야 할 출제 유형을 풀어 보며 스스로 취약한 문제 유형이 무엇인지 쉽게 파악할 수 있습니다. 자세한 유형 설명과 정답 해설로, 보다 정확한 유형 이해가 가능합니다.2. [실전편]으로 실전 능력 UP최근 대학수학능력시험 및 모의평가 문항을 철저하게 분석하여 실전과 가장 가까운 문항을 수록하였습니다.실전처럼 구성된 ""5회분의 실전 모의고사""로 실전 감각을 키울 수 있습니다. +기출로 부족한 2015 개정 교육과정 첫 수능!실전 학습이 더 필요하다면 〈EBS 모의고사 시리즈〉를 만나보세요.① FINAL 실전모의고사 (5월 출시)② 만점마무리 봉투모의고사 (7월 출시)③ 고난도 시크릿X 봉투모의고사 (9월 출시)흔들리지 않는 수능 자신감, EBS가 함께합니다.*설문 결과: 서울 소재 대학생 1000명 대상 설문조사 (한국리서치, 2019)",
