title,author,score,num_reviewers,main genre,middle genre,subclass,introduction,review
매일 만들어 먹고 싶은 식사빵 맛있는 빵을 실패 없이 만드는 딸공쌤의 베스트 레시피 20,딸공 최지은,0.0점, 3,가정/생활/요리,요리,,"매일 먹어도 질리지 않고, 그대로 먹어도 맛있고, 어떤 요리와도 잘 어울리는 ‘식사빵’기본 재료, 간단한 도구, 쉽고 정확한 조리법으로 유명한 인기 베이킹클래스 401레시피의 시그니처 빵 20가지한국인의 힘은 밥심! 이라고들 하지만 이제는 그 또한 옛말이지요. 하루 세 끼를 모두 챙겨 먹는 이들을 찾기도 힘들지만, 매 끼니 ‘밥’으로 먹는 것은 더욱이나 불가능하고요. 그러다 보니 간단하면서, 간편하고, 하지만 맛과 멋은 있어야 하는 한 끼를 찾는 이들이 늘고 있답니다. 그중 하나의 대안이 바로 식사로 할 수 있는 빵, ‘식사빵’입니다. 그렇다면 식사빵이란 무엇일까요?매일 먹어도 질리지 않고, 우유나 커피와 함께해도 맛있고, 과일, 치즈 정도만 곁들여도 푸짐하고, 수프나 스튜, 카레, 샐러드 등 요리와도 잘 어울리는 빵-이라고 정의할 수 있지요.흔히들 떠오르는 식빵, 모닝빵이 대표적인 식사빵이지만, 이런 평범한 것들 말고 조금 새롭고, 그렇지만 집에서 내 손으로 만들 수 있는 맛있고 간단한 식사빵 레시피가 필요하지 않나요?〈매일 만들어 먹고 싶은 식사빵〉에는 서래마을 인기 베이킹클래스 401레시피 딸공쌤의 시그니처 식사빵 레시피 20개를 담았습니다. 현미밥빵, 우유 크림빵, 시금치 치아바타 등, 다른 곳에서는 배울 수 없는 그런 빵들입니다.딸공쌤은 철저히 집에서 빵을 만드는 홈베이커를 위한 빵을 소개하는 것으로 잘 알려져 있어요. 업장(빵집)처럼 재료들을 빠른 시간 내에 소모할 수 없으니 최소한의 친숙한 재료만 사용하고, 우리 가족이 먹을 거니까 채소(브로콜리, 양파, 당근)나 과일, 건과일, 견과류와 같은 좋은 것들을 듬뿍 더하고. 또 고가에다가 공간 차지를 많이 하는 발효기나 틀과 같은 도구가 없어도 만들 수 있는 레시피이지요. 게다가 빵 만드는 일이 노동이 되지 않도록 3시간만 투자해도 쉽고, 간단하고, 맛있게 식사빵을 만드는 것에 중점을 두었답니다. 덕분에 401레시피는 수업 공지가 올라가면 순식간에 마감이 될 정도로 늘 인기가 있지요.레시피뿐만 아니라 집에서 빵을 만들기 위해 알아둘 기본 재료, 도구 이야기부터 식사빵을 더 맛있게 먹는 법이라든지 빵 예쁘게 써는 방법, 어울리는 추천 재료(치즈, 채소, 햄 등)까지- 이 한 권이면 내 손으로, 직접 빵을 만들어서 맛있는 한 끼를 즐길 수 있을 거예요.","그렇다면 식사빵이란 무엇일까요?매일 먹어도 질리지 않고, 우유나 커피와 함께해도 맛있고, 과일, 치즈 정도만 곁들여도 푸짐하고, 수프나 스튜, 카레, 샐러드 등 요리와도 잘 어울리는 빵-이라고 정의할 수 있지요. 흔히들 떠오르는 식빵, 모닝빵이 대표적인 식사빵이지만, 이런 평범한 것들 말고 조금 새롭고, 그렇지만 집에서 내 손으로 만들 수 있는 맛있고 간단한 식사빵 레시피가 필요하지 않나요? 『매일 만들어 먹고 싶은 식사빵』에는 서래마을 인기 베이킹클래스 401레시피 딸공쌤의 시그니처 식사빵 레시피 20개를 담았습니다. 현미밥빵, 우유 크림빵, 시금치 치아바타 등, 다른 곳에서는 배울 수 없는 그런 빵들입니다.딸공쌤은 철저히 집에서 빵을 만드는 홈베이커를 위한 빵을 소개하는 것으로 잘 알려져 있어요. 업장(빵집)처럼 재료들을 빠른 시간 내에 소모할 수 없으니 최소한의 친숙한 재료만 사용하고, 우리 가족이 먹을 거니까 채소(브로콜리, 양파, 당근)나 과일, 건과일, 견과류와 같은 좋은 것들을 듬뿍 더하고. 또 고가에다가 공간 차지를 많이 하는 발효기나 틀과 같은 도구가 없어도 만들 수 있는 레시피이지요. 게다가 빵 만드는 일이 노동이 되지 않도록 3시간만 투자해도 쉽고, 간단하고, 맛있게 식사빵을 만드는 것에 중점을 두었답니다. 덕분에 401레시피는 수업 공지가 올라가면 순식간에 마감이 될 정도로 늘 인기가 있지요. 레시피뿐만 아니라 집에서 빵을 만들기 위해 알아둘 기본 재료, 도구 이야기부터 식사빵을 더 맛있게 먹는 법이라든지 빵 예쁘게 써는 방법, 어울리는 추천 재료(치즈, 채소, 햄 등)까지- 이 한 권이면 내 손으로, 직접 빵을 만들어서 맛있는 한 끼를 즐길 수 있을 거예요. 이 책의 특징하루 한 끼 정도는 빵으로 식사하는 분들, 많으시죠?이 책은 하나만으로도 맛있는 식사가 되고, 다양한 재료나 요리에 곁들여도 잘 어울리는 집에서 만들기 좋은 식사빵 20가지를 소개했어요.식빵, 모닝빵은 이제 그만!현미밥빵, 우유 크림빵, 시금치 치아바타 등 다른 곳에서는 배울 수 없는 인기 베이킹클래스 ‘401레시피’의 시그니처 빵을 엄선했습니다. 또한 식사빵을 맛있게 즐기는 방법도 더했지요.‘홈베이커’를 위한 빵 레시피는 따로 있다!?틀이 없어도, 고가의 발효기가 없어도, 낯설거나 대량으로 구입해야 하는 어려운 재료가 없어도 집에서 3시간만 투자하면 되는 쉽고, 맛있고, 간단한 빵 레시피를 담았어요. 책을 보며 빵을 따라 만드는 것은 어렵다?!집에서 빵을 만들기 위해 알아야 할 기본 이론부터 레시피마다 상세한 설명과 과정 사진, 핵심 포인트까지 모두 알려드립니다.  내 손으로 만들어서 우리 가족이 먹을 거니까!브로콜리, 당근, 양파와 같은 채소부터 건과일, 견과류 등 몸에 좋은 재료를 듬뿍 더한 빵을 만나보세요. 맛도, 영양도 최고지요."
백종원이 추천하는 집밥 메뉴,백종원,0.0점, 4,가정/생활/요리,요리,테마별요리,"* 대한민국 NO.1 베스트셀러 요리책, 믿고 보는 〈백종원이 추천하는 집밥 메뉴〉 시리즈 4권을 한 권으로!* 백종원의 모든 집밥 레시피를 단 한 권으로 소장하고 싶은 당신을 위해,  《백종원이 추천하는 집밥 메뉴 애장판》 전격 출간* 1~4탄 백종원 집밥 레시피를 총망라한 합본 한정판  쉽고 간편한 백종원표 집밥 메뉴 217개를 이 한 권으로 모두 만나세요!국민 요리책, ‘백종원이 추천하는 집밥 메뉴’ 시리즈 합본 한정판!1~4탄 백종원의 집밥 레시피를 한 권에 총망라한 깜짝선물 같은 책손쉽게 구할 수 있는 식재료와 만능양념 등 간편하고 유용한 레시피로 요리를 전혀 못하는 사람들도 집에서 밥을 만들어 먹을 수 있도록 용기를 준 ‘백종원이 추천하는 집밥 메뉴’ 시리즈가 4권의 요리책으로 완결되었다. 4권의 책 모두 ‘집밥 열풍’을 불러일으키며 독자들의 큰 사랑을 받은 만큼, 그 성원에 보답하고자 ‘애장판’이라는 이름으로 합본이 출간되었다.《백종원이 추천하는 집밥 메뉴 애장판》은 ‘백종원이 추천하는 집밥 메뉴’ 4권을 한 권으로 모아 묶은 것이다. 밥, 국, 찌개, 반찬 등 일상적이면서 꼭 필요한 메뉴를 담은 1탄 《백종원이 추천하는 집밥 메뉴 52》, 만능간장으로 백종원표 만능시리즈의 시작을 알린 2탄 《백종원이 추천하는 집밥 메뉴 54》, 만능양념의 인기에 힘입어 만능된장, 만능오일, 만능고기소스 등의 만능시리즈 레시피를 다양하게 활용한 3탄 《백종원이 추천하는 집밥 메뉴 55》, 외식 부럽지 않은 다양한 메뉴와 함께 만능맛간장 활용 레시피를 담은 완결판 4탄 《백종원이 추천하는 집밥 메뉴 56》까지. 그간의 여정을 기록하는 의미를 담아, 총 217개의 백종원 집밥 레시피를 한데 합쳐 정리한 것이다. 그동안 4권의 책을 한 권으로 소장하고 싶다는 많은 독자들의 목소리가 있었던 만큼 이 책은 그야말로 깜짝선물 같은 특별함을 준다.“저만의 요리 노하우와 레시피가 모두 담긴 이 책 한 권이 여러분들의 식탁을 조금이나마 더 행복하게 해줄 수 있길” 바란다는 저자 백종원의 말처럼, 오늘도 나를 위해, 가족을 위해, 친구를 위해 요리할 당신에게 이 책이 요리의 즐거움을 알고, 맛을 즐기며 우리 모두가 행복해지는 데 작은 도움이 되기를 기대한다.",
튼이 이유식,정주희,0.0점, 20,가정/생활/요리,요리,테마별요리,"쌀가루, 큐브, 밥솥 칸막이를 활용한 최초의 이유식 책!엄마의 정성과 사랑이 듬뿍 담긴 이유식. 하지만 현실은 쉽지 않다. 이제 막 4개월 된 아기는 엄마에게 잠깐의 쉴 틈도 주지 않는다. 배고파서 울고, 기저귀 갈아달라고 울고, 졸려서 울고. 아기 돌보는 일만도 너무 어려운데, 이유식까지 만들 수 있을까? 대부분의 엄마들이 힘든 나머지 사 먹이는 쪽으로 선택한다. 하지만 아직 돌도 안 된 아기에게 사 먹이는 음식이 썩 마음에 내키지는 않는다. 그래서 엄마들이 찾아낸 이유식의 구세주, 희야 블로그(희야라이프). 쌀가루, 큐브, 밥솥 칸막이를 활용한 이유식 레시피는, 어려워서 도저히 따라할 엄두도 나지 않았던 기존 레시피들과는 완전히 달랐다. 희야 레시피만 있으면 하루에 두 끼, 세 끼를 먹이는 중기와 후기 이유식도 더 이상 두렵지 않다. 덕분에 희야 블로그는 700만 명의 엄마들이 매일매일 찾아드는 이유식의 성지가 되었다. 그 모든 내용을 고스란히 이 책에 담았다.파워블로거 희야가 알려주는 이유식의 신세계, 밥솥 칸막이 이유식!밥솥 칸막이가 뭐야? 생전 처음 들어보는 사람도 많다. 원래는 현미밥, 콩밥, 잡곡밥 등 여러 종류의 밥을 한 번에 만들기 위한 것이었다. 그런데 엄마들이 이유식에 활용하면서, 엄마들 사이에서 ‘밥솥 칸막이’는 이유식의 신세계를 선물해준 세상에서 가장 놀라운 발명품이 되었다. 인스타그램에는 #밭솥이유식 #밥솥칸막이 #밥솥이유식은신세계 #한번에3가지이유식 등 수천 개의 해시태그가 달린 포스팅을 쉽게 발견할 수 있다. 그만큼 엄마들에게는 이유식의 늪에서 탈출하게 해준 매우 고마운 이유식 아이템이 되었다. 더불어 세상 쉽고 맛있는 이유식 레시피를 알려준 파워블로거 희야는 엄마와 아이에게 더 풍요롭고 행복한 시간을 선물해준 은인과도 같은 존재이다.#밥솥이유식 #쌀가루 #이유식의꽃_큐브 #이유식의신세계_밥솥이유식 #희야밥솥레시피 #튼이이유식 #밥솥이유식_편하다더니_이건_혁명임 #한번에3가지이유식","700만 명의 엄마들이 희야 이유식을 선택한 이유 3가지첫째, 세상 쉬운 이유식: 쌀가루, 큐브, 밥솥 칸막이로 만든 진짜 쉬운 레시피예전에는 쌀을 불려서 믹서에 갈고, 가스레인지 앞에 20~30분씩 서서 냄비에 있는 이유식이 눌어붙지 않게 저어가면서 정성스럽게 이유식을 만들었다. 하지만 요즘에는 좀 더 쉽고 편하게 할 수 있는 여러 가지 육아 아이템이 쏟아져 나오고 있다. 대표적으로 쌀가루가 그렇다. 초기, 중기, 후기 이유식 활용도에 맞게 잘게 쪼개진 조각 쌀가루가 나왔다. 또한 채소와 고기를 다져서 보관하고 냉동할 수 있는 다양한 크기의 큐브도 있다. 밥솥 칸막이라는 아이템도 불티나게 팔리고 있다. 원래는 현미밥, 콩밥, 잡곡밥 등 여러 종류의 밥을 한 번에 만들기 위한 것이었다. 그런데 엄마들이 이유식에 활용하면서, 엄마들 사이에서 ‘밥솥 칸막이’는 이유식의 신세계를 선물해준 세상에서 가장 놀라운 발명품이 되었다. 이렇게 쉽게 할 수 있는 아이템들이 많은데, 아직까지 이런 아이템들을 활용한 이유식 책이 없었다. 엄마들은 여러 권의 이유식 책을 사서 참고했지만, 그보다 훨씬 쉬운 방법으로 레시피를 알려준 〈희야라이프〉 블로그에 전적으로 의지할 수밖에 없었다. “사 먹이려고 했는데, 레시피를 따라 해보니 너무 쉬워서 그 이후로는 쭉 만들어 먹였어요.” “희야 님의 쉬운 레시피 덕분에 우리 아기에게 후기 이유식까지 만들어 먹일 수 있었어요.”둘째, 세상 맛있는 이유식: 초보 엄마가 만들어도 맛있게 먹는 이유식정성을 다해 이유식을 만들어 설레는 마음으로 아기 입에 넣어주었는데, 한 입도 먹지 않는다. 그때의 절망감은 아마도 경험해보지 않은 사람은 절대 모를 것이다. 말도 못하는 아기를 원망할 수도 없고, 요리도 못하면서 이유식 한번 만들어보겠다고 이리저리 분주하게 움직인 엄마는 오히려 스스로를 자책한다. 이유식 책도 보고, 요리 잘 한다는 블로그 레시피도 따라해 보고, 아예 사서 먹이는 방법을 선택하기도 한다. 정말 온갖 방법을 찾아 헤매다 보면, 그 사이 말 못하는 아기만 고생스럽다. 그렇게 시행착오를 거듭하다 만난 이유식의 구세주, 희야 레시피는 그동안의 고생과 고민을 한 번에 해결해준다. 요리를 못해서 스트레스만 받고 있던 엄마는 쉽고 맛있는 레시피를 알게 되었고, 아기는 맛있는 이유식을 먹을 수 있게 되었다.“시판 이유식을 안 먹어서, 우연히 블로그를 보고 만들어봤는데요. 아기가 참 잘 먹네요.” 셋째, 세상 건강한 이유식: 궁합이 잘 맞는 재료를 활용해서 더 건강한 맛아기는 모유나 분유를 먹다가 점점 여러 가지 재료가 섞인 이유식을 먹는다. 한편 아기들마다 알레르기를 일으키는 식재료도 있어서 엄마들은 처음 접하는 식재료를 먹일 때마다 민감하게 반응한다. 필자는 이 점을 고려해서 식재료 간에 궁합이 맞거나 안 맞는 정보를 쉽게 정리해주었다. 육류과 궁합이 좋은 식재료, 채소와 궁합이 좋은 식재료, 아기 상황에 따라 좋은 식재료 등이다. 예를 들면 소고기와 브로콜리는 궁합이 좋은 식재료이지만, 소고기와 고구마는 궁합이 좋지 않아서 함께 넣고 만들지 않는다는 것이다. 책 부록에도 따로 정리해두었다. 필요에 따라 잘라서 냉장고에 붙여 놓고 이유식을 만들 때마다 참고하면 좋은 유용한 정보이다.엄마는 세상 편하고 아기는 후루룩 잘 먹는 튼이 이유식. 큐브와 밥솥 칸막이로 한 번에 3가지 9끼 이유식을 완성할 수 있는 방법을 담은 최초의 이유식 책이다. 이유식의 신세계를 경험해보자."
"와인 폴리 당신이 궁금한 와인의 모든 것,매그넘 에디션",Madeline Puckette,10.0점, 7,가정/생활/요리,요리,차/술/음료,"미국 아마존 와인 분야 베스트셀러 1위!20여 개의 언어로 번역된 와인 폴리 도서가 매그넘 에디션으로 돌아왔다!“요즘 출간된 와인 입문서 중 최고다!” - 워싱턴 포스트“내가 와인을 처음 배울 때도 와인 폴리처럼 재치 있고, 금방 읽히고, 이해하기 쉬운 책이 있었다면 얼마나 좋았을까!” - 카렌 맥닐, 『와인 바이블』 저자2016년에 출간된 「와인 폴리」는 뉴욕 타임스의 베스트셀러 및 아마존에서 최고의 요리책으로 선정되었습니다. 그런 이 책의 작가들이 기존 도서보다 2배 이상 업그레이드된 정보를 담아 더욱 강력하게 업그레이드하여 매그넘 에디션으로 돌아왔습니다. 세계 1위 와인 교육 웹사이트인 ‘와인 폴리(WINEFOLLY.COM)’는 개인의 의견이 아닌 여러 와인 전문가와 작가, 과학자, 의사들이 제공한 와인의 지식 데이터베이스를 도서에 담았습니다. 이 책에서는 와인의 양조, 시음 방법, 서빙 및 보관법 등의 와인 기본 지식을 제공하고, 음식과 어울리는 와인을 찾는 방법을 알려줍니다. 그리고 흔히 볼 수 있는 와인, 포도, 블렌드 100종을 음식 조합과 권장 시음 방법, 지역별 분포도로 설명하고 있습니다. 마지막으로 국가별 와인 생산지와 생산하는 와인을 탐색하는 법을 보기 쉽게 인포그래픽으로 소개하고 있습니다. 이 책은 와인에 대해 궁금한 초보자부터 새로운 지식을 늘리고 싶은 전문가들까지 와인을 안내하는 길잡이가 되어 줄 것입니다.",
에듀윌 제과제빵기능사 필기끝장 핵심이론편 2020,오명석,10.0점, 2,가정/생활/요리,요리,,"“혼자서도 충분히, 10일 안에 필기 합격!”“시험 감독위원이 집필한 상시시험에 최적화된 단기 합격 비법서!”본 책은 단기간에 합격하고 싶어하는 제과?제빵기능사 필기 수험생들의 요구를 반영하여 단기 합격이 가능한 최적의 10일끝장 커리큘럼을 제시합니다. 실기시험에도 적용 가능한 필기 이론을 알차게 정리한 [핵심이론편]과 문제은행 형식인 시험의 특성을 고려한 [기출문제편]으로 구성하였습니다. 또한 실제 시험 형식인 CBT 화면을 최신 기출문제 풀이에 도입하여 수험생들의 실전 감각을 더 높일 수 있도록 구성하였습니다.","2020 제과기능사, 제빵기능사 신규 출제기준 반영!2020년 1월 1일부터 적용되는 제과·제빵기능사 신규 출제기준을 적극 반영하여 이론 내용을 구성하였습니다. 변경되는 시험 과목을 반영하여 최신 이론으로 학습할 수 있도록 하였습니다. [핵심이론편 + 기출문제편]으로 이론과 기출을 모두 잡아 한 권으로, 단기간에 끝장낸다!제과·제빵기능사 필기 시험의 수많은 합격 후기의 공통 내용은 이론과 기출을 모두 잡아야 합격할 수 있다는 것입니다. 따라서 본 책은 [핵심이론편]과 [기출문제편]으로 나누어져 있어, 깊이 있는 이론 학습과 약 1,000문항의 기출문제로 충분한 실전 연습이 가능하도록 구성하였습니다. 1. DAY 1~8 [핵심이론편]: 8일 동안 끝내는 이론 과목 총정리!① 시험 합격을 위해 선별된 핵심이론과 풍부한 보충 설명을 통해 이론 학습의 완성도를 높일 수 있습니다.② 한눈에 보는 단원의 구성도를 통해 해당 단원의 내용을 개괄적으로 한 번에 파악할 수 있습니다.③ 하루의 학습이 마무리되면 확인기출문제를 통해 학습 내용을 확인해 볼 수 있습니다. 2. DAY 9~10 [기출문제편]: 실전 감각을 다지는 기출문제 총집합!① 제과기능사, 제빵기능사 기출모의고사가 5회씩 총 10회 수록되어 있고, CBT 최신 기출 복원 문제 2회가 수록되어 있어 충분한 기출문제 학습을 할 수 있습니다.  ② 정답과 오답에 대한 해설을 자세히 수록하여 문제 풀이만으로도 이론 학습이 쉽게 이루어질 수 있습니다.  ③ 실제 시험 형식을 그대로 옮겨 놓은 CBT 최신 기출 복원 문제를 통해 시험장에서도 익숙하게 문제풀이를 이어나갈 수 있습니다. 3. Plus 학습팩 3종 제공!① 시험장 가는 길 필수 아이템! 핵심 집중노트② 시험장이 두렵지 않은 실전 연습의 힘! CBT 최신 기출 복원 문제③ 나에게 맞는 학습 플랜을 선택하여 초고속 합격 완성! 최적 합격 맞춤 플래너4. 프리미엄 무료 특강 제공!독학하는 수험생, 학습을 더 원활하게 진행하고 싶은 수험생을 위해 필기 이론 프리미엄 무료 특강 20강을 제공합니다. 각 분야의 전문가인 교수님들의 특별 강의로 충분한 단기 합격이 가능하도록 하였습니다."
