title,author,score,num_reviewers,main genre,middle genre,subclass,introduction,review신비아파트 고스트볼 더블X 6개의 예언 4,편집부,10.0점, 5,어린이,,,"★〈신비아파트 고스트볼 더블X 6개의 예언〉 소개2020년 3월, 멸망한 세상을 목격하다!금비의 시간 요술로 1년 뒤 미래로 가게 된 하리와 친구들.세상 사람들이 모두 돌로 굳어 버리고 귀신이 점령한 인간 세상을 확인하고 충격에 빠진다.이후, 현재로 돌아온 하리와 친구들에게 리온이 찾아오는데....리온은 아이기스에서 찾아낸 예언서를 보여 주며 예언서의 귀신을 막지 못하면 세상에 재앙이 찾아온다고 했다.미래에서 본 재앙을 막기 위해 귀신들과 싸워 예언을 막기로 결심한 하리와 친구들.과연 하리와 친구들은 세상을 구할 수 있을까…?","★〈신비아파트 고스트볼 더블X 6개의 예언 애니북 4권〉 ~차례 및 줄거리 소개~제10화 전생의 기억, 연금술사와 황금박쥐박물관에 견학 간 하리네 반 친구들. 같은 시각아이기스 지하 감옥에 잠들어 있던 오래된 괴수 ‘자간’이 깨어나고,‘자간’은 힘을 되찾기 위해 신비아파트를 향해 오는데…!제11화 공포의 비명동산, 악마가 된 마스코트정체불명의 귀신의 초대장을 받은 아이들이 하나둘 사라지는사건이 발생한다. 하리와 두리마저도 귀신에게 붙잡히고,남매는 귀신과의 내기에서 이겨 탈출하고자 한다.제12화 귀신 보는 아이, 붉은 시선의 위협첨단 의료 시설을 자랑하는 병원에서 정체불명의 기운이사람들을 위협하기 시작한다. 하리는 뭔가 수상한 일이벌어지고 있단 것을 느끼고, 불길한 기운의 정체를 추적하려 한다.제13화 최후의 예언, 영혼 없는 집행자드디어 신비아파트 친구들이 마주한 최후의 예언.하리와 친구들은 예언의 귀신들을 무찌르고‘오피키언’으로부터 세상을 구하려 한다.~등장 캐릭터 소개~신비 신비아파트가 100년이 된 순간 태어난 도깨비. 하리와 두리에게 업그레이드된 고스트볼 더블X를 선물해서, 더 강력해진 귀신들과 맞서 싸울 수 있도록 도와준다.금비 사투리를 쓰는 반전 매력 도깨비. 시간의 요술로 써서 친구들과 도착한 1년 뒤 미래에서 세상의 멸망을 보게 된다.구하리 따뜻한 마음씨의 생기발랄 의리녀. 정의감이 강해, 친구들과 소중한 사람들을 위해선 어떤 위험이든지 뛰어든다. 고스트볼 더블X로 귀신들과 싸우면서 세상의 멸망을 막고자 한다.최강림 귀신과 맞서 싸우는 멋진 퇴마사. 평소엔 조용하지만, 귀신과 싸울 땐 누구보다 열정적인 최강 퇴마사. 새로운 무기로 세상의 멸망을 막기 위해 싸운다.구두리 하리의 동생이자 신비와 환상의 단짝인 겁쟁이. 귀신을 엄청 무서워하지만 세상을 구하기 위해 용기를 내어 귀신에 맞선다.이가은 따뜻한 마음씨를 가진 하리의 절친. 침착한 판단력으로 친구들과 함께 귀신에 맞선다.김현우 하리의 수다쟁이 남사친. 귀신에 대한 정보를 제공하며 친구들이 활약할 수 있도록 돕는다.자간 (저주받은 금수) 파르켈의 연구실에서 실수로 만들어진 괴수로, 한쪽 눈알을 빼앗긴 채 아이기스의 지하 감옥에 봉인된다. 자간의 눈을 보면 황금으로 변해 녹아 버린다.토면귀 (비명동산의 마스코트) 귀신의 초대장을 받은 아이를 비명동산으로 끌고 간다. 용기를 증명하지 못한 아이의 영혼을 잡아먹는다.적목귀 (기계 속의 방랑자) 의료 과실로 사망한 노숙자의 원혼. 자신의 억울한 죽음이 비밀에 부쳐지자 부도덕한 병원의 의료 행위를 막기 위해 기기들에 잠입해 문제를 일으킨다. 만티 두억시니 (합체귀신) 만티코어의 몸에 두억시니의 상체가 합체된 모습으로, 강력하고 거대한 도깨비 방망이를 휘두른다.오피키언 (예언의 집행자) 먼 과거에 연금술사가 만들어 놓은 거대한 기계. 예언이 완성되면 세계를 멸망시키도록 설계되어 있다."
마법의 설탕 두 조각 소년한길 동화 2,미하엘 엔데,8.84점, 334,어린이,초등3~4학년,어린이동화,"미카엘 엔데의 잘 알려진 동화 <모모>며 <끝없는 이야기>는 사실 어른들에게도 만만치 않은 동화이다. 그 동화들을 낮은 학년 어린이들에게 선뜻 읽히기 힘들다면, 이 동화 <마법의 설탕 두 조각>(원제는 ""렝켄의 비밀"")을 권해 줄 만하다. 이 동화는 오트프리트 프로이슬러와 미카엘 엔데와 같은 독일이 자랑하는 동화 작가의 타이틀을 독점으로 관리하고 있는, 명망 있는 독일 출판사인 티네만에서 엔데의 단편 동화를 요즘 어린이의 눈높이에 맞추어 깔끔하고 세련된 컬러 그림으로 다시 펴낸 새 판본을 옮긴 것이다. 그 내용과 분량 면에서도 어린이가 앉은 자리에서 단숨에 끝까지 읽어 낼 수 있을 만큼 인물과 사건이 군더더기 없이 속도감 있게 곧장 결말을 향해 간다. 주인공 렝켄은 아주 착한 아이이다. 착한 아이 렝켄에게 고민이 생겼다. 렝켄이 느끼기엔 엄마 아빠가 자기 뜻을 전혀 존중해 주지 않는 것 같다. 렝켄은 요정을 찾아가서 이 문제를 상담하기로 결심한다. 손가락이 여섯 개 달린 요정이 렝켄에게 해결책으로 준 것은 다름 아닌 마법의 설탕 두 조각. 그걸 몰래 엄마, 아빠의 찻잔 속에 타 먹이면 엄마, 아빠가 렝켄의 말을 들어주지 않을 때마다 키가 반으로 줄어든단다. 렝켄은 더 생각할 필요도 없이 집으로 돌아와 엄마 아빠의 찻잔 속에 설탕을 몰래 넣는다. 설탕을 넣은 차를 마신 렝켄의 부모는 성냥갑 속에 들어갈 만큼 줄어들게 된다.렝켄은 막상 부모가 자기를 돌봐 줄 수 없을 만큼 작아지자 슬픔과 두려움을 느낀다. 요정을 다시 찾아갔더니 이번에는 렝켄이 마법의 설탕을 삼키는 것이 유일한 해결책이라고 한다. 그걸 삼키면 이번에는 렝켄이 부모의 말을 거역할 때마다 반으로 줄어들게 되는 위험이 따른다고 한다.렝켄은 고민 끝에 차라리 부모라는 든든한 보호자 없이 살기보다는 부모의 말에 순종하는 쪽을 선택한다. 그러나 렝켄에게는 그런 일이 절대로 일어나지 않는다. 렝켄이 부모가 원하지 않을 때에도 부모가 원하는 것이 무엇인지를 헤아릴 줄 아는 아이가 되었으므로. 대개의 가정에는 크든 작든 구성원 간의 갈등이 있게 마련이다. 여기서 렝켄이라는 이제 갓 초등학교에 입학한 소녀는 이 갈등을 어떻게 이해하고 있을까? 렝켄의 인식 수준으로는 부모가 자신을 억압하는 힘의 논리가 {크기와 수}의 논리로 이해된다. 그래서 아이는 요정에게 부모가 자기보다 크고, 두 사람이라서 대적하기 힘들다고 호소한다. 소녀는 현실 공간에서 이 갈등의 해결책을 찾지 못하고 결국 마법의 손을 빌리게 된다. 그러나 그 마법에는 큰 대가가 따른다. 자기도 상대의 처지에 빠져 봐야 한다는. 엔데는 부모와 아이 둘 다에게 시련을 체험시키고 그 체험을 통해서 구성원이 행복하게 화해하는 결말을 택한다. 그러나 이 작은 소품에서도 <모모>나 <끝없는 이야기>를 통해 현대 사회가 직면한 문제를 우주적인 질서의 회복을 통해서 해결할 수 있다고 보는 엔데의 철학이 엿보인다. 렝켄이라는 어린 소녀의 인식 수준으로는 가정이라는 테두리가 광대한 우주만큼이나 넓은 공간일 수 있으므로.","대개의 가정에는 크든 작든 구성원 간의 갈등이 있게 마련이다. 여기서 렝켄이라는 이제 갓 초등학교에 입학한 소녀는 이 갈등을 어떻게 이해하고 있을까? 렝켄의 인식 수준으로는 부모가 자신을 억압하는 힘의 논리가 ""크기와 수""의 논리로 이해된다. 그래서 아이는 요정에게 부모가 자기보다 크고, 두 사람이라서 대적하기 힘들다고 호소한다. 소녀는 현실 공간에서 이 갈등의 해결책을 찾지 못하고 결국 마법의 손을 빌리게 된다. 그러나 그 마법에는 큰 대가가 따른다.자기도 상대의 처지에 빠져 봐야 한다는 엔데는 부모와 아이 둘 다에게 시련을 체험시키고 그 체험을 통해서 구성원이 행복하게 화해하는 결말을 택한다. 그러나 이 작은 소품에서도 『모모』나 『끝없는 이야기』를 통해 현대 사회가 직면한 문제를 우주적인 질서의 회복을 통해서 해결할 수 있다고 보는 엔데의 철학이 엿보인다. 렝켄이라는 어린 소녀의 인식 수준으로는 가정이라는 테두리가 광대한 우주만큼이나 넓은 공간일 수 있으므로."
"쿠키런 어드벤처 41 마왕의 경고,지구의 허파 아마존,쿠키들의 신통방통 지리여행",송도수,10.0점, 3,어린이,,,"브브와 친구들, 아마존에서 뿔뿔이 흩어지다!마리안에게 이끌려 브라질의 아마존에 도착한 브브 일행.브브 일행은 늪지대를 건너다 지구에서 가장 큰 뱀, 아나콘다의 공격을 받게 되고, 콜드는 자신을 부르는 소리를 따라아마존 열대 우림을 헤맨다. 한편, 마침내 꿈속의 우물룡을 만난 콜드는 쿠키계의 운명이 달린 엄청난 진실을 듣게 되는데…!","세계 도시의 명소를 통해 세계문화를 담은 〈쿠키런 어드벤처〉 2시즌!생각이 커지고, 호기심이 자라는 신통방통 지리 문화 여행! 41권에서는 〈지구의 허파 아마존〉를 탐험합니다.〈쿠키런 어드벤처 -신통방통 지리여행 편〉의 특징 31.  만화 속 유익함 up 만화 스토리 속에서 자연스럽게 연결된 정보 코너브브의 탐험 노트, 허브의 생물X파일 코너2.  콘텐츠 속 호기심 up * 호기심을 채워 주는 주제별 다양한 콘텐츠 구성- 페이의 대단한 지리 상식- 콜드의 호기심 랭킹- 버블의 버블버블 미스터리- 쿠키런 미션 쿠키런을 찾아라!(놀이페이지)3. 에필로그 속 색다른 재미 up*쿠키 인간형 버전의 짤막 에피소드 공개본편에서 다루지 못한 뒷이야기를 통해 또 다른 재미를 선사합니다."
"설민석의 한국사 대모험 6 역사 속 라이벌 편 설쌤과 황 대감, 화해 대작전!",설민석,0.0점, 1,어린이,어린이(공통),교양/취미,"한국사 학습만화 분야 압도적 1위!지식, 재미, 감동을 모두 담은우리 아이 첫 한국사 한습만화! 만나기만 하면 으르렁 으르렁,설쌤, 황 대감님! 언제까지 싸우실 거예요?역사를 통해 진정한 라이벌이란 무엇인지 생각하는 시간을 가져보세요!  한때 고구려를 위해 함께 뜻을 모으자고 다짐했었던 설쌤과 황 대감, 하지만 지금은 각각 온달과 공갈을 부마 자리에 앉히기 위해서 서로 경쟁하는 상황입니다. 거기에 둘은 만나기만 하면 서로 트집을 잡아 싸우기에 바쁩니다. 이런 설쌤과 황 대감을 화해시킬 수 있는 방법은 정말 없는 것일까요? 『설민석의 한국사 대모험 6』은 설쌤과 황 대감의 관계 회복을 위한 시간 여행을 통해서 역사 속의 진정한 라이벌을 찾아 나섭니다. 라이벌이란 같은 목적을 가졌거나 같은 분야에서 일하면서 이기거나 앞서려고 서로 겨루는 맞수입니다. 진정한 의미의 라이벌이란 서로를 이기기 위해서 자신의 실력을 갈고 닦아서 실력으로 승부를 겨루고, 상대의 패배를 조롱하지 않고 감싸주는 것입니다.  『설민석의 한국사 대모험 6』은 이런 진정한 의미의 라이벌로 ‘김유신과 계백’ ‘정도전과 이방원’으로 선정하고, 이들을 만나기 위한 역사 여행을 시작합니다. 적국의 장수로 국가의 운명을 가르는 황산벌 전투에서 만난 신라의 김유신과 백제의 계백. 비로 적국의 장수이지만 두 사람은 서로를 인정했으며, 전투가 끝난 후에도 그 예를 다하여 상대를 높였습니다. ‘백성을 위한 세상을 만들고자 했던 뜻은 같았지만 방법이 달랐던 정도전과 이방원 역시 서로를 인정하는 진정한 라이벌이었습니다. 이번 여행을 통해서 설쌤과 황 대감이 화해를 할 수 있을지, 그리고 앞으로 펼쳐질 온달과 공갈의 부마 경쟁에는 어떤 영향을 줄지, 『설민석의 한국사 대모험 6』을 통해서 확인해보세요.",
"설민석의 한국사 대모험 4 선사시대 편,본격 부마 결정전,온달 대 공갈!",설민석,0.0점, 4,어린이,어린이(공통),학습/학습만화,"드디어 평강의 아버지이자 고구려의 왕을 만나게 된 온달. 온달은 먹을 것과 관련한 이야기를 늘어놓으며 왕의 환심을 사게 된다. 하지만 황 대감은 공갈에게도 기회를 주자며 온달과 공갈의 대결을 제안한다. 왕은 동맹이 시작하는 날 두 사람이 부마 자리를 두고 대결할 것을 결정한다. 다급해진 설쌤 일행은 다시 대한민국으로 돌아가 대결 준비를 하려고 하는데, 이때 황 대감의 꼼수로 설쌤 일행은 대한민국이 아닌 구석기 시대로 향하게 되는데… 과연 온달은 무사히 역사 공부를 마치고 공갈과의 대결에서 승리할 수 있을까?『설민석의 한국사 대모험』은 설민석 선생님과 태건 역사 연구소가 철저하게 고증하여 정확한 역사 지식을 어린이들에게 쉽고, 재미있게 알려주는 책이다. 어린이들이 일상에서 고민할 수 있는 문제들을 역사 속 인물을 통해 같이 생각하고 해결해 볼 수 있도록 구성되어 있다. 우리가 매일 쓰고 있는 한글을 만든 세종대왕, 수원화성에 담긴 정조의 마음, 조선왕조실록의 의미 등 한국의 문화유산에 대해 만나게 될 것이다.","한국사 학습만화 분야 압도적 1위!지식, 재미, 감동을 모두 담은우리 아이 첫 한국사 한습만화!1. 『설민석의 한국사 대모험 4』 도서 소개구석기 시대, 신석기 시대, 청동기 시대, 철기 시대설쌤과 함께 선사시대 우리 선조들의 생활과 문화를 체험하는 역사 여행을 시작하세요!<4권 줄거리>드디어 평강의 아버지이자 고구려의 왕을 만나게 된 온달. 온달은 먹을 것과 관련한 이야기를 늘어놓으며 왕의 환심을 사게 된다. 하지만 황 대감은 공갈에게도 기회를 주자며 온달과 공갈의 대결을 제안한다. 왕은 동맹이 시작하는 날 두 사람이 부마 자리를 두고 대결할 것을 결정한다.다급해진 설쌤 일행은 다시 대한민국으로 돌아가 대결 준비를 하려고 하는데, 이때 황 대감의 꼼수로 설쌤 일행은 대한민국이 아닌 구석기 시대로 향하게 되는데...과연 온달은 무사히 역사 공부를 마치고 공갈과의 대결에서 승리할 수 있을까?2. 『설민석의 한국사 대모험 4』 제대로 즐기기<등장인물 소개>설쌤 고구려에서 대한민국으로 온 대학자. 한국사에 대한 애정만큼은 누구보다 뜨거운 설쌤! 용의 송곳니를 갈아 만든 분필로 시간여행을 하는 능력자! 설쌤과 함께 하게 될 시간여행, 기대되지 않나요?평강 고구려의 공주입니다. 아는 것이 매우 많고 한국사에 관심도 많지만 급한 성격이 항상 문제입니다. 평강은 떳떳하게 아바마마를 만날 수 있을까요?온달 귀여운 외모에 비해 지식은 부족한 아이입니다. 식탐 많고 잠 많고 한국사엔 관심도 없지만,가슴이 따뜻하고 밝고 명랑하죠. 과연 온달은 역사 천재가 되어 평강의 신랑이 될 수 있을까요?로빈 언제부터인가 설쌤의 태건 역사 연구소에서 함께 지내는 강아지입니다. 애교가 많고 친근한 성격이죠! 위기의 순간에 설쌤과 친구들을 도와줍니다. 로빈의 활약 기대해주세요.황 대감 고구려의 대학자이자 설쌤의 라이벌. 자신의 제자 공갈을 평강의 신랑으로 만들고 싶어 합니다. 의심이 많고 신중하지만 그런 성격이 오히려 설쌤과 평강, 온달에게는 행운입니다. <이 책의 구성과 특징>1. 시간의 문을 열고 한국사 대모험 속으로 빠져들어요!온달을 역사 천재로 만들기 위해 시간의 문을 열고 한국사 여행을 하는 설쌤 일행! 시간여행을 통해 한국사의 주요 장면을 직접 겪는 듯 생생하게 즐길 수 있습니다!2. 설쌤의 역사톡톡으로 한국사 지식이 늘어나요!‘설쌤의 역사톡톡’을 놓치지 마세요. 만화 중간에 꼭 알아야 할 한국사 지식을 모두 담았습니다. 아이가 어려워하면 부모님이 함께 읽고 이야기해주세요.3. 설쌤의 주문을 같이 따라 해보아요!시간의 문을 열기 위한 설쌤의 주문! 그 주문에는 역사 속 인물들의 특징이 잘 드러나 있지요. 다 함께 설쌤의 주문을 외쳐보아요!4. 다양한 추가 학습으로 한국사의 깊이를 느껴보세요!만화에 없는 더 깊은 지식, 역사의 숨결을 느낄 수 있는 현장학습 정보, 시대를 한눈에 볼 수 있는 연표까지! 책 한 권으로 다양한 한국사 학습 활동을 체험할 수 있습니다.5. 한국사 50문제를 풀며 실력을 확인해보세요!학습 내용을 확인하는 기본 문제는 물론 한국사능력검정시험 초급에 해당하는 문제를 통해 응용 능력과 해결 능력을 키우고 시험에 도전해보세요!"
세상에서 가장 힘이 센 말,이현정,0.0점, 5,유아,,,"《세상에서 가장 힘이 센 말》로즐겁고 행복하고 슬기로운 언어생활의 마법을!영국 평의회는 해마다 전 세계 영어 사용자 50만 명에게 물었다. “세상에서 가장 힘이 센 말이 뭐라고 생각하느냐?”2005년, 세계 영어 사용자들은 답했다. MOTHER(엄마)2005년 영국 BBC 방송국은 세계인들이 세상에서 가장 힘이 센 말로 ‘엄마’를 뽑았다고 발표했다. 아침 뉴스로 이 보도를 본 《세상에서 가장 힘이 센 말》의 글작가 이현정은  빠르게 아이디어 노트에 메모를 했다. ‘세상에서 가장 힘이 센 말-엄마.’ 7년 뒤, 그 아이디어 노트는 그림책이 되었다. 초판 《세상에서 가장 힘이 센 말》이 바로 그 책이다. 초판 출간 당시 이현정 작가는 그림책에 ‘엄마’를 넣지 않았다. 그때 작가는 이제 막 세 아이의 엄마가 됐고 그 세 아이들은 말을 배우기 바빴다. 작가는 아이들이 좋은 언어를 듣고 좋은 언어를 말하기 바라는 마음을 담아 박재현 화백과 함께 그림책을 냈다. 그 메시지는 독자에게 그대로 전달이 됐다. 13년 초등학교 국어교과서 나, 2019년 특수학교 고등학교 국어 가에 수록이 된 것. 작가는 다시 8년이 흐른 뒤, 개정판《세상에서 가장 힘이 센 말》을 고쳐 쓰며 이번만큼은 ‘엄마’를 살리기로 한다. 그래서 물었다.  당신에게 가장 힘이 센 말은 무엇인가요? 그리고 답했다. 내게 가장 힘이 센 말은 ‘엄마’, ‘아빠’라고.★2013년 초등 1학년 국어교과서 수록 도서 ★2019년 특수학교 고등 국어 수록 도서","말은 힘이 세다태어나서 죽을 때까지 평생 수없이 많은 말을 하지만 우리는 정작 필요한 때, 필요한 말을 하지 못할 때가 많다.  끙끙 앓으며 미처 하지 못한 말 때문에 밤새 잠 못 이루고 잘못 뱉은 말 한 마디 때문에 또 골머리를 앓는다.  태어나서 한 순간도 쉬지 않고 불렀던 어떤 말은 한순간에 다시 부를 수 없는 말이 되기도 한다. 달달북스 첫 번째 그림책 《세상에서 가장 힘이 센 말(개정판)》은말의 힘을 알고 그 힘을 제대로 쓰는 법을 우리 아이들에게 아름다운 일러스트와 글로 건넨다.  흔한 말, 그런데 하기 어려운 말 이제 막 세상에 온 아이의 눈동자를 보며 아름다운 말을 건네고 싶은데 이상하게 입이 떨어지지 않을 때,   어쩔 수 없이 “안 돼!” “하지 마!” 하고 따끔따끔한 말을 쏟아냈는데 아이 마음을 풀어줄 말을 찾지 못할 때,그냥 이유 없이 ‘미안해’, ‘고마워’, ‘사랑해’라고 말하고 싶은데 입 안에서 말들이 맴돌기만 할 때, 《세상에서 가장 힘이 센 말》를 아이와 함께 읽어 보자. 너무 쉬운 말, 그런데 하기 어려운 말이 그림책을 읽는 동안에 아이 마음에 작은 씨앗이 되어 아름다운 말씨를 꽃피울 것이다.  집에서 시작해 집으로 돌아온 ‘말’ 이야기 아침 햇살이 쏟아지는 아침, 행복한 아침이 시작된다. 엄마와 아이들은 아침을 준비하고, 아빠는 고양이 밥을 챙긴다. 그리고 서로에게 ‘고맙다’ 인사를 건넨다.  《세상에서 가장 힘이 센 말》은 이렇게 집에서 시작한다. 도와줘서 ‘고마워’, 실수해도 ‘괜찮아’서로에게 따뜻한 말을 건네는 속에, 아이는  이제 ‘혼자 할 수 있어요!’라며 운동화 끈을 질끈 묶고 학교로 향한다. 집에서 사회로 나가는 것이다. 하지만 세상은 낯설고 새로운 친구 앞에 부끄럽다. ‘안녕!’하고 가벼운 인사를 건네는 것도 쉽지 않다. 아이는 날마다 연습을 한다. 하늘에 구름, 길가의 꽃, 공원의 벤치, 동네 강아지, 동네 고양이에게 ‘안녕’ 인사를 건넨다. 힐끗 돌아보고 싱긋 웃어주던 친구가 ‘안녕’ 인사를 받아주고 아이는 조금 자신감을 갖는다. 이렇게 우리는 유치원으로, 학교로, 사회로 한 걸음 나가는 법을 배운다. 그 속에서 기쁜 일, 속상한 일을 겪으며 말로 마음과 생각을 표현하고 문제를 해결해 나간다. 그리고 집에 돌아온 아이는 가족과 함께 감사하게 저녁 식사를 마치고 할머니, 할아버지에게 보고 싶으니 얼른 오시라고 마음을 전한다. 이윽고 밤이 깊어지고 《세상에서 가장 힘이 센 말》은 이렇게 집에서 이야기를 마친다.  내게 가장 힘이 센 말은 따로 있다 《세상에서 가장 힘이 센 말》의 시작은 엄마(어쩌면 아빠)가 아이에게 던진 질문으로 시작한다. “너에게 가장 힘이 센 말은 뭐니?”아이는 생각에 잠긴다. 그리고 하루를 돌아본다. 아침에 엄마를 들어주고 들었던 ‘고마워’ 한 마디는 더 돕고 싶은 마음이 들게 했다거나 엄마가 실수하는 모습을 보았을 때 ‘괜찮다’고 했던 말은 언젠가 엄마와 아빠에게 들었던 말이다. 학교에서 친구와 다투고 ‘미안해’라고 말하는 건 쉽지 않았지만 하고 보니 속이 시원했다. 기쁘다고 말하면 기쁜 마음이 들고 속상하다고 말하면 속상한 마음이 들었다. 말이 마음이 되기도 한다. 하지만 아이는 생각한다. 이 모든 말들이 힘이 세지만, 자신에게 힘이 센 말은 따로 있다고. 어떤 말보다 힘이 세고 모든 말을 대신할 수 있고 자꾸 하고 싶은 그 말. 바로 ‘엄마’ 그리고 ‘아빠’라고. 그리고 이 책의 가족들은 서로에게 ‘사랑한다’고 말한다. 아름다운 말씨는 ‘건강한 마음’ 위에 꽃핀다 《세상에서 가장 힘이 센 말(개정판)》을 내며, 가장 중점을 둔 것은 그림의 서사를 통해 ‘세상에서 가장 힘이 센 말’이 건강한 마음에서 나온다는 이야기를 들려주고 싶었다. 그래서 그림은 아침부터 저녁까지 한 가족과 한 아이의 일상을 통해, 말이 언제 어디서 누구와 있을 때 어떤 힘을 가지는지 보여준다. 그리고 글의 서사는 묻는다. 세상에 힘이 센 말이 많지만, ‘내게 힘이 센 말’은 무엇이냐고. 글의 서사는 ‘엄마와 아빠’라고 맺지만, 마지막 페이지에 그 모든 말의 힘이 결국 ‘사랑해’에서 온다고 말한다. ‘사랑해’라는 말은 덧붙이는 말없이, 따뜻한 햇살이 밀려드는 아침, 가족이 하나로 누워 ‘사랑해’로 서로를 깨우는 모습을 보여준다. 세상에서 가장 힘이 센 말, 아름다운 말씨는 결국 ‘사랑’을 바탕으로 하지 않나?"
