title,author,score,num_reviewers,main genre,middle genre,subclass,introduction,review"워드마스터 Word Master 중등 고난도 2016,30단어씩 30일만에 완성하는 중등 주요 교과서 심화 900단어",박혜란,10.0점, 8,학습/참고서,,,"교육 과정 및 국가 수준 영어 시험을 분석하여 최신 기출 어휘 및 예문을 반영하였다. 주제별 분류, 반복 연습, Word Mapping, 누적테스트를 통한 효율적 학습이 가능하다. 표제어 암기용(2가지 버전)과 리스닝 훈련용 MP3 파일을 제공한다.","1. 주제별 학습: 총 5가지 큰 주제로 나눈 뒤 각 day는 세부 주제별로 구성해 비슷한 주제로 연관된 단어들을 연속으로 학습할 수 있습니다.2. 기출 예문 활용: 학습한 단어가 실제 시험에서는 어떻게 출제되는지 알 수 있도록 국가 수준 영어 시험의 주요 기출 예문을 적극 활용하였습니다.3. 파생 어휘 학습: 표제어 900단어의 관련 어휘, collocation을 함께 제공하여 단어의 활용도를 높일 수 있도록 했습니다.4. 순수 영어 실력 향상: 필수 접두사 / 접미사, 유의어의 의미 차이, broken English 등 다양한 유형의 팁을 제공하여 단어 이해의 폭을 넓힐 수 있도록 했습니다. 5. 다양한 확인 문제: 영영풀이, 어휘 간 관계 유추, 단어 형태 변화, 빈칸 채우기 등의 문제를 풀면서 실력을 쌓을 수 있습니다.6. 누적 테스트: 누적 테스트를 제공하여 앞에서 배운 어휘를 반복하여 학습할 수 있으며, 이를 통해 나의 학습 성취도를 파악할 수 있습니다."
"라이트쎈 중등 수학1 (상) 새교육과정,2020",홍범준,0.0점, 1,학습/참고서,중학교,중1 문제집,- 독자대상: 중학 수학 학습자- 구성: 문제 + 정답 및 해설- 특징: 기본+유형+마무리의 3단계 학습 시스템,쉬운 문제기본서 라이트쎈!수학을 어려워하는 학생들이 수학을 포기하지 않도록 부담을 줄인 “문제기본서 라이트쎈”실력에 맞는 교재를 선택하면 학습 성취도를 높일 수 있습니다.수학을 어려워하는 학생들이 어려운 개념과 문제로 학습 의욕이 꺾이지 않도록 출제 빈도가 낮은 어려운 문제를 과감히 생략하였습니다. 또 기본 실력을 강화하고 유형별 학습을 통해 문제해결력을 향상시킬 수 있도록 하였습니다.라이트쎈은 수학을 어려워하는 학생들에게 최적화된 문제기본서입니다.
개념원리 고등 수학 1 2020,이홍섭,0.0점, 0,학습/참고서,고등학교,문제집,"수학의 기본 개념과 원리를 확실히 잡기 위한 개념기본서다. 수학을 어렵다는 편견 없이 시작할 수 있도록 학생들의 눈높이에 맞추었으며, 교과서 내용을 충실히 담아 개념과 원리를 확실히 이해하고 문제를 쉬운 것부터 단계적으로 제시하였다. 단순한 암기식 풀이가 아니라 개념원리에 의한 독특한 교수법으로 새 교육과정에서 요구하는 사고력, 응용력, 창의력을 배양할 수 있도록 기획되어 생각하는 방법을 깨칠 수 있다.","수학의 기본 개념과 원리를 확실히 잡기 위한 개념기본서1. 수학을 어렵다는 편견 없이 시작할 수 있도록 학생들의 눈높이에 맞춘 수학 개념기본서입니다.2. 교과서 내용을 충실히 담아 개념과 원리를 확실히 이해하고 문제를 쉬운 것부터 단계적으로 제시하여 차근차근 공부하다보면 수학에 대한 자신감이 생길 수 있습니다.3. 단순한 암기식 풀이가 아니라 개념원리에 의한 독특한 교수법으로 새 교육과정에서 요구하는 사고력, 응용력, 창의력을 배양할 수 있도록 기획되어 생각하는 방법을 깨칠 수 있도록 하였습니다."
개념원리 RPM 수학(하) 2019,이홍섭,0.0점, 0,학습/참고서,고등학교,문제집,"1. 전국 고등학교 중간·기말고사와 모의고사, 수능 기출 문제를 철저히 분석, 분류하여 유형을 세밀하게 나누어 수학의 모든 유형을 완벽히 마스터할 수 있도록 하였습니다.2. 각 유형의 모든 문제를 난이도별로 분류하였습니다.전체 구성을 5단계로 구성하고, 이 중 유형 익히기와 유형 UP은 하, 중하, 중, 중상, 상의 5단계 난이도로 세분화하여 체계적으로 수학 실력을 키울 수 있습니다.3. 개념원리 수학의 필수 예제를 유형화하였습니다.개념원리 수학기본서의 필수 예제를 유형화하고 각 유형에 따른 다양한 문제를 실어 이를 통해 응용력과 문제해결력을 기를 수 있도록 하였습니다. 따라서 개념원리 수학기본서와 연계하여 공부하다 보면 학습 효과가 더욱 높아질 것입니다.",
"EBS My Grammar Coach 표준편 개념잡는 중학영문법, EBS 정승익 선생님의 명쾌한 영문법 강의 무료제공",EBS교육방송 편집부,10.0점, 19,학습/참고서,,,"명쾌하게 개념을 설명하는 교재로, 개별 문법 규칙들을 큰 원리로 묶어 쉽게 설명했다. 친절한 그래머 코치가 이해하고 넘어갈 것과 암기해야 할 것들을 구분해주고 어려운 용어도 사이다처럼 시원하게 설명해 준다. 큰 줄기를 이루는 중요한 것들을 먼저 공부하고 큰 줄기에서 벗어난 곁가지 문법들을 따로 모았다. 다양한 형태의 쓰기 훈련 문제로 문법을 내재화할 수 있다.","■ 교재 특징● 명쾌한 개념설명   - 개별 문법 규칙들을 큰 원리로 묶어 쉽게 설명했습니다.   - 어려운 용어와 개념을 우리말과 비교해서 쉽게 풀어 줍니다.● 그래머 코치를 내 곁에   - 친절한 그래머 코치가 이해하고 넘어갈 것과 암기해야 할 것들을 구분해주고 어려운 용어도 사이다처럼 시원하게 설명해 줍니다.● 기본 문법과 추가 문법   - 큰 줄기를 이루는 중요한 것들을 먼저 공부하고 큰 줄기에서 벗어난 곁가지 문법, 개별적으로 학습해도 되는 것들을 따로 모았습니다.    - 순서를 잡아주니까 문법을 쉽고 간단하게 공부할 수 있습니다.● 쓰기를 통한 훈련   - 쓰기를 통해 배운 문법은 머리 속에 오래가는 문법 회로를 만들어줍니다.    - 다양한 형태의 쓰기 훈련 문제로 문법을 내재화 합니다."
고등 과학탐구영역 생명과학1(2020)(2021 수능대비)(8절)(EBS Final 실전모의고사) 2015 개정 교육과정 첫 수능,편집부,0.0점, 0,학습/참고서,,,"〈FINAL 실전모의고사 과학탐구영역 생명과학Ⅰ〉2015 개정 교육과정 첫 수능, 기출로는 부족하다!2021학년도 수능 완벽 대비는 EBS 모의고사 시리즈와 함께!EBS의 첫 번째 모의고사 시리즈 ""FINAL 실전모의고사“수능과 동일한 난이도의 신규 모의고사 ‘9회분’ 제공2021학년도 수능 리허설!출제 가능성이 높은 문항을 수능과 동일한 배점과 난이도의 모의고사로 구성하였습니다.실제 시험 시간에 맞춰 모의고사를 풀어보며 실전 감각을 익히고 부족한 개념을 보완할 수 있도록 하였습니다.명확한 해설!쉽고 상세한 풀이를 보기 항목별로 제시하였습니다. 특히 옳은 진술과 틀린 진술을 정답 맞히기와 오답 피하기로 구분하여 제시함으로써 옳고 그른 이유를 명확히 파악할 수 있도록 하였습니다.EBSI 100% 무료강의 제공고교강의의 중심, EBSI에서 제공하는 100% 무료 강의를 인터넷 홈페이지 / 스마트폰 ‘EBS 고교강의’ 앱을 통해 들을 수 있습니다.","2015 개정 교육과정 첫 수능, 기출로는 부족하다!2021학년도 수능 완벽 대비는 EBS 모의고사 시리즈와 함께!EBS의 첫 번째 모의고사 시리즈 ""FINAL 실전모의고사“수능과 동일한 난이도의 신규 모의고사 ‘9회분’ 제공2021학년도 수능 리허설!작년 수능과 동일한 배점과 비슷한 난이도로 구성하되, 각 회 별로 고난도 문항을 포함시켜 2021학년도 수능 대비 실전력을 한층 강화시킬 수 있도록 하였습니다.명확한 해설!쉽고 상세한 해설을 선택지별로 제시함으로써 정답이 되는 이유와 오답이 되는 이유를 명확하게 파악하도록 하였습니다.EBSi 100% 무료강의 제공고교강의의 중심, EBSi에서 제공하는 100% 무료 강의를 인터넷 홈페이지 / 스마트폰 ‘EBS 고교강의’ 앱을 통해 들을 수 있습니다."
개념원리 RPM 문제기본서 수학 중1-1 2018,이홍섭,0.0점, 3,학습/참고서,중학교,중1 문제집,- 독자대상 : 중학교 1학년- 구성 : 이론 + 문제- 특징 : 1. 교과서 내용을 꼼꼼히 분석2. 핵심 개념만을 모아 알차고 이해하기 쉽게 정리3. 학습한 정의와 공식을 적용4. 개념을 확실하게 익힐 수 있도록 구성5. 문제 해결에 사용되는 핵심 개념·정리를 제시6. 문제의 형태 및 풀이 방법 등에 따라 문제를 유형화하여 구성7. 발전된 유형을 모아 문제의 형태 및 풀이 방법 등에 따라 문제를 유형화하여 구성8. 중단원을 학습한 후 테스트를 통해 나의 실력을 확인해 볼 수 있도록 함,"[이 책의 특장점]1. 전국 중학교 중간·기말 고사를 철저히 분석, 분류하여 유형을 세밀하게 나누어 내신유형을 완벽히 마스터할 수 있도록 하였습니다.2. 각 유형의 모든 문제를 난이도별로 분류하였습니다.전체 구성을 5단계로 구성하고, 이 중 유형 익히기는 하, 중하, 중, 중상, 상의 5단계 난이도로 세분화하여 체계적으로 수학 실력을 키울 수 있습니다.3. 개념원리 중학수학의 핵심문제를 유형화하였습니다.개념원리 중학수학의 핵심문제를 유형화하고 각 유형에 따른 다양한 문제를 실어 이를 통해 응용력과 문제 해결력을 기를 수 있도록 하였습니다. 따라서 개념원리 중학수학과 연계하여 공부하다 보면 학습 효과가 더욱 높아질 것입니다.[이 책의 특성]1. 개념 핵심 정리 : 교과서 내용을 꼼꼼히 분석하여 핵심 개념만을 모아 알차고 이해하기 쉽게 정리하였습니다.2. 교과서 문제 정복하기 : 학습한 정의와 공식을 적용하여 해결할 수 있는 기본적인 문제를 충분히 연습하여 개념을 확실하게 익힐 수 있도록 구성하였습니다.3. 유형 익히기 : 문제 해결에 사용되는 핵심 개념·정리를 제시하고, 문제의 형태 및 풀이 방법 등에 따라 문제를 유형화하여 구성하였습니다.4.유형 UP : 발전된 유형을 모아 문제의 형태 및 풀이 방법 등에 따라 문제를 유형화하여 구성하였습니다.5. 중단원 마무리하기 : 단원이 끝날 때마다 중요 문제를 통해 유형을 익혔는지 확인할 수 있을 뿐만 아니라 실전력을 기를 수 있도록 하였습니다.6. 실력 테스트 : 중단원을 학습한 후 테스트를 통해 나의 실력을 확인해 볼 수 있도록 하였습니다."
고등 사회탐구영역 생활과 윤리2020)(2021 수능대비)(8절)(EBS Final 실전모의고사) 2015 개정 교육과정 첫 수능,편집부,0.0점, 0,학습/참고서,,,"〈FINAL 실전모의고사 사회탐구영역 생활과 윤리〉2015 개정 교육과정 첫 수능, 기출로는 부족하다!2021학년도 수능 완벽 대비는 EBS 모의고사 시리즈와 함께!EBS의 첫 번째 모의고사 시리즈 ""FINAL 실전모의고사“수능과 동일한 난이도의 신규 모의고사 ‘9회분’ 제공2021학년도 수능 리허설!작년 수능과 동일한 배점과 비슷한 난이도로 구성하되, 각 회 별로 고난도 문항을 포함시켜 2021학년도 수능 대비 실전력을 한층 강화시킬 수 있도록 하였습니다.명확한 해설!쉽고 상세한 해설을 선택지별로 제시함으로써 정답이 되는 이유와 오답이 되는 이유를 명확하게 파악하도록 하였습니다.EBSI 100% 무료강의 제공고교강의의 중심, EBSI에서 제공하는 100% 무료 강의를 인터넷 홈페이지 / 스마트폰 ‘EBS 고교강의’ 앱을 통해 들을 수 있습니다.","2015 개정 교육과정 첫 수능, 기출로는 부족하다!2021학년도 수능 완벽 대비는 EBS 모의고사 시리즈와 함께!EBS의 첫 번째 모의고사 시리즈 ""FINAL 실전모의고사“수능과 동일한 난이도의 신규 모의고사 ‘9회분’ 제공2021학년도 수능 리허설!작년 수능과 동일한 배점과 비슷한 난이도로 구성하되, 각 회 별로 고난도 문항을 포함시켜 2021학년도 수능 대비 실전력을 한층 강화시킬 수 있도록 하였습니다.명확한 해설!쉽고 상세한 해설을 선택지별로 제시함으로써 정답이 되는 이유와 오답이 되는 이유를 명확하게 파악하도록 하였습니다.EBSi 100% 무료강의 제공고교강의의 중심, EBSi에서 제공하는 100% 무료 강의를 인터넷 홈페이지 / 스마트폰 ‘EBS 고교강의’ 앱을 통해 들을 수 있습니다."
주니어 리딩튜터 Level 1 즐거운 독해가 만드는 실력의 차이,능률영어교육연구소,10.0점, 26,학습/참고서,,,"1) 소개글중학 영어 독해 기본기를 다지고 싶은 초6-예비중1 학생들을 위한 2019년 개정판 주니어 리딩튜터 LEVEL 1! 다양하고 재미있는 소재의 지문과 함께 유익한 정보를 쏙쏙 채워주는 배경지식 및 재미있는 읽을거리를 제공한다. 최신 학습 경향을 반영한 유형의 문제로 중학 영어 독해 실력 기본기를 위한 교재이다.2) 특장점1. 체계적인 학습을 위한 시리즈 구성 및 난이도- 렉사일 지수 및 단어 수를 기반으로 개발된 객관적인 단계 구분- 렉사일 지수: 미국 교육연구소인 METAMETRICS가 개발한 미국에서 가장 공신력 있는 영어 읽기 지수2. 양질의 지문과 문제, 풍부한 배경지식, 다양한 단어 퍼즐, 재미있는 읽을 거리를 통한 영어 독해 학습- 학습 전 소재를 확인하고 그에 대해 생각할 기회를 제공하는 THINK!- 지문에 대한 배경지식 및 관련 상식을 쌓을 수 있는 KNOWLEDGE BANK - 각 섹션에서 배운 어휘와 숙어를 확인하는 REVIEW TEST - 각 섹션별 본문과 연관된 흥미로운 주제의 쉬어가기 코너 3. 최신 트렌드를 반영한 더욱 다양하고 흥미로운 내용의 지문과 문제- 독해 실력이 향상되는 서술형 문제 강화- 학생들이 호기심을 가지고 접근할 수 있는 소재 선정- 중등교육과정의 중요 어휘와 문법 반영4. 자습의 편의성을 높여주는 친절한 정답 및 해설- 정답의 이유를 쉽게 설명해 주는 친절한 문제 해설- 지문을 빠르게 해석할 수 있는 방법을 보여주는 직독직해 코너 - 해석이 안 되는 부분이 없도록 도와주는 구문 해설 5. 주니어 리딩튜터로 공부하는 학습자들이 누리는 혜택- 직독직해 WORKSHEET- QR코드로 듣는 지문- 어휘 암기장- 지문 MP3 파일",
마더텅 수능기출 모의고사 35회 생활과 윤리 2021 수능대비,마더텅 편집부,0.0점, 0,학습/참고서,고등학교,수능문제집,"시험 당일 실제 상황과 동일한 환경에서 35번 반복 연습 가능실제 시험지 모양을 그대로 재현 / 수능과 똑같은 실전용 OMR 카드 제공 / 시험장 상황을 체험할 수 있는 안내 방송 MP3 제공기출문제로 만들 수 있는 최다 구성 35회분!5개년 수능 및 모의평가 15회 + 5개년 학력평가 20회, 700문항 수록수능 완전 정복을 위한 〈기출 OX 678제〉 특별 부록 수록단원별로 문제를 풀고자 하는 학생, 취약한 부분의 문제를 집중적으로 풀고자 하는 학생들을 위한 단원별 문항 분류표 제공자가 진단을 위한 회차별 등급컷 제공전 문항 정답률 표기","1.시험 당일 실제 상황과 동일한 환경에서 35번 반복 연습 가능실제 시험지 모양을 그대로 재현 / 수능과 똑같은 실전용 OMR 카드 제공 / 시험장 상황을 체험할 수 있는 안내 방송 MP3 제공2.기출문제로 만들 수 있는 최다 구성 35회분!5개년 수능 및 모의평가 15회 + 5개년 학력평가 20회, 700문항 수록3.수능 완전 정복을 위한 [기출 OX 678제] 특별 부록 수록4.단원별로 문제를 풀고자 하는 학생, 취약한 부분의 문제를 집중적으로 풀고자 하는 학생들을 위한 단원별 문항 분류표 제공5.자가 진단을 위한 회차별 등급컷 제공6.전 문항 정답률 표기"
"쎈연산 중학 수학 중1-1 2019,수학 기본기 강화 프로젝트",홍범준,9.93점, 36,학습/참고서,중학교,중1 문제집,1. 친절한 개념 설명이해하기 쉬운 개념 정리와 기억하기 쉬운 도식화를 제공하여 체계적인 개념 학습이 가능하도록 구성하였습니다. 또한 선수 단계 내용을 제시하여 한 권으로 개념 완전 학습이 가능합니다.2. 기본 문제 집중 반복 학습 가능개념 적용 훈련을 집중적으로 할 수 있도록 기본 문제를 충분히 제공하였습니다. 또 같은 유형의 문제를 '풀이 과정 연습→따라 하기→반복 연습' 과정을 따를 수 있도록 단계별로 구성하였습니다.3. 기본 실전 문제 구성학교 시험 문제 중 자주 출제되는 기본 실전 문제를 통해 실력을 점검할 수 있습니다.4. 효율적인 자기주도학습 가능스스로 계획을 세우고 성취도를 점검할 수 있도록 학습 플래너를 제공하였습니다.,"[특징]1. 수학 기본기 강화를 위한 최적의 학습 시스템2. 빈틈없는 개념 학습과 체계적인 개념 적용 반복 훈련3. 학습 편의를 위해 학습 플래너, 빠른 정답 제공 수학 기본기 강화 프로젝트 [쎈연산]1. 학습자 눈높이에 맞춘 개념 설명으로 개념을 쉽게!2. 충분한 반복 훈련으로 빠르고 정확하게!3. 빈틈없고 체계적인 문제 구성으로 기본기를 탄탄하게![쎈연산]을 통해 정확한 개념 이해를 바탕으로 문제 적용 훈련을 반복함으로써 탄탄한 기본기를 쌓고 자신감을 얻을 수 있습니다!진정한 실력은 탄탄한 기본기에서 시작됩니다. [쎈연산]과 함께 진정한 실력을 키워보세요!"
빠작 중학 국어 비문학 독해 1 독해력과 어휘력을 함께 키우는 독해 기본서,동아출판 편집부,10.0점, 13,학습/참고서,중학교,중1 문제집,"『빠작 중학 국어 비문학 독해』는 교과 학습과 연계된 다양한 주제의 지문을 읽고, 독해력과 어휘력을 함께 키울 수 있는 중학생용 국어 비문학 독해 교재이다.","· 독해력과 어휘력을 함께 키우는 독해 기본서 · 교과 학습과 연계된 다양한 주제의 지문 : 인문, 사회, 과학, 기술, 예술 등 5개 분야에 걸쳐 다양한 주제의 지문을 수록했습니다. 교과 학습과 연계된 유익한 지문, 최신 이슈를 반영한 흥미로운 지문은 읽는 것만으로도 학생들에게 큰 도움이 될 것입니다. · 독해의 기본 원리를 익히는 '지문 분석' : 각 문단의 중심 내용을 정리한 후 이를 바탕으로 글의 구조를 파악하고 주제를 찾아내는 '지문 분석'을 통해 독해의 기본 원리를 익힐 수 있습니다. '지문 분석'은 단답형·서술형 문항으로 되어 있어 학교 시험의 서술형 평가를 대비하기에도 좋습니다. · 지문 이해를 도와주는 '배경지식' : 지문 내용과 관련된 배경지식을 수록하여 지문을 보다 쉽게 이해할 수 있습니다. 배경지식을 차곡차곡 읽다 보면 독해나 논술에 도움이 되는 기초 교양을 자연스럽게 쌓아 나갈 수 있습니다. · 지문과 연계해 익히는 '어휘·어법' : '어휘·어법' 을 통해 지문에 나온 어휘의 의미와 쓰임을 바로 확인할 수 있어서 독해력과 어휘력을 함께 키울 수 있습니다."
EBS 수능완성 사회탐구영역 생활과 윤리 (2020년) 2021학년도 수능 연계교재,EBS(한국교육방송공사) 편집부,0.0점, 1,학습/참고서,,,"2021학년도 대학수학능력시험 연계율 70%!서울 소재 대학교에 진학한 선배들 중 정시 98%, 수시 92.4%가 선택한 EBS 수능완성!*합격한 선배들이 데이터로 입증한 연계교재 'EBS 수능완성'의 힘12월 3일 수능, 직접 느낄 수 있습니다. 1. [유형편]으로 영역별 유형 이해를 점검2015 개정 교육과정 첫 수능에 맞추어 영역별 기본적으로 알아 두어야 할 출제 유형을 풀어 보며 스스로 취약한 문제 유형이 무엇인지 쉽게 파악할 수 있습니다. 자세한 유형 설명과 정답 해설로, 보다 정확한 유형 이해가 가능합니다.2. [실전편]으로 실전 능력 UP최근 대학수학능력시험 및 모의평가 문항을 철저하게 분석하여 실전과 가장 가까운 문항을 수록하였습니다.실전처럼 구성된 ""5회분의 실전 모의고사""로 실전 감각을 키울 수 있습니다. +기출로 부족한 2015 개정 교육과정 첫 수능!실전 학습이 더 필요하다면 〈EBS 모의고사 시리즈〉를 만나보세요.① FINAL 실전모의고사 (5월 출시)② 만점마무리 봉투모의고사 (7월 출시)③ 고난도 시크릿X 봉투모의고사 (9월 출시)흔들리지 않는 수능 자신감, EBS가 함께합니다.*설문 결과: 서울 소재 대학생 1000명 대상 설문조사 (한국리서치, 2019)",
