title,author,score,num_reviewers,main genre,middle genre,subclass,introduction,review제과제빵기능사 필기 유튜버 빵선생의 과외교실(2021) 유튜버 빵선생의 과외교실,김연진,0.0점, 0,가정/생활/요리,요리,,● 이 책의 특징1.핵심요약노트2.CBT체험형 기출문제3.저자직강 유튜브 채널 운영4.NCS 국가직무능력표준 교육과정 반영,
매일 한끼 비건 집밥,이윤서,0.0점, 4,가정/생활/요리,요리,테마별요리,"쉽고 맛있는 101가지 비건 요리건강, 환경, 신념… 채식을 하는 이유는 다양해지고 채식인은 늘고 있지만 아직 채식을 실천하기 편한 환경에 놓여 있지는 않습니다. 채식 요리를 먹을 수 있는 식당은 많지 않고 비건 식재료는 여전히 구하기가 쉽지 않지요. 집에서 먹는 음식 의존도가 높지만 알려진 요리법 또한 한정적이고요. 채식을 지속하기엔 많은 노력이 필요해보입니다.『매일 한끼 비건 집밥』은 채식을 포기하지 않고 이어 나갈 수 있게 도와주는 요리책입니다. 채식을 하기로 마음 먹고 직접 요리를 하다 보면 곧 메뉴의 한계에 다다라서 같은 음식을 반복해서 만들게 됩니다. 이런 어려움에 부딪히지 않도록, 뭘 먹을지 고민하지 않고 즐거운 채식 생활을 할 수 있도록 다채로운 레시피를 담았습니다. 이 책은 채식, 그 중에서도 엄격한 비건 요리를 무려 101가지나 제안합니다. 채식도 실천하기 힘든데 달걀, 유제품을 먹지 않는 비건은 더 힘들지 않을까, 선입견은 갖지 마세요. 우리가 흔히 먹는 재료로 만드는 접근성 좋은 비건 요리만을 선별했으니까요. 레시피 외에도 요리를 하기 전, 식재료와 활용법 등 채식의 기본을 차근차근 짚어줘서 채식을 시작해볼까, 고민하는 초보부터 채식 고수까지도 두루 도움이 될 것입니다.『매일 한끼 비건 집밥』을 통해 채소를 보고, 만지고, 요리하면서 식재료를 알아가는 즐거움과 함께 자연이 주는 좋은 에너지를 느껴보세요. 하루 한끼부터 천천히 시작해도 좋고 맛있는 비건식을 한번 맛본다는 생각으로 가볍게 시작해도 좋습니다. 무엇으로 시작했든 『매일 한끼 비건 집밥』이 그 시작을 지속할 수 있도록 도움을 줄 것입니다.","하루에 한 번, 31일간의 비건식비건은 식사를 할 때마다 김치, 국물, 샐러드 드레싱까지도 어떤 재료가 들어갔는지 꼼꼼히 살펴야 합니다. 때문에 먹을 수 있는 음식의 폭은 줄어들고, 요리법도 한정적인 것처럼 느껴집니다. 다채로운 비건식을 먹을 수 있게 가르쳐주는 가정 요리책이 있다면 얼마나 좋을까요?『매일 한끼 비건 집밥』은 우리 입맛에 맞는 채식 요리를 제안합니다. 밥과 국수, 빵과 파스타, 한식과 서양식, 그리고 일상식부터 근사한 메뉴까지… 모두 집에 있는 재료로 만드는 법을 알려드려요. 또한 초보는 식단 구성이 쉽지 않으므로 영양과 맛을 고려한 정식 메뉴로 구성했습니다.비건을 시작한다고 해서 즐겨 먹던 메뉴를 포기하지 마세요! 『매일 한끼 비건 집밥』에서는 그 메뉴 그대로 즐길 수 있도록 대체 재료로 맛을 재현합니다. 콩고기 같은 특수 재료가 아니라 냉장고 속에 있는 식재료를 사용하지요. 비건이라면 꼭 필요한 채수, 비건소스, 비건치즈 등은 집에서 직접 만들 수 있게 저자의 노하우가 담긴 레시피를 공개합니다.30일 이상 같은 일을 지속하면 습관이 됩니다. 채식 습관을 만들 수 있도록 이 책에서는 31일간의 식단을 제안합니다. 그대로 따라하면 채식을 편하게 이어나갈 수 있습니다. 1일부터도 좋고 원하는 메뉴를 먼저 먹어도 됩니다. 하루에 한끼로 시작해서 차츰 횟수를 늘려가도 좋겠지요. 하지만 무엇보다 꾸준히 실천하기를 권합니다. 31일 후, 달라진 몸의 변화를 느낄 수 있을 테니까요.#비건 초보부터 고수까지 도움이 되는 식재료 레슨#하루 한끼, 정식 메뉴로 구성#홈메이드 소스와 치즈... 어디에서도 찾기 힘든 비건 소스 레시피#플레이팅과 도시락 싸는 법 등 팁 공개#두부, 이색 곡물, 템페 등 비건 식재료의 다채로운 활용법#채식에 대해 궁금한 것들과 식재료 구입처"
커피는 어렵지 않아 그림과 함께 배우는 커피 입문서,세바스티앵 라시뇌,10.0점, 7,가정/생활/요리,요리,차/술/음료,"커피, 아는 만큼 맛있다“싱글오리진 또는 블렌딩커. 에스프레소 또는 필터커피. 우유를 넣거나 아니면 넣지 않거나. 커피에 대해 알면 나만의 커피도 개성있게!” 유명 브랜드의 커피전문점이 수도 없이 생기고 고가의 커피머신도 이제는 웬만한 가정에 갖춰져 있어 집에서 직접 자신만의 커피를 즐기려는 사람들이 많아졌다. 가정에서 커피를 추출하는 방법은 매우 다양하다. 빠르게 추출할 수는 있으나 비교적 고가인 캡슐머신, 에스프레소머신 등의 커피머신이 있고, 시간은 걸리지만 부담 없는 가격의 몇 가지 기구만 갖추면 추출할 수 있는 칼리타드리퍼, 프렌치프레스, 모카포트 등의 추출기구도 있다.그렇다면 이런 기구들만 있다고 모두가 맛있는 커피를 만들 수 있을까? 아니다. 자신이 만든 커피가 생각했던 것과는 달리 맛이 없어서 실패한 경험이 많을 것이다. 그럼 실패하지 않고 커피의 향미를 제대로 살리는 방법은 무엇일까? 중요한 것은 커피 추출에 영향을 주는 주요 변수들이 무엇이고, 이 변수들을 어떻게 긍정적으로 작용시켜 맛있는 커피로 조절하느냐이다. 이 책에서는 커피추출을 크게 에스프레소와 필터커피로 나누고, 기본 변수인 원두 분쇄 굵기, 커피가루의 양, 물양, 추출온도, 추출시간, 추출량 등을 정확히 맞추어 커피의 향미를 온전히 추출하는 방법을 알려준다.","알면 알수록 어려운 커피의 세계그림과 함께 커피에 대한 모든 것을 쉽고 재미있게 배운다이 책은 [커피이야기], [커피추출], [로스팅], [커피재배]의 4개 챕터로 나누어 커피에 관한 모든 것을 설명하고 있다. 특히 로스팅은 커피의 기본재료인 원두를 만드는 과정으로 과학적 원리를 쉽게 이해시키고 있다. 커피의 역사, 종류, 재배 등의 소소하고 재미있는 이야기부터 물이나 로스팅, 커피머신의 작동원리 등 조금은 복잡한 과학이야기까지 모두 개성 있는 그림을 곁들여 이해하기 쉽게 설명하고 있어 어렵지 않다. 커피판매자, 로스터, 바리스타 등 커피와 관련된 모든 사람들이 쉽고도 재미있게 커피를 알아가고 궁금증을 풀어가는 커피교과서가 되리라 확신한다. 맛있는 한 잔의 커피로 모두 행복해지세요."
"하루 5,000원 집밥 만능 레시피북 외식과 배달음식에 지친 당신을 위한 현실 집밥 108",강지현,10.0점, 30,가정/생활/요리,요리,,"식비와 조리시간 둘 다 절약하는 겨울딸기의 초알뜰 집밥 레시피하루 평균 5,000원이면 2~3인 집밥이 뚝딱!집밥에 도전해보고 싶은 요린이, 귀차니스트, 독거인들에게도 추천!집밥 고수 ‘겨울딸기’의 바쁜 당신을 위한 빠른 집밥 레시피!* 쉽고 빠른 홈쿡 1위 저자이자 3,400만이 다녀간 인기 요리 블로거 겨울딸기의 집밥 요리* 식재료 쇼핑 주 1회, 1주일 예산 3~4만 원, 하루 5,000원꼴로 만드는 알뜰 집밥* 소, 돼지, 닭, 해산물 등 다양한 단백질 재료를 기본으로 하는 4주 레시피 수록* 각 주차별 장바구니 리스트와 실제 영수증 공개* 각 레시피마다 조리 시간, 보관 기간 표기* 빠르고 알뜰한 집밥 차리기 필수 포인트인 재료 냉동 요령 수록* 모든 메뉴는 10~15분에 완성외식, 배달음식, 무계획적인 대량 장보기에서 벗어나 경제적으로 장을 보고 그 재료를 100% 활용하여 일주일 내내 먹을 수 있는 다양한 요리를 만들 수 있는 방법을 알려주는 요리책이다. 일주일에 한 번씩 장을 봐서 15가지 이상의 반찬, 국, 샐러드 등을 만드는 방법을 4주 각기 다른 메뉴 구성으로 담았다. 주차별로 닭고기, 삼겹살, 해물류 등의 메인 재료 한 가지씩을 잡아 낭비 없이 사용하는 다양한 재료 활용 방법을 보여준다. 주요 4대 서점 요리 분야 베스트셀러 1위를 기록한 〈에어프라이어 만능 레시피북〉의 저자이자 집밥 쿠킹 클래스를 운영 중인 ‘겨울딸기’가 실제 집에서는 어떤 반찬을 해먹는지 보여주는 이 요리 책은 ‘반찬 없을 때 다른 집에서는 대체 뭘 해먹고 사나’ ‘모처럼 장을 봐도 요리 아이디어가 없어 한 가지 겨우 해먹고 재료 다 버리기 일쑤’라는 집밥 요린이들이 조리 아이디어를 얻을 수 있는 현실 집밥 메뉴판이라 할 수 있다. 알뜰해도 맛과 영양은 꽉꽉 채운 실속 집밥 레시피 108 & 장보기, 재료 보관 꿀팁소고기, 돼지고기, 닭고기, 생선류 등 다양한 단백질과 그에 어울리는 채소로 구성한 일주일 식단 4세트부터 간단히 먹는 한 그릇, 푸짐한 주말 메뉴, 집밥의 핵심인 김치 활용 요리까지 지금 당장 따라 할 수 있는 생활 밀착형 요리 108개가 담긴 이 책은 음식 레시피 외에 SNS에서 가장 많이 하는 집밥 질문, 알뜰 장보기 노하우, 남은 재료 활용법, 요리 속도 올리는 치트키 음식, 냉동 보관 노하우까지 집밥에 필요한 모든 포인트를 꼼꼼히 담고 있다. ‘외식비 ZERO’에 도전하는 알뜰족은 물론, 늦은 퇴근으로 시간이 없는 사람, 요리를 싫어하는 사람, 요리하는 게 무서운 사람, 반복되는 뻔한 식단 때문에 고민하는 사람, 건강을 걱정하는 사람 모두를 위한 요리책이 될 것이다.","알뜰해도 맛과 영양은 꽉꽉 채운 실속 집밥 레시피 108 & 장보기, 재료 보관 꿀팁소고기, 돼지고기, 닭고기, 생선류 등 다양한 단백질과 그에 어울리는 채소로 구성한 일주일 식단 4세트부터 간단히 먹는 한 그릇, 푸짐한 주말 메뉴, 집밥의 핵심인 김치 활용 요리까지 지금 당장 따라 할 수 있는 생활 밀착형 요리 108개가 담긴 이 책은 음식 레시피 외에 SNS에서 가장 많이 하는 집밥 질문, 알뜰 장보기 노하우, 남은 재료 활용법, 요리 속도 올리는 치트키 음식, 냉동 보관 노하우까지 집밥에 필요한 모든 포인트를 꼼꼼히 담고 있다. ‘외식비 ZERO’에 도전하는 알뜰족은 물론, 늦은 퇴근으로 시간이 없는 사람, 요리를 싫어하는 사람, 요리하는 게 무서운 사람, 반복되는 뻔한 식단 때문에 고민하는 사람, 건강을 걱정하는 사람 모두를 위한 요리책이 될 것이다."
마시멜로(Marshmallow)(유아시스 인기 클래스 2) 노 오븐 디저트,김소우,10.0점, 1,가정/생활/요리,요리,빵/케이크/과자,"인기 클래스 ‘유아시스(UASIS)’에서 알려주는 마시멜로에 대한 모든 것!전작인 『MERINGUE COOKIE 머랭 쿠키』의 시리즈로, 이번에는 ‘마시멜로’를 만드는 모든 과정과 노하우를 인기 클래스 방식 그대로 담았다. 마시멜로를 만들기 전 꼭 알아야 할 기본 이론을 비롯해 맛을 첨가하는 법, 식감을 조절하는 법, 반죽을 조색하는 법 등 다양한 테크닉을 알기 쉽게 설명한다. 또한 기본 마시멜로뿐 아니라 살아 움직일 것 같은 입체적이고 앙증맞은 캐릭터 마시멜로 테크닉을 가감 없이 공개하고, 고난도 테크닉은 동영상으로 참고할 수 있도록 QR코드를 수록했다. 아이스크림 마시멜로, 생과일 마시멜로 퐁듀, 마시멜로 초콜릿 쿠키, 우피 파이 등 마시멜로를 활용한 다양한 디저트 레시피도 함께 담아, 집에서도 색다른 디저트를 즐기고 싶은 베이킹 초보자는 물론 새롭고 이색적인 카페 메뉴를 고민하는 이들에게도 도움이 되도록 했다. 맛있고, 귀엽고, 개성 넘치는 말랑말랑 마시멜로의 매력에 빠져보자.","이 책은 베이킹 입문자, 디저트의 실패 원인과 해결 방법을 알고 싶은 베이킹 초보자, 이색적인 사업 아이템이 필요한 예비 카페 창업자, 각 매장만의 특색 있는 신메뉴를 개발하고 싶은 디저트샵 또는 카페 사장님 분들 모두에게 추천합니다. 책을 통해 머랭과 마시멜로의 세계를 더 많은 분들이 함께 알고 즐길 수 있는 기회를 마련하고 싶었습니다.제가 마시멜로에 관한 책을 출간할 줄은 저 역시 예상하지 못했습니다. 단순한 호기심으로 초콜릿 라테 위에 귀여운 마시멜로를 올려봤는데, 그것이 상당한 호평을 받았고 해당 메뉴는 가장 인기 있는 메뉴가 되었습니다. 그리고 이 일을 계기로 더 많은 사람들이 더 다양하게 즐길 수 있도록 마시멜로 레시피와 제조법을 개발하기 시작했습니다. 처음 도전하는 영역이라 시행착오도 많았지만 결국 마시멜로를 가장 맛있게 만드는 법을 찾았습니다. 재료 자체의 품질도 중요하지만 다른 재료와 어떻게 조합해야 최적의 맛을 내는지 저만의 비결을 이 책에 녹여냈습니다. 요리에 대한 지식이나 기술이 조금 부족해도 이 책의 레시피만 잘 따라 한다면 누구나 제 매장에서 느꼈던 마시멜로의 달콤함과 즐거움을 느낄 수 있을 것입니다."
채식 연습 천천히 즐기면서 채식과 친해지기,이현주,0.0점, 10,,,,"채식에도 연습이 필요할까요?“채식이 뭐 별건가, 그냥 밥상에서 고기만 빼면 되지.”채식에 대해 이렇게 생각하는 분들이 많습니다. 사실 틀린 말은 아니지요. 하지만 고기만 뺀 단순한 채식은 먹는 즐거움이 떨어지고, 영양 불균형도 생겨 오래 이어가기 어렵습니다. 그렇다고 매끼 채식을 완벽하게 해야 한다는 강박증 역시 채식의 지속 가능성을 떨어뜨리지요. 채식을 제대로 즐기기 위해서는 연습이 필요합니다.이 책은 건강이나 환경, 동물권 등 여러 가지 이유로 채식 라이프에 도전하려는 분들이 부담과 강박에서 벗어나, 천천히 즐기면서 채식과 친해지는 연습의 과정들을 안내하고 있습니다. 첫 단계에서는 지금까지 내 식생활을 돌아보고 점검하는 것부터 시작합니다. 이어 채식의 가치와 이점을 짚어보고, 슬기로운 채식 생활을 위해 알아두면 유용한 장보기, 재료 관리, 쿠킹 포인트 등 실질적인 정보들을 알려드립니다.본격적인 채식 요리편에서는 채소에 대한 감수성을 높이는 심플하면서도 새로운 채식 레시피, 일주일에 하루 실천하는 아침?점심?저녁 채식 레시피, 운동이나 보양, 스트레스 등 채식하기 어려운 상황을 위한 채식 레시피, 혈당과 혈압, 뱃살, 빈혈, 가려움증 등을 완화시키는 증상별 채식 레시피까지 100여 가지의 채식 메뉴들을 소개하고 있습니다.한 그릇 밥과 면부터 죽과 수프, 샌드위치와 샐러드, 반찬과 국물, 일품요리, 브런치와 디저트, 건강 음료까지 다채롭게 다루었으니 채식을 시작하는 분들은 물론 이미 채식을 하고 있지만 좀 더 다양한 레시피가 필요한 분들에게도 많은 도움이 될 겁니다.폭넓은 내용과 채식 레시피를 한 권에 담을 수 있었던 건 저자 이현주 박사의 풍부한 경험과 지식 때문입니다. 서른 중반의 나이에 마음의 건강을 위해 우연히 채식을 시작했던 그녀는 현재 17년째 채식을 실천하고 있는 한약사이자 환경운동가입니다. 녹용과 같은 동물성 약재 대신 순식물성 약재와 채식 식단만 처방하는 독특한 한약국을 운영하고 있으며, 일주일에 하루 채식을 통해 지구를 살리자는 글로벌 환경운동 ‘고기없는월요일’의 한국 대표도 맡고 있지요.한약사로서 많은 환자들을 만나 채식을 처방하고, 또 글로벌 환경운동가로서 채식 문화가 발달한 나라들의 다양한 채식 요리들을 접했던 저자는 이 책에 식재료의 성질과 영양을 고려한 더 건강한 채식, 또 새롭고 맛있고 아름다운 채식을 풍부하게 담고자 노력했습니다. 실제 이 메뉴들은 그녀가 17년간 채식을 즐겁게 지속할 수 있었던 원동력이 되었다고 합니다.마지막으로 이현주 저자는 ‘고기없는월요일’에서 지향하는 것처럼, 일주일에 하루 정도 내 일상에서 허용 가능한 범위의 채식만큼은 꼭 실천해보라고 권합니다. 비건(완전 채식)이 아니더라도, 이렇게 채식 지향자가 되는 것만으로도 나와 지구의 건강을 위한 소중한 선택이기 때문입니다."," 이 책을 꼭 만나보았으면 하는 분들√ 채식을 처음 시작하는 이들이라면 누구나√ 다양한 레시피로 지속 가능성을 높이고 싶은, 이미 채식을 하는 분들√ 고기가 잘 맞지 않아 채식 위주로 식사를 하는 분들√ 건강과 다이어트 등을 위해 채식을 실천하려는 분들√ 나와 지구의 건강을 위해 채식에 대해 조금 더 알고 싶은 분들 이 책의 특징1단계 내 밥상 돌아보기- 지금껏 내가 먹어온 음식들- 현재 나의 푸드 라이프스타일 점검하기2단계 채식 시작 전 알아두기- 채식의 의미와 유형, 조리 포인트- 현명한 장보기와 재료 보관법- 채식에 많이 쓰는 양념, 허브와 향신료, 재료들- 미리 만들어두는 홈메이드 비건 식품과 소스, 채수3단계 채소 감수성 키워주는 채식 시작하기- 채소와 과일의 매력을 고스란히 담은 쉽고 심플한 채식. 채소롤, 뿌리채소구이, 과일구이, 채소 스테이크, 채소국수4단계 일주일에 하루, 채식 실천하기- 하루의 시작을 상쾌하게 해주는 아침 채식 - 도시락으로도 좋은, 영양 가득한 점심 채식 - 속이 편하고 숙면에 도움이 되는 저녁 채식5단계 이런 때, 이런 날에도 채식해보기- 운동 전후 단백질, 수분 듬뿍 채식- 지치고 힘든 날에는 든든한 채소 보양식- 스트레스가 많고 우울할 때는 기분 전환 채식- 특별한 날 내놓아도 손색없는 홈 파티용 채식6단계 건강을 위협하는 증상들, 채식으로 관리하기- 뱃살, 고혈압과 고혈당, 빈혈과 어지럼증, 뼈 건강, 피부 가려움증 등의 증상을 완화해주는 식재료를 활용한 채식"
커피로스팅,스콧라오,0.0점, 11,가정/생활/요리,요리,차/술/음료,"이 책 『커피 로스팅』 은, 커피 바리스타, 로스터, 컨설턴트로 활약해 왔으며 '『The Professional Barista's Handbook』 으로 잘 알려져 있는 스캇 라오(Scott Rao)의 원저 『The Coffee Roaster's Companion』 를 우리말로 옮긴 것입니다. 로스팅의 목적, 생두와 로스팅 이론 등 기본적인 내용에서부터 온도상승율(ROR), 발현 시간(DT) 등, 커피 로스팅 분야에서 가장 최근 이슈로 떠오르고 있는 사안까지 망라하여 10년이 넘는 현장 로스팅 및 로스팅 컨설팅 경험을 토대로 접근하고 있습니다. 특히 도입부와 머리말에서 저자가 직접 언급하였듯이, 이 책은 드럼 로스터를 사용하여 8-16분간 볶는, 스페셜티 커피 업계에서 주로 사용하는 로스팅 방식에 초점을 두고 있으며, 직감이나 추정과 같은 접근법 대신 데이터 로거, 굴절계와 등 과학적 도구를 사용하여 측정 가능하고 일관성을 달성하기 쉬운 접근법을 추구하고 있습니다. 과학적 방법 찾기를 추구하는 그의 탐구 자세는 가장 효율적이면서 실용적인 로스팅 기술 지식을 제공해 주고 있습니다.","커피 업계에서는 진부할 정도의 표현이겠지만, 커피 로스팅은 생두가 원두로 화하는 극적인 순간을 만들어 내는 작업입니다. 커피는 로스팅을 거쳐 본연의 향과 맛을 발현하게 되고, 원두 커피라는 높은 부가 가치를 지닌 상품이 됩니다. 커피 애호가 분들에게 사랑 받는 한 잔의 커피는 이 원두 커피를 알맞은 방식으로 추출하여 탄생합니다. 커피 산업의 초점이 점차 산지로 이동해가고 있는 현 시점에도, 커피 로스팅의 중요성 그 자체는 여전히 막대합니다. 아니, 향미 면에서 보다 탁월한 생두가 등장하면서 이들의 잠재력을 온전히 발현할 수 있도록 하는 로스팅의 위상은 더욱 높아진 상태입니다. 그렇기에 커피 분야의 아마추어와 전문가 할 것 없이 모두, 훌륭한 로스팅을 이룩하기 위해 노력하고, 완벽한 로스팅 기법을 찾아내고자 경주하고 있습니다. 본서 『커피 로스팅』 (원서 : The Coffee Roaster's Companion) 의 원저자 스캇 라오(Scott Rao)는 머리말에서 훌륭한 로스팅에 대해 아래와 같이 서술하고 있습니다. 그는 다양한 자신의 로스팅 경험에 더하여 여러 로스팅 업체에 대한 컨설팅 경험을 통해 다양한 로스팅 머신들을 다루었고, 길고 많은 경험 속에서 훌륭한 로스팅 배치는 커피콩이나 로스터와는 관계 없는 고유한 패턴이 있음을 발견했습니다. 그는 다시금 그 패턴을 검증하고 다듬어 내었고, 그 결과물은 본서의 핵심적인 기본 내용으로 자리하고 있습니다. 스캇 라오는 특히, 과학적 도구와 방법을 통해 로스팅 결과물을 측정함으로써 로스팅을 평가하는 것을 강조하고 있습니다. 그는 이를 통해 성공적인 로스팅, 즉 생두에 잠재된 훌륭한 향미가 온전히 발현된 결과물을 만들어 낼 수 있으며, 작업자 자신이 원하는 한 이러한 성과를 지속적으로 반복할 수 있다고 말합니다. 과학적 방법 찾기를 추구하는 그의 탐구 자세는 가장 효율적이면서 실용적인 로스팅 기술 지식을 제공해 주고 있습니다"
"원큐패스 한식조리기능사 필기 새 출제기준과 NCS학습모듈을 적용한 합격 필승법!,2020",이현경,10.0점, 15,가정/생활/요리,요리,,"현장 조리 교사의 지피지기 필승법 대공개!큰 글자, 보기 좋은 편집으로 기분 좋게 합격하세요!『2020 최신판 한식조리기능사 필기』는 공통과목에서 종목별 평가로 변경되며 2020년부터 확 달라진 출제기준을 완벽히 반영한 교재입니다. 특히 조리를 현장에서 가르치는 선생님이 직접 엮은 이론과 문제만 반복해도 합격할 수 있는 지피지기 문제를 선별했습니다. 챕터별 핵심이론과 지피지기 문제를 학습한 뒤 핵심이론의 별표와 형광펜 표시를 따라 중요한 내용은 한 번 더 학습합니다. 지피지기 문제에서 헷갈리는 문제(△), 모르는 문제(×)를 복습하여 오답노트로 활용합니다. 실전모의고사는 QR코드를 통해 모바일로도 풀어보며 CBT 시험을 준비합니다. 실전모의고사 해설 중 색칠된 부분을 요약집으로 활용합니다.","이 책의 특징-큰 글자, 보기 좋은 편집-2020년 출제기준, NCS 교육과정에 맞는 핵심 이론-문제만 반복해도 합격할 수 있게 엄선한 지피지기 문제-모바일로도 풀어볼 수 있는 실전모의고사 5회분"
