title,author,score,num_reviewers,main genre,middle genre,subclass,introduction,review컬러의 힘,캐런 할러,0.0점, 26,예술/대중문화,미술,디자인,"누구에게나 삶을 바꿔줄 자기만의 컬러가 있다!지난 20년간 색의 힘을 세상에 알리는 데 전념해온 세계적인 응용색채심리학자인 캐런 할러가 과학과 심리학의 관점에서 색의 힘을 구체적으로 짚어주는 안내서 『컬러의 힘』. 나를 빛나게 하는 인생 색을 찾고 싶고, 내 안의 자존감과 집중력을 높여줄 컬러 톤을 알고 싶고, 우리 브랜드에 긍정적 이미지를 심어줄 컬러 조합을 알고 싶은 사람들에게 과학, 문화, 역사, 심리, 예술을 넘나들며 그간의 연구와 실험, 교육 경험을 농축한 알수록 신기한 색 이야기를 친절하고 경쾌한 목소리로 들려준다.컬러에 대한 기본적 이해는 물론, 일상과 일터에서 삶의 무기가 되어줄 컬러 감각을 본격적으로 키워주는 이 책은 1시간짜리 컬러 컨설팅으로는 부족한 인생 컬러를 스스로 찾을 수 있도록 도와준다. 내 삶을 빛나게 해줄 마법의 컬러를 찾을 수 있도록 컬러 전문가와 아트 디렉터의 협업으로 만들어진 섬세하고 명료한 컬러 팔레트를 페이지마다 담아냈고, 나만의 색을 찾을 수 있는 셀프 테스트를 통해 누구나 나의 색을 발견할 수 있도록 도와준다. 이렇게 나의 심리가 반영된 컬러 팔레트는 삶의 모든 단면에서 긍정적 영향력을 발휘할 것이다.","★ 영국 아마존 베스트셀러 1위(디자인 분야)모든 색에는 에너지가 있다“모든 색은 각자 신비로운 삶을 산다.” 바실리 칸딘스키가 남긴 말이다. 자연에 존재하는 색은 물론, 우리가 오늘 본 모든 색은 나름의 에너지를 지닌 채 그곳에 있다. 그 색들이 과연 어떤 힘을 지니는지 궁금한 적 있는가?이 책은 과학과 심리학의 관점에서 색의 힘을 구체적으로 짚어주는 안내서다. 파랑은 집중력을 높여주어 지적인 활동에 도움을 준다. 침실에 노랑은 금물이다. 노랑은 색채 진동수가 커서 숙면을 방해하기 때문이다. 신체 에너지 수치를 약화시키므로 분홍은 운동 공간에 적절하지 않다. 제각의 색이 지닌 물리적, 화학적 언어를 이해하면 삶의 모든 영역에서 보다 나은 선택을 할 수 있다.저자 캐런 할러는 지난 20년간 ‘색의 힘’을 세상에 알리는 데 전념해온 세계적인 응용색채심리학자다. 응용색채심리학이란 색채와 인간 정신의 관계를 연구하는 색채심리학을 생활공간, 업무 공간, 기업 경영에 실질적으로 적용하는 방법론을 제시하는 실용적인 학문이다. 저자는 과학, 문화, 역사, 심리, 예술을 넘나들며 그간의 연구와 실험, 교육 경험을 농축한 ‘알수록 신기한 색 이야기’를 친절하고 경쾌한 목소리로 들려준다.명상하듯 마음을 정돈시켜 일이 잘되는 색깔이 따로 있다. 자존감과 행복감에 영향을 주는 컬러 배합이 있다. 위험과 불안을 상징하는 색 조합이 있고, 신뢰와 안정을 담아 기업 이미지를 고양시켜주는 컬러가 존재한다. 색이 지닌 힘은 상상 이상이고, 그 언어를 감각적으로, 그리고 논리적으로 이해할 때 우리 삶에 적용 가능한 분야는 무궁무진하다. 저자에 따르면 컬러란 우리 삶을 바꿀 수 있는 가장 강력한 수단이며, 단시간에 효과를 낼 수 있는 감각의 도구다.컬러에 대한 기본적 이해는 물론, 일상과 일터에서 삶의 무기가 되어줄 컬러 감각을 본격적으로 키워주는 책이다. 무엇보다 핵심은 ‘나의 색 발견하기’에 있다. 1시간짜리 컬러 컨설팅으로는 부족한 인생 컬러를 스스로 찾게 한다. 나에게 맞는 진정한 컬러는 단순히 피부 톤보다는 성격, 성향, 심리, 취향과 밀접한 관계에 있고, 나를 가장 잘 아는 건 바로 자기 자신이기 때문이다. ‘토널 배색 팔레트’의 개념으로 나만의 색을 찾을 수 있는 셀프 테스트가 실려 있어 누구나 ‘나의 색’을 발견할 수 있도록 고안되어 있다. 나의 심리가 반영된 컬러 팔레트는 삶의 모든 단면에서 긍정적 영향력을 발휘할 것이다.내 삶을 빛나게 해줄 마법의 컬러, 이 우아하고 지적이며 유쾌한 컬러 팔레트에서 찾아보시길. 모든 색이 신비로운 삶을 살아가듯, 우리 모두 신비로운 삶을 살아가므로."
어반스케치 수업 차근차근 따라 하면 작품이 되는,김도이,10.0점, 5,예술/대중문화,미술,미술실기/기법,"그림 실력이 부족한 초보자도 따라서그릴 수 있는 소소한 나만의 작품, 어반스케치!어반스케치(URBANSKETCH)는 도시의 경관이나 거리, 건물을 그리는 것을 말한다. 출근길 아침 버스 정류장, 자주 가는 단골 카페, 매일 걷는 집 앞 거리 등 매일의 일상부터 즐거운 여행, 사랑하는 사람과 보낸 행복한 시간, 함께하는 반려동물까지 눈앞에 있는 지금 이 순간의 느낌을 남다르게 기록하는 특별한 방법으로 떠오르고 있다.“나는 그림을 잘 못 그려요”라고 미리 겁먹지 말자. 미술을 전문으로 배우지 않은 일반인도 조금만 연습하면 얼마든지 나만의 작품을 그릴 수 있다. 이 책은 선을 그리는 방법부터 도형, 작은 소품, 풍경까지 차근차근 그릴 수 있도록 도와준다. 또한 여러 종류의 펜과 다양한 기법을 소개해 그림 주제에 따라 멋지게 표현하는 방법들을 알려준다.집에 있는 노트와 펜을 들고 집 앞을 나서 보자. 마음에 남는 주변의 모든 것들을 나만의 작품으로 남기는 어반스케치의 매력에 빠져보자!","언제 어디서는 색다른 추억을 남기는 나만의 멋진 방법, 어반스케치!눈앞에 있는 멋진 순간을 남기고 싶을 때 사진보다는 좀 더 특별한 방법으로 기록을 남기고 싶은가? 그림을 그리고 싶은데 왠지 자신도 없고 재주도 없어서 주저하고 있는가? 이 책은 그림을 잘 그리지 못하는 소위 ‘곰손’이라도 매일 꾸준히 즐기다보면 어느새 멋진 나만의 작품을 그릴 수 있도록 도와준다. 초보자여도 쉽게 따라 그리고 완성할 수 있다.차근차근 시작해보는 그리기 수업이 책은 펜을 잡고 그릴 때 손목과 팔의 방향부터 직선, 곡선, 도형까지 순서대로 차근차근 그려볼 수 있도록 친절하게 안내한다. 꼬불꼬불한 선을 이어 그리다보면 다양한 모양의 나무가 되고, 원통을 그려 연습하다보면 따뜻한 음료가 들어 있는 머그잔이 완성된다. 물감을 사용해 간단한 수채화 기법으로 예쁜 꽃도 그려볼 수 있도록 그리는 순서를 단계별로 소개한다. 다양한 느낌을 주는 도구와 드로잉 기법어반스케치는 사용하는 도구에 따라 각각의 특별한 느낌들을 담고 있다. 이 책은 부드러운 느낌을 주는 연필, 채색할 때 편한 라이너펜, 수채화 느낌을 줄 수 있는 플러스펜 등 자신이 좋아하는 스타일이나 상황에 맞는 도구가 무엇인지 이해할 수 있도록 여러 펜으로 그린 스케치들을 모았다. 또한 건물을 지으려면 기초공사가 중요하듯 어반스케치의 전체적인 분위기를 결정하는 드로잉 기법에 대해서도 이해하기 쉽게 소개한다. 보고 그리기에 도전하기차근차근 연습하며 가까운 소재를 능숙하게 그릴 수 있게 되었다면 이제 보고 그리는 것에 도전해보도록 안내한다. 지금 내 눈앞에 있는 것, 쉽게 볼 수 있는 자동차나 오토바이, 좋아하는 명화, 즐거웠던 여행지 사진들을 보며 하나씩 나만의 느낌을 넣어 그려보자. 또한 그림에 입체감을 주기 위해 소실점과 투시도에 대해서도 예시를 들어 설명한다."
"헬로, 리틀프렌즈 컬러링북 리틀프렌즈와 함께한 소중한 순간",미호 편집부,10.0점, 18,예술/대중문화,,,"더 큰 즐거움으로 돌아왔다!리틀프렌즈와 함께 칠하는 일상의 행복한 순간들만나서 반가워! 헬로 리틀프렌즈 컬러링북전국민에게 사랑을 받는 캐릭터 ‘카카오프렌즈’와 출판사 미호가 만나 탄생한 『헬로, 카카오프렌즈』컬러링북! 이번에는 리틀프렌즈와 함께 찾아왔어요. 리틀 라이언, 리틀 어피치, 리틀 튜브, 리틀 콘, 리틀 무지, 리틀 프로도, 리틀 네오, 리틀 제이지. 일곱 명의 친구들과 함께 어린 시절 소중한 추억 속으로 떠나보세요! 카카오프렌즈의 어린 시절 추억을 간직하고 있는 리틀프렌즈는 우리들의 소중했던 순간들을 떠올리게 하여 일상에 또 다른 즐거움을 전달해줄 거예요.| 색칠하면 펼쳐지는 귀엽고 사랑스러운 리틀프렌즈의 하루리틀프렌즈와 함께 소중한 추억 여행을 떠나볼까요? 스키 타기, 캠핑하기, 비눗방울 놀이, 피크닉, 낚시, 쇼핑하기. 새로운 일에 도전하며 신나게 놀고, 특별한 날을 즐기는 리틀프렌즈의 일상에 예쁘게 색을 더해보세요. 내 손으로 칠한 리틀프렌즈를 만나는 시간! 귀엽고 사랑스러운 리틀프렌즈와 함께 행복한 추억 여행을 떠나보세요.| LET'S COLOR LITTLE FRIENDS! 리틀프렌즈와 함께 일상을 다양한 색으로 채워보세요리틀프렌즈의 1년은 어떤 모습일까요? 이번 컬러링북에는 1월부터 12월까지 1년의 이야기를 꽉 담았어요. 계절감이 느껴지는 라인드로잉을 저마다의 색으로 칠해 나만의 그림을 완성하세요. 리틀프렌즈를 색칠하는 순간 다채롭게 살아나는 소중한 순간의 기억들. 칙칙하고 어두운 일상을 다양한 색으로 채워보세요. 울고 웃고 다투고 화해하며 매일을 살아가는 리틀프렌즈와 친구가 되어주세요. | 『헬로, 리틀프렌즈 컬러링북』 100% 활용법! * 집콕 지루함에 온몸이 쑤실 때 * 차분하게 마음을 정리하고 싶을 때* 심심하고 친구가 필요한 날 * 생일이나 특별한 날에 선물로도 제격!마음을 전하고 싶은 사람에게 선물해보세요. 친구들과 함께 칠하거나, 각자 칠해 비교해보세요. 같은 그림이어도 수만 가지의 색으로 다채롭게 완성될 거예요. 일상의 새로운 즐거움 『헬로, 리틀프렌즈 컬러링북』과 즐겁고 활기찬 일상을 맞이하세요!","  색칠하면 펼쳐지는 귀엽고 사랑스러운 리틀프렌즈의 하루리틀프렌즈와 함께 소중한 추억 여행을 떠나볼까요? 스키 타기, 캠핑하기, 비눗방울 놀이, 피크닉, 낚시, 쇼핑하기. 새로운 일에 도전하며 신나게 놀고, 특별한 날을 즐기는 리틀프렌즈의 일상에 예쁘게 색을 더해보세요. 내 손으로 칠한 리틀프렌즈를 만나는 시간! 귀엽고 사랑스러운 리틀프렌즈와 함께 행복한 추억 여행을 떠나보세요.  Let's color little FRIENDS! 리틀프렌즈와 함께 일상을 다양한 색으로 채워보세요리틀프렌즈의 1년은 어떤 모습일까요? 이번 컬러링북에는 1월부터 12월까지 1년의 이야기를 꽉 담았어요. 계절감이 느껴지는 라인드로잉을 저마다의 색으로 칠해 나만의 그림을 완성하세요. 리틀프렌즈를 색칠하는 순간 다채롭게 살아나는 소중한 순간의 기억들. 칙칙하고 어두운 일상을 다양한 색으로 채워보세요. 울고 웃고 다투고 화해하며 매일을 살아가는 리틀프렌즈와 친구가 되어주세요.   『헬로, 리틀프렌즈 컬러링북』 100% 활용법! * 집콕 지루함에 온몸이 쑤실 때 * 차분하게 마음을 정리하고 싶을 때* 심심하고 친구가 필요한 날 * 생일이나 특별한 날에 선물로도 제격!마음을 전하고 싶은 사람에게 선물해보세요. 친구들과 함께 칠하거나, 각자 칠해 비교해보세요. 같은 그림이어도 수만 가지의 색으로 다채롭게 완성될 거예요. 일상의 새로운 즐거움 『헬로, 리틀프렌즈 컬러링북』과 즐겁고 활기찬 일상을 맞이하세요!"
엄지 피아노 칼림바 기초곡집,장진영,0.0점, 1,예술/대중문화,음악,악기/악보집,"1. 칼림바의 기초부터 연주까지 한 권에 담았습니다.2. 숫자악보와 오선악보를 동시에 볼 수 있어, 악보를 잘 몰라도 연주할 수 있습니다. 3. 일부 수록곡은 QR코드 모범연주 영상이 제공되어 음악의 느낌을 더 살려서 연습할 수 있습니다. 4. 화음연주, 합주가 있어 방과후학교, 학원, 특강 등 다양하게 활용할 수 있습니다.5. 페이지를 넘기지 않아도 보이는 만능코드반주패턴 표(부록)가 있어 코드반주 연습이 편리합니다.",
"헬로, 카카오 프렌즈 컬러링 엽서북",미호 편집부,9.82점, 25,예술/대중문화,미술,디자인,"인간적인 매력을 지닌 카카오프렌즈를 색칠하다!《헬로, 카카오프렌즈》컬러링북의 그림 32점을 담아 재구성한 엽서북『헬로, 카카오 프렌즈 컬러링 엽서북』. 작은 가방에 간편하게 수납 가능한 포켓 사이즈로 휴대성과 편리함을 더한 엽서북은 정성스럽게 색칠 한 후 선물용으로도 활용 가능하도록 구성했다.저마다 개성과 인간적인 매력을 지닌 8명의 친구들 카카오프렌즈와 협업을 통해 인기몰이 중인 컬러링북 속 그림을, 색칠하기 부담스럽지 않은 크기로 제작하여 색칠에 자신 없는 초보자들은 물론, 남녀노소 누구나 쉽게 컬러링북에 입문할 수 있도록 구성했다. 뿐만 아니라 한 장, 한 장 깔끔하게 떼어낼 수 있어 인테리어 소품으로도 활용할 수 있다.","나만의 컬러로 꾸민 카카오프렌즈 엽서로 일상에 즐거움을 전해보세요~미호 출판사 ‘헬로, 카카오프렌즈 컬러링 엽서북’ 출시!- 출판사 미호, 지난 9월 출시한 컬러링북 《헬로, 카카오프렌즈》의 그림 32점을 담아 재구성한 엽서북 출시-  미니백에 간편하게 수납 가능한  포켓 사이즈로 휴대성과 편리함을 더해- 정성스럽게 색칠한 엽서를 넣을 수 있는 한정판 엽서봉투 제공, 선물용으로도 활용 가능- 10월 26일부터 전국 오프라인 서점 및 주요 온라인 서점에서 판매 시작| 《헬로, 카카오프렌즈》에서 엄선한 컬러링 엽서 32장이 들어 있어요!출판사 미호가 지난 9월 국민 캐릭터 카카오프렌즈와 협업을 통해 출시하여 베스트셀러 상위권을 차지하며 인기몰이 중인 컬러링북 《헬로, 카카오프렌즈》 속 그림 32점을 선정해 새롭게 재구성한 《헬로, 카카오프렌즈 컬러링 엽서북》을 선보인다. 《헬로, 카카오프렌즈 컬러링 엽서북》은 기존 컬러링북 속 그림을 미니북 사이즈에 맞게 새롭게 구성한 버전으로, 컬러링북과는 또 다른 매력을 느낄 수 있다. 소비자가 직접 색칠한 카카오프렌즈 캐릭터가 담긴 엽서는 주변 사람에게 마음을 전하는 선물용으로도 활용 가능하다.| 미니백에 쏘옥 들어가는 포켓 사이즈, 깔끔하게 한 장씩 뜯어져요!《헬로, 카카오프렌즈 컬러링 엽서북》은 가방에 수납 가능한 미니북 사이즈라 언제 어디서든 간편하게 휴대할 수 있다. 해당 엽서북은 색칠하기 부담스럽지 않은 크기로 제작되어 색칠에 자신 없는 초보자들이 컬러링북 입문하기에 적합하다. 뿐만 아니라 한 장 한 장 깔끔하게 떼어낼 수 있어 색칠한 엽서를 액자에 넣어 인테리어 소품으로도 활용할 수 있다.| 색칠한 엽서를 넣을 수 있는 ‘한정판’ 엽서봉투까지!《헬로, 카카오프렌즈 컬러링 엽서북》에는 32점의 엽서와 함께 소비자가 색칠한 엽서를 넣을 수 있는 2종의 한정판 엽서봉투가 포함됐다. 엽서 봉투 속에는 카카오프렌즈 캐릭터 패턴이 디자인되어 카카오프렌즈를 좋아하는 소비자들에게 소장 가치가 크며, 엽서를 받는 이 또한 캐릭터를 통해 즐거움을 느낄 수 있다.《헬로, 카카오프렌즈 컬러링 엽서북》은 10월 28일부터 전국 오프라인 서점 및 주요 온라인 서점에서 만나볼 수 있다.헬로, 카카오프렌즈!카카오프렌즈는 저마다의 개성과 인간적인 매력을 지닌 라이언, 무지, 어피치, 프로도, 네오, 튜브, 콘, 제이지 총 8명의 친구들입니다. 각기 다른 성격과 하나씩은 콤플렉스를 가지고 있는 여덟 친구들의 모습은 독특하면서도 어딘가 우리 주변 사람들의 모습을 닮았죠? 이렇게 카카오프렌즈 친구들은 친숙하면서도 위트 넘치는 표정과 행동으로 남녀노소 누구에게나 많은 사랑을 받고 있답니다."
"비밀의 숲  상 이수연 대본집,시즌 2",이수연,0.0점, 1,예술/대중문화,TV/대중문화,시나리오/희곡 작법,"침묵을 원하는 자, 모두가 공범이다!통영지검 근무를 마치고 대검찰청 형사법제단에 합류하게 된 황시목.검경수사권 조정이라는 최전선의 대척점에서 다시 만난 고독한 검사 황시목과 행동파 형사 한여진.자살인지 타살인지 알 수 없는 해묵은 사건들이 수면 위로 떠오르고 이를 뒤쫓던 현직 검사 서동재가 납치되면서 다시금 펼쳐지는 치밀한 두뇌게임!의문의 사건들은 회를 거듭할수록 복잡하게 얽히면서 사건을 은폐하려는 내부 인물들의 윤곽이 드러나려 하는데….     시즌 1의 화제성과 작품성을 뛰어넘는 또 하나의 고급 스릴러 TVN 〈비밀의 숲 시즌 2〉! 동시간대 최고 시청률을 올리며 방영 중인 TVN 화제의 드라마 〈비밀의 숲 시즌2〉 대본집이 출간을 앞두고 예약 판매를 시작했다. 전2권으로 이뤄진 대본집은 ‘시즌1’ 때와 마찬가지로 많은 시청자들이 출간을 기다려온 핫 아이템이다.  〈비밀의 숲 시즌1〉이 2017년 대한민국에서 실제 화두로 떠오른 “검찰 개혁”이라는 주제를 전면에 내세워 거침없이 나아갔다면, 〈비밀의 숲 시즌 2〉는 2020년 현재 가장 첨예하게 대립 중인 ‘검경 수사권 조정’이라는 묵직한 주제를 내세워 또다시 진실을 향한 끈질긴 탐구를 이어간다.   스피디한 전개, 다층 구조로 쌓여 있는 사건의 씨줄 날줄, 압축적인 대사와 인물 관계도 등 영상만으로는 따라가기 벅찬 지적 드라마의 진짜 매력을 작가판 대본집에서 확인해보자.방송되지 않은 미공개 씬까지 포함된, 작가판 대본집 출간!!드라마를 ‘보는’ 재미에서 그치는 게 아니라 ‘읽는’ 재미로까지 영역을 확장시킨 〈비밀의 숲 시즌 1〉 대본집. 이미 3년 전 종영한 드라마임에도 지금까지 분야 최정상을 지키며 명품 스테디셀러의 위엄을 뽐내고 있다. 〈비밀의 숲 시즌 2 대본집〉 역시 쫄깃하고 지적인 스토리, 흡입력 있는 전개, 탄탄한 구성, 허를 찌르는 반전 등을 모두 담은 명품 드라마로, 활자 하나하나를 천천히 음미하며 읽는 고급스런 독서 경험을 선물할 것이다.  드라마에서 미처 발견하지 못한 숨겨진 복선과 복잡한 인과관계의 실타래를 하나하나 풀어가며 읽는 재미가 남다르다. 방송에선 편집된, 미공개 씬을 찾아보는 재미는 덤!예약 판매 기간에 대본집 세트를 구매하면 드라마 포스터로 만든 고급 양장 포스트잇 증정!","시즌 1의 화제성과 작품성을 뛰어넘는 또 하나의 고급 스릴러 tvN [비밀의 숲 시즌 2]! 동시간대 최고 시청률을 올리며 방영 중인 tvN 화제의 드라마 [비밀의 숲 시즌 2] 대본집이 출간을 앞두고 예약 판매를 시작했다. 전2권으로 이뤄진 대본집은 ‘시즌1’ 때와 마찬가지로 많은 시청자들이 출간을 기다려온 핫 아이템이다. [비밀의 숲 시즌 1]이 2017년 대한민국에서 실제 화두로 떠오른 “검찰 개혁”이라는 주제를 전면에 내세워 거침없이 나아갔다면, [비밀의 숲 시즌 2]는 2020년 현재 가장 첨예하게 대립 중인 ‘검경 수사권 조정’이라는 묵직한 주제를 내세워 또다시 진실을 향한 끈질긴 탐구를 이어간다. 스피디한 전개, 다층 구조로 쌓여 있는 사건의 씨줄 날줄, 압축적인 대사와 인물 관계도 등 영상만으로는 따라가기 벅찬 지적 드라마의 진짜 매력을 작가판 대본집에서 확인해보자.방송되지 않은 미공개 씬까지 포함된, 작가판 대본집 출간!!드라마를 ‘보는’ 재미에서 그치는 게 아니라 ‘읽는’ 재미로까지 영역을 확장시킨 [비밀의 숲 시즌 1] 대본집. 이미 3년 전 종영한 드라마임에도 지금까지 분야 최정상을 지키며 명품 스테디셀러의 위엄을 뽐내고 있다. [비밀의 숲 시즌 2 대본집] 역시 쫄깃하고 지적인 스토리, 흡입력 있는 전개, 탄탄한 구성, 허를 찌르는 반전 등을 모두 담은 명품 드라마로, 활자 하나하나를 천천히 음미하며 읽는 고급스런 독서 경험을 선물할 것이다. 드라마에서 미처 발견하지 못한 숨겨진 복선과 복잡한 인과관계의 실타래를 하나하나 풀어가며 읽는 재미가 남다르다. 방송에선 편집된, 미공개 씬을 찾아보는 재미는 덤! 예약 판매 기간에 구매하면 드라마 포스터로 만든 고급 양장 포스트잇 증정!"
나는 스마트폰으로 매일 인생사진 찍는다 일상을 화보로 만들어주는 책,방쿤,0.0점, 15,예술/대중문화,사진,사진이론과 실기,"여행에서 처음 접하는 빛과 풍경을 원하는대로 사진에 담아내는 일은 상당히 어렵습니다. 큰 마음먹고 떠난 장소에서 어쩐지 아쉬운 기분을 감출 수 없죠. 숙소에 돌아와서 보정을 해 봐도, 어떻게 해야 나아지는지 알 수 없어 결국 제대로 보정하지 못할 때가 많습니다. 그렇지만 스마트폰 카메라로 사진을 찍으면, 찍은 자리에서 바로 보정을 할 수 있기에 눈으로 현재 풍경을 보면서 사진을 똑같이 보정해내기 쉽습니다. 단순히 ‘보정이 가능하다’를 넘어서 ‘그 자리에서, 실제 풍경을 눈으로 보면서 보정이 가능하다’ 라는 점이 가장 큰 장점입니다.이 책의 핵심은 크게 두 가지입니다. 하나는 스마트폰 카메라 촬영법, 다른 하나는 스마트폰 사진 보정법입니다. 스마트폰 카메라가 가진 장점을 극대화하여 녹여낸 이 비법서가 여러분의 사진 생활에 큰 도움이 되면 좋겠습니다. 이 세상 모든 이들이 스마트폰으로 자신의 감성을 한껏 표현해낼 수 있기를 바라는 마음으로 책을 썼습니다. 책을 읽으며 스마트폰 카메라의 깊고도 넓은 세계에 빠져 보시기 바랍니다.","매일매일 인생사진을 찍을 수 있다면‘인생 사진’ 한 장을 건지기 위해 오늘도 우리는 수십 장의 사진을 찍습니다. 유명한 필터 앱도 깔아보고, 사진을 보정 앱으로 수정하며 많은 시간과 정성을 들입니다. 하지만 이렇게 열심히 노력해도 원하는 결과물이 나오지 않거나 실물을 다 담지 못한 사진인 경우가 대부분입니다.‘역시 스마트폰 카메라로는 한계가 있어’실망한 우리는 이내 일상에서 사진 찍는 재미를 잃고 맙니다. 그런데 멋진 사진을 찍기 위해서 꼭 전문적인 카메라가 있어야만 하는 걸까요? 정말 ‘폰카’로 찍는 사진에는 한계가 있을까요?좋은 스마트폰이 나오면서 스마트폰 카메라도 덩달아 발전했습니다. 다양한 기능이 생겼으며 전문 카메라처럼 세부적인 요소를 마음대로 조절할 수 있게 되었습니다. 앱을 활용해 보정을 하면 웬만한 고급카메라 이상의 퀄리티를 만들 수도 있습니다. 하지만 우리는 아직도 스마트폰 카메라를 과거의 ‘폰카’처럼 이용합니다. 이 책에는 지난 4년간 스마트폰 강의를 하면서 알게 된 작가의 모든 노하우가 담겨있습니다. 자칭 ‘똥손’인 분들도, 카메라 전문용어를 하나도 모르시는 분들도 매일매일 ‘멋진 인생 사진’을 찍을 수 있게 이 책이 도움을 줄 것입니다."
