title,author,score,num_reviewers,main genre,middle genre,subclass,introduction,review아기가 잘 먹는 이유식은 따로 있다,김정미,0.0점, 12,가정/생활/요리,요리,테마별요리,"대한민국 엄마들이 꼼꼼히 따져보고 고르는 국민 이유식책!모유가 부족해 완전 모유수유를 하지 못한 것이 늘 미안했던 이 책의 저자 김정미는 이유식만큼은 제대로 해보리라 맘 먹고 국내외 이유식 책들을 섭렵하며 아기에게 이유식을 만들어 먹였다. 하지만 아무리 좋다고 하는 이유식을 만들어도 아기가 잘 먹지 않으면, 노력이 아깝고 아기가 걱정되어 정말 속상하다. 그녀는 이렇게 한 끼 한 끼 준비하면서 경험했던 이유식 정보들이 다른 엄마들에게도 도움이 될까 싶어 ‘마더스고양이’라는 닉네임으로 블로그를 통해 소개하기 시작했다. 이 책 『아기가 잘 먹는 이유식은 따로 있다』는 블로그를 통해 많은 엄마들이 인정한 마더스고양이의 대박 이유식 비법을 공개하였다. 총 240개의 다양한 이유식과 간식 레시피를 수록했고, 저자의 생생한 경험담을 바탕으로 4-8주간의 시기별 식단을 소개한다. 개정판에서는 아기가 잘 먹는 대박 이유식 및 간식 레시피들을 한층 더 풍부하게 실었고, 두 아이의 엄마이자 소아청소년과 전문의로 많은 엄마들의 이유식 궁금증을 풀어주었던 서지영 박사가 새롭게 자문을 맡아 꼼꼼하게 짚어주었다.","이 책으로 이유식을 끝낸 40만 엄마들의 애정 어린 제안을 반영해 더 알차게 개정판을 만들었습니다① 아기가 잘 먹는 이유식의 노하우를 더 풍부하게! 많은 엄마들이 인정한 마더스고양이의 대박 이유식 비법 공개 ② 다른 이유식책 필요 없이 한 권으로 충분하게! 대폭 보강된 총 240개의 다양한 이유식 & 간식 레시피 수록 ③ 초보 엄마들도 누구나 더 따라 하기 쉽게! 늘어난 과정컷, 쉽고 정확한 조리법, 더 자세하고 친절한 설명 ④ 엄마의 수고로움을 덜어주어 더 활용도 높게! 마더스고양이의 생생한 경험담과 4~8주간의 시기별 식단 아기가 잘 먹는 대박 이유식을 모은 실전서,지난 6년간 큰 사랑을 받으며 국민 이유식책이 되었습니다모유가 부족해 완모(완전 모유수유)를 하지 못한 것이 늘 미안했던 이 책의 저자 김정미 씨는 이유식만큼은 제대로 해보리라 맘 먹고 국내외 이유식 책들을 섭렵하며 아기에게 이유식을 만들어 먹였습니다. 하지만 아무리 좋다고 하는 이유식을 만들어도 아기가 잘 먹지 않으면, 노력이 아깝고 아기가 걱정되어 정말 속상했습니다. 반대로 아기가 남김없이 싹싹 먹어주면 그보다 더 뿌듯한 일이 없었지요. 그녀는 이렇게 한 끼 한 끼 준비하면서 경험했던 이유식 정보들이 다른 엄마들에게도 도움이 될까 싶어 ‘마더스고양이’라는 닉네임으로 블로그를 통해 소개하기 시작했습니다. 특히 마더스고양이의 이유식 레시피는 ‘아기가 잘 먹는 이유식’이라고 알려지면서 ‘대박 이유식’으로 불리며 큰 인기를 모았습니다. 덕분에 마더스고양이는 네이버 파워 블로거로 선정되는 것은 물론 그녀가 운영하는 육아 카페 ‘마더스’ 역시 네이버 대표 카페로 선정되기도 했습니다.2010년 1월, 마더스고양이는 실제 아기에게 해먹였던 레시피들 중에서 잘 먹는 것들만 엄선해 첫 책 <아기가 잘 먹는 이유식은 따로 있다>를 펴냈습니다. 이 책은 출간 즉시 베스트셀러에 등극했고, 지난 6년간 ‘이유식 바이블’, ‘국민 이유식책’으로 불리며 누적 40만부가 팔리는 등 꾸준한 사랑을 받아왔습니다.출간 이후 꾸준히 수집해온 독자들의 다양한 의견을 반영해소아과 전문의, 조리 전문가 등과 함께 처음부터 다시 꼼꼼히 만들었습니다“주변 엄마들, 열이면 열 모두 추천하는 책이에요”, “아기가 잘 먹는 것은 물론 초보 엄마에게 멘토 역할도 해주더군요”, “이유식에 대한 자세한 설명과 다양한 메뉴, 역시 엄마들이 추천하는 이유가 있네요”, “백일 선물로 추천하고 싶은 소중한 책입니다” 등등.온라인 서점이나 개인 블로그, 육아 카페 등에는 이처럼 <아기가 잘 먹는 이유식은 따로 있다>에 대한 칭찬과 격려의 글도 많지만, 부족한 부분에 대한 지적들도 있었습니다. 그래서 그간의 과분한 독자들의 사랑에 보답하고자 더 완벽한 이유식책을 만들기 위해 개정판을 내기로 하고, 꾸준히 수집해온 독자들의 다양한 의견을 반영해 지난 1년간 출간 작업을 진행했습니다. 개정판에는 이미 많은 아기 엄마에게 인정받은 마더스고양이의 아기가 잘 먹는 대박 이유식 및 간식 레시피들을 한층 더 풍부하게 실었고, 독자들에게 큰 호응을 얻었던 마더스고양이의 생생한 이유식 경험담과 깨알 정보들도 소개했습니다. 또한 두 아이의 엄마이자 소아청소년과 전문의로 많은 엄마들의 이유식 궁금증을 풀어주었던 서지영 박사가 새롭게 자문을 맡아 꼼꼼하게 짚어주었습니다. 요리 및 건강책 전문 출판사 레시피팩토리 테스트키친팀의 조리 전문가들은 모든 레시피를 하나하나 세밀하게 검증해 육아도, 요리도 초보인 요즘 엄마들이 보다 쉽게 따라 할 수 있는 간결하고 정확한 조리법을 완성했습니다.■ 이 책의 특징독자의 목소리를 반영한 <아기가 잘 먹는 이유식은 따로 있다> 완전 개정판, 이렇게 더 탄탄해졌습니다!1.	이유식을 처음 시작하는 초기부터, 유아식으로 넘어가기 직전인 완료기까지 매 시기별 이유식과 간식을 대폭 보강해 아기가 참 잘 먹는 240개의 풍부한 레시피를 실었습니다.2.	육아도, 요리도 초보인 엄마들이 더욱 쉽게 이해하고 따라 할 수 있도록 이유식에 대한 꼼꼼한 이론 설명은 물론 모든 레시피를 자세한 과정컷과 함께 보다 상세하게 소개했습니다.3.	매 시기마다 영양과 맛의 밸런스를 맞추면서 엄마들이 좀더 편하게 만들 수 있도록 구성한 4~8주간의 식단을 제시했습니다.4.	이유식을 하면서 순간순간 갖게 될 크고 작은 궁금증을 마더스고양이의 생생한 경험담과 요긴한 팁들로 곳곳에 구성해 알려드렸습니다.5.	모든 레시피는 레시피팩토리 테스트키친팀이 다시 한번 검증해 보다 쉽고 정확한 조리법으로 풀어냈고 예쁜 비주얼과 보기 좋은 편집으로 소장가치를 높였습니다.6.	그간 독자들이 많이 물어왔던 이유식에 관한 세세한 궁금증은 Q/A 코너에 소개했고 그밖에 궁금증은 언제든 레시피팩토리의 요리잡지 <수퍼레시피> 온라인 커뮤니티 Q/A 게시판을 통해 해결하실 수 있습니다."
이탈리아 집밥 푸근한 할머니 음식에서 미슐랭 셰프의 레시피까지,정해리,10.0점, 9,가정/생활/요리,요리,,"푸근한 할머니 음식에서 미슐랭 셰프의 레시피까지 전세계 가정식의 최고봉, 이탈리아 집밥의 모든 것. 감자 삶아 툭툭 빚은 할머니의 뇨끼, 친구 어머니의 보리수프 등 푸근한 손맛이 담긴 레시피와 요리학교, 미슐랭 레스토랑에서 익힌 한 끗 차 요리 포인트를 담았다. 쇠고기와 돼지고기, 햄을 섞어 만드는 황금비율 라구소스, 사르르 녹는 문어 삶기, 쿠스쿠스 삶는 법, 허브를 골라 쓰는 저자의 오랜 노하우를 따라 하면 집밥이 달라진다.이탈리아 음식 하면 떠오르는 파스타와 리조또뿐 아니라 해산물과 고기로 만든 메인 메뉴, 가지 피클, 피망구이 등 반찬, 판나꼬따, 리몬첼로, 소르벳또 등 배우고 싶었던 이탈리아 디저트까지, 책에 담긴 이탈리아 레시피는 다채롭고 알차다. 흑맥주목살찜, 불고깃감에 치즈를 넣은 요리, 시금치볶음 등이 친근하고도 새로워 활용하기 좋다.","푸근한 할머니 음식에서 미슐랭 셰프의 레시피까지전세계 가정식의 최고봉, 이탈리아 집밥의 모든 것 20년 가까이 이탈리아의 가정에서, 농부의 집에서, 셰프의 주방에서 익힌레시피 중에서 레스토랑 손님들이 좋아한 메뉴, 쿠킹 클래스 회원들이 만들어보고 감탄한 레시피를 고르고 골라 담았어요.-본문 중에서세계적으로 이탈리아 집밥이 유명한 이유쉽다! 맛있다! 건강하다!이탈리아 음식을 먹어보면 무슨 재료가 들어갔는지 대략 알 수 있다. 복잡한 소스나 기술 없이 재료 본연의 맛을 살리는 요리가 많기 때문이다. 게다가 건강식이다. 전세계적으로 이탈리아 가정식이라는 말이 통용되는 것도 같은 이유. 우리가 칼국수 삶듯이, 밥 볶듯이 면을 삶아 토마토소스에 쓱쓱 비비고, 쌀을 끓이다 치즈를 섞는 등 이탈리아 음식은 집에서 해먹기 좋다.   이탈리아 할머니와 친구들의 어머니 음식,요리학교와 레스토랑에서 찾아낸 비장의 노하우성악을 전공한 저자는 이탈리아에서 13년간 살았고, 귀국 후에도 10여 년간 이탈리아로 푸드 여행을 떠났다. 감자 삶아 툭툭 빚은 할머니의 뇨끼, 친구 어머니의 보리수프 등 푸근한 손맛이 담긴 레시피와 요리학교, 미슐랭 레스토랑에서 익힌 한 끗 차 요리 포인트를 담았다. 쇠고기와 돼지고기, 햄을 섞어 만드는 황금비율 라구소스, 사르르 녹는 문어 삶기, 끓이지 않고 쿠스쿠스 삶는 법, 버터와 올리브유, 허브를 골라 쓰는 저자의 오랜 노하우를 따라 하면 집밥이 달라진다.      이탈리아에도 목살찜이 있다고?파스타와 리조또는 기본, 고기와 해산물 메뉴, 반찬과 디저트까지이탈리아 음식 하면 떠오르는 파스타와 리조또뿐 아니라 해산물과 고기로 만든 메인 메뉴, 가지 피클, 피망구이 등 반찬, 판나꼬따, 리몬첼로, 소르벳또 등 배우고 싶었던 이탈리아 디저트까지, 책에 담긴 이탈리아 레시피는 다채롭고 알차다. 흑맥주목살찜, 불고깃감에 치즈를 넣은 요리, 시금치볶음 등이 친근하고도 새로워 활용하기 좋다. 한 그릇에 사랑이 담기고, 삶이 어리고 음식에 담긴 온기 가득한 이야기   유학 시절 시험보고 온 날이면 하숙집 할머니가 한 사발 만들어주던 티라미수, 동네 행사 때 끓이던 만둣국 같은 토르텔리니, 브로콜리로 끓인 슬로푸드 수프 등 저자의 음식에는 추억이 담겨 있다. 안나 할머니와 살면서 먹어 본 시칠리아의 맛, 파올라 아주머니가 해주던 따뜻한 수프와 위로의 말을 읽다 보면 홈메이드 음식을 나누는 정을 다시금 기억하게 한다. 이것이 집밥의 가치임을."
문성실의 우리집 요리 백과 행복한 우리 가족 밥상 레시피 330,문성실,10.0점, 20,가정/생활/요리,요리,,"기본에 충실한 330가지 레시피 골라 담아한 권으로 끝내는 요리백과사전『문성실의 우리집 요리 백과』는 2013년도에 출간되어 많은 사랑을 받은 『문성실의 요즘 요리』 개정판으로 요리연구가 문성실의 16년 요리 노하우로 빚어진 레시피북으로, 실용적인 요리 정보와 지식만을 골라 압축하여 알차게 담은 요리백과사전이다. ‘오늘 뭐 먹지?’ 하는 걱정을 덜어줄 330가지의 다채로운 레시피가 빼곡히 담겨 있다. 반찬 없이도 한 그릇으로 충분한 밥과 면 요리부터 늘 있는 재료로 쉽게 끓이는 국물 요리, 한두 가지만 있어도 밥 한 그릇 뚝딱 해치우는 효자 반찬, 두고두고 오래 먹을 수 있는 김치와 장아찌, 가벼운 끼니가 되는 샐러드, 평범한 식재료로 폼 나게 만드는 별미 요리 그리고 어른, 아이 할 것 없이 누구나 좋아하는 간식까지 총망라했다. 일 년 내내 쉽게 구할 수 있는 친근한 재료와 누구나 따라 할 수 있는 손쉬운 레시피에 ‘요리 고수’ 문성실만의 개성 넘치는 요리 센스가 버무려진, 아주 감칠맛 나는 요리책이다. 『문성실의 우리집 요리 백과』는 익숙하고 평범한 레시피부터 약간의 변화만으로 풍미가 더해지는 똑똑한 레시피, 나아가 그 맛이 정말 궁금해지는 창의적인 레시피까지 요리의 기본과 실전 그리고 응용을 제대로 보여준다. 그리고 이 모든 요리들의 공통점은, 요리에 자신이 없던 사람도 밥숟가락과 종이컵만 있으면 용감하게 따라 할 수 있을 정도로 쉽고 간편하다는 것이다. 식구들에게 하루 세끼 집밥을 먹이고 싶은 가정주부에게, 아이들에게 조금 더 건강한 간식을 먹이고 싶은 부모에게, 요리를 제대로 배운 적이 없지만 맛있고 폼 나는 주말 별식을 차리고픈 요리 초보자에게, 뚝딱뚝딱 한 그릇 요리를 만들어 엄마 밥상 같은 한 끼를 맛보고 싶은 싱글족에게 꼭 필요한 요리 바이블이라고 할 수 있다.","친절한 레시피와 유용한 쿠킹 팁들로빈틈없이 알찬 구성간단하지만 맛있고 폼 나는 요리의 고수인 저자 문성실은 이 책 『문성실의 우리집 요리 백과』에서 역시 실용적이고 효율적인 요리 가이드가 되는 데 힘썼다. 우선, 본격적인 레시피 소개에 앞서 꼭 알아두어야 할 쿠킹 팁을 안내한다. 재료별 계량법, 꼭 필요한 기본양념, 건강한 요리를 위한 천연 재료 만드는 법, 유용한 주방 도구까지 꼼꼼히 일러주고 있다. 이어 각 요리에 대한 간단한 소개와 함께 재료와 양념, 생생한 사진과 요리 과정을 꼼꼼히 수록하여 누구나 쉽게 따라 할 수 있도록 하였다. 이렇게 빈틈없이 알찬 요리책 『문성실의 우리집 요리 백과』만의 특별한 매력 세 가지를 꼽자면 다음과 같다. 첫째, 책에 나오는 모든 레시피는 누구나의 집에 늘 있는 밥숟가락과 종이컵으로 계량하여 최대한 쉽고 편리하게 활용할 수 있도록 했다. 둘째, 당장 재료가 없다고 단념하지 않아도 되는 대체 식재료가 다양하게 안내되어 있다. 새로운 요리를 만들어 보려고 하면 일단 낯선 재료에 부딪히기 쉬운데, 그럴 걱정 없이 각 요리에 대체 식재료를 표기하여 반드시 그 재료가 없더라도 다른 재료를 활용할 수 있도록 하여 요리의 폭을 넓힐 수 있게 했다.셋째, 궁금한 레시피를 빠르게 찾고 싶거나 요리할 시간이 정해져 있을 때, 쉽고 간편하게 찾아갈 수 있는 인덱스를 책의 끝에서 만날 수 있다. 그날그날 기분에 따라, 혹은 집에 있는 재료에 따라 만들고 싶은 요리를 바로 찾을 수 있도록 가나다순, 요리 시간순으로 구성했다.1세대 파워 블로거이자소통하는 요리 연구가 문성실“늘 그렇지만, 화려하지도 복잡하지도 않은 것이 저 문성실 요리의 특징입니다. 오히려 참 가볍게 보이기까지 하지요. 저는 무겁고 어려운 요리는 싫습니다. 이미 세상을 살면서 많은 어려움과 온갖 일로 충분히 힘들고 괴로운데, 요리까지 어려울 필요가 있을까요?”밥숟가락 하나로 밥상을 평정한 집밥 요리의 대가이자, 누적 방문자 1억 3천만의 1세대 블로거 저자 문성실. 그녀의 레시피를 따라 해 보면 자연스럽게 “간단해. 근데 맛있어!”라는 말이 나온다. 전업주부로 살면서 무료한 마음을 달래기 위해 블로그를 시작했다는 저자 문성실은 귀찮게 장 보러 나가지 않아도 집에 늘 있는 재료로 간편하게 뚝딱뚝딱 만들 수 있는 요리를 추구한다. 화려하고 특별하기보다는 소박하고 친근한 레시피에 더해진 진솔한 삶의 이야기로 가득한 그녀의 블로그 “문성실의 심플 레시피”가 16년째 사랑받는 비결이다.저자는 『문성실의 우리집 요리 백과』가 주방의 온갖 양념과 손때로 퉁퉁 불어 너덜너덜한 요리책이 되어 독자와 함께 동고동락하며 긴 시간 함께하기를 바란다고 말한다. 아무 욕심 없이 시작한 블로그에서 주고받은 진심이 담긴 메시지들에서 힘을 얻어 오늘도 더 즐겁게 요리하며, 요리 열정에 불을 지펴준 독자들에게 감사해하는 마음 또한 책에 담았다. 소박한 지식과 경험을 함께 공유하고 소통하는 시간 속에서 함께 성장하는 과정을 즐기고, 또 꾸준히 노력할 줄 아는 진정한 연구가 문성실의 사랑과 땀방울이 담긴 따뜻한 요리책이다."
2021 나합격 조주기능사 필기+실기+무료동영상 나합격 수험생 지원센터 운영 + 칵테일 레시피 카드 부록,전재구,9.92점, 23,가정/생활/요리,요리,,"한 권으로 한 번에 합격하자!!나합격 100%만의 합격 비법STEP 01 스터디 플래너로 시험 계획 세우기STEP 02 쏙쏙 들어오는 이론구성으로 개념완성STEP 03 기출문제 풀기로 유형 잡고,STEP 04 CBT 최종 모의고사로 합격을 잡자* 조주기능사 실기 완벽 반영40가지 공개 레시피 완벽 수록포켓 레시피 카드 수록나합격 시크릿 팁!이제 더 이상 혼자 공부하지 마세요.SECRET 01 - 전 과목 무료동영상 강의 제공SECRET 02 - 나합격 수험생 지원 센터 운영NAVER 카페 [칵테일과 꿈]을 검색해보세요.",
KBS 황금레시피 플러스 매일 저녁 식탁을 풍성하게 채워 줄,KBS <2TV 생생정보> 제작팀,9.71점, 24,가정/생활/요리,요리,,"한국인이 가장 많이 보는 저녁 정보 프로그램 KBS 2TV 〈생생정보〉!저녁마다 눈과 귀를 끌어당긴 황금레시피의 비법을 가득 담아더 풍성한 〈KBS 황금레시피 플러스〉로 돌아왔다! ◆집에서도 맛집처럼 맛을 내는 황금레시피!방송에서 소개되는 맛집과 요리연구가의 비법을 한눈에 쉽게 볼 수는 없을까 하는 고민을 했었다면 이젠 〈KBS 황금레시피 플러스〉로 집에서도 쉽고 맛있게 요리할 수 있다. 방송에 소개된 황금 같은 레시피를 요리 전문가 이밥차가 직접 검증하고 집에서도 따라 할 수 있도록 계량하여 쉽고 맛있게 풀어냈다.◆복잡한 레시피도 밥숟가락 계량으로 쉽게!맛집의 복잡하고 까다로운 레시피도 요리전문가 이밥차의 손을 거치면 요알못도 똑같은 맛을 낼 수 있다. 집에서도 만들 수 있도록 조리과정을 간단하게 풀어내고 복잡한 계량 도구 없어도 누구나 따라할 수 있도록 이밥차만의 ‘밥숟가락 계량법’으로 직관적으로 조리할 수 있다. 또한 방송에선 시간상 자세하게 소개하지 못한 조리법과 맛내기 비법도 추가하여 누구나 쉽고 맛있게 요리할 수 있다. ◆레시피마다 숨어있는 황금팁을 찾는 재미 간략한 레시피라고 해서 불친절한 레시피라는 오해는 금물! 철저히 요리 초보의 눈으로 까다롭고 어려워 보이는 맛집의 레시피도 집에서 쉽게 따라 할 수 있도록 레시피 곳곳에 깨알같은 ‘황금팁’을 가득 수록했다. 집에서 만들기에는 까다로운 요리도 차근차근 자세하게 조리 과정을 설명했을 뿐만 아니라 요리가 어려운 초보들에게는 이를 대체할 방법까지 눈높이에 맞게 설명했다. 그뿐 아니라 고기를 구울 때 뒤집는 타이밍, 주방 도구 관리 팁 등 맛을 내기 위한 팁들도 다양하게 수록했다. 요리마다 가득한 황금팁으로 맛집 같은 맛을 내보자. ◆다양한 상황에 어울리는 다채로운 레시피맛집의 비법을 가득 담은 황금레시피라고 해서 특별한 요리만 담은 것이 아니다. 집에서 먹는 간단한 한 끼나 반찬도 맛집에서 먹듯이 제대로 먹기 위해서 다채로운 레시피를 담았다. 다양한 상황에 어울리는 일품요리부터 일상을 맛집처럼 만드는 찌개, 국, 밑반찬 요리, 한 끼로도 든든한 볶음요리, 손님상에 내어놓아도 손색없는 별미요리까지 황금 같은 레시피로 식탁을 황금빛으로 물들여보자.","복잡한 레시피도 밥숟가락 계량으로 쉽게!맛집의 복잡하고 까다로운 레시피도 요리전문가 이밥차의 손을 거치면 요알못도 똑같은 맛을 낼 수 있다. 집에서도 만들 수 있도록 조리과정을 간단하게 풀어내고 복잡한 계량 도구 없어도 누구나 따라할 수 있도록 이밥차만의 ‘밥숟가락 계량법’으로 직관적으로 조리할 수 있다. 또한 방송에선 시간상 자세하게 소개하지 못한 조리법과 맛내기 비법도 추가하여 누구나 쉽고 맛있게 요리할 수 있다. 레시피마다 숨어있는 황금팁을 찾는 재미 간략한 레시피라고 해서 불친절한 레시피라는 오해는 금물! 철저히 요리 초보의 눈으로 까다롭고 어려워 보이는 맛집의 레시피도 집에서 쉽게 따라 할 수 있도록 레시피 곳곳에 깨알같은 ‘황금팁’을 가득 수록했다. 집에서 만들기에는 까다로운 요리도 차근차근 자세하게 조리 과정을 설명했을 뿐만 아니라 요리가 어려운 초보들에게는 이를 대체할 방법까지 눈높이에 맞게 설명했다. 그뿐 아니라 고기를 구울 때 뒤집는 타이밍, 주방 도구 관리 팁 등 맛을 내기 위한 팁들도 다양하게 수록했다. 요리마다 가득한 황금팁으로 맛집 같은 맛을 내보자. 다양한 상황에 어울리는 다채로운 레시피맛집의 비법을 가득 담은 황금레시피라고 해서 특별한 요리만 담은 것이 아니다. 집에서 먹는 간단한 한 끼나 반찬도 맛집에서 먹듯이 제대로 먹기 위해서 다채로운 레시피를 담았다. 다양한 상황에 어울리는 일품요리부터 일상을 맛집처럼 만드는 찌개, 국, 밑반찬 요리, 한 끼로도 든든한 볶음요리, 손님상에 내어놓아도 손색없는 별미요리까지 황금 같은 레시피로 식탁을 황금빛으로 물들여보자."
타르트 바이 가루하루(TARTE by GARUHARU)(가루하루 마스터 북 시리즈 2),윤은영,0.0점, 1,가정/생활/요리,요리,,"가루하루만의 시그니처 타르트를 만나다!전 세계가 주목하는 한국 대표 파티시에 가루하루 윤은영 셰프의 두 번째 페이스트리 북『타르트 바이 가루하루(TARTE BY GARUHARU)』. 계절을 담은 재료 본연의 확실한 맛, 단조롭지 않은 다양한 텍스처, 포인트를 살린 간결한 디자인을 담은 가루하루만의 시그니처 타르트를 모두 공개한다. 또한 타르트 반죽인 ‘파트 아 사블레’, ‘파트 아 브리제’에 관한 이론과 함께 쌀가루를 이용한 글루텐 프리 레시피, 가루하루 스타일의 클래식 OR 라이트 아몬드 크림 배합을 활용해 다양한 스타일의 타르트를 완성할 수 있다.이 책은 레시피가 아닌 그 과정에서 겪었던 많은 시행착오와 실패를 경험하며 터득한 포인트와 팁, 도구 활용법은 물론 제조 공정에서의 잦은 실수를 줄여주는 방법들을 이 책에 담았다. 또한 해외 마스터 클래스를 진행하며 만난 다양한 문화권의 훌륭한 셰프들과 새로운 식재료들로부터 받은 영감의 결과물을 오롯이 담아냈다.","파티시에는 다른 이들에게 달콤한 맛의 휴식과 즐거움을 주는 행복한 직업이지만, 기술을 배우고 능숙해지기까지 긴 시간과 노력이 필요했습니다. 하지만 이 길고 힘든 시간 끝에는 저와 제가 만든 제품들이 함께 성장해 있었습니다.단지 레시피가 아닌 그 과정에서 겪었던 많은 시행착오와 실패를 경험하며 터득한 포인트와 팁, 도구 활용법은 물론 제조 공정에서의 잦은 실수를 줄여주는 방법들을 이 책에 담았습니다. 또한 해외 마스터 클래스를 진행하며 만난 다양한 문화권의 훌륭한 셰프들과 새로운 식재료들로부터 받은 영감의 결과물을 오롯이 담고자 노력했습니다.이 책이 누군가에게 새로운 영감을 주는 도구로 사용되길 바랍니다. 이 책의 레시피를 토대로 여러분의 주변에서 구할 수 있는 재료를 활용해 다양한 시도를 해보셨으면 좋겠습니다. 제가 늘 작업대 위에서 기존의 제품과 새로운 재료의 조합을 고민하듯, 여러분의 작업실에서도 이러한 고민과 새로운 시도가 계속되길 희망하며, 그 과정에서 저의 책이 작은 도움이 되었으면 합니다.- PROLOGUE 중 -"
