title,author,score,num_reviewers,main genre,middle genre,subclass,introduction,review
백년운동,정선근,8.0점, 9,건강,요가/헬스,,"서울대 의대 재활의학과 정선근 교수는 그의 새로운 책, ‘백년운동’을 통해서 100세 인생을 건강하고 멋지게 살고 싶은 이들에게 그 방법을 의학적으로 제시하고 있다. 정 교수가 몇 년 전에 출간한, 건강분야의 스테디셀러인 ‘ 백년허리’ , ‘백년 목’이 허리와 목디스크 질환에 대한 새로운 치료법을 대중에게 제시한 책이라면, 이번 신간인 ‘백년운동’은 관절과 척추를 보호하면서 안전하게 운동할 수 있는 운동방법을 제시한 책이다.운동이 몸에 좋다는 것은 모든 사람이 다 아는 사실이다. 운동이 얼마나 우리 몸에 좋은지는 ‘운동이라는 단 한 가지 자극으로 30조(兆) 개가 넘는 온몸의 세포가 동시에 활성화 된다는 사실’ 하나로도 충분히 잘 알 수 있다. 하지만, 이렇게 좋은 운동, 운동은 최고의 명약이지만, 운동의 가장 큰 적은 척추와 관절의 통증이다. 운동을 하면 아프고, 운동을 안하면 약해지는 이 딜레마를 어떻게 해결할지가 관건이다.사람들은 척추, 관절이 아프거나, 중년 이후 노화가 시작되면, 운동의 딜레마에 빠지게 된다. 건강에 좋은 운동을 하고 싶어도 자칫, 섣부른 운동이 몸의 회복 상태를 더 악화시키거나 부상을 동반할 수 있다는 두려움에 빠져 이러지도 저러지도 못하는 고민을 하게 되는 것이다. 그런 사람들의 고민을 해결하기 위해서 저자는 임상 경험과 연구를 토대로 방법을 제시하고 있다. 저자는 튼튼한 근육과 뼈 사이에서 이리 찢기고 저리 차이는 힘 받는 연부조직(연골, 힘줄, 인대)을 잘 보호하면서 꾸준히 운동할 수 있는 방법만 알게 되면 ‘척추, 관절을 다친 경험이 있는 사람들이 운동을 해야 할 지 말아야 할지’ 혹은 ‘나이가 들면서 운동을 해야 할지 말아야 할지’라는 딜레마에 빠질 필요가 없다고 말하고 있다. 책에서 제시하는 연부조직을 보호하는 구체적이고 단계적인 운동법은 척추와 관절을 잘 보호하는 운동법으로 이 책의 핵심적인 내용 중 하나이다. 첫 번째로, 자신의 척추와 관절 상태를 정확히 알고 자신의 몸에 맞는 운동을 찾는 것이며,  두 번째로, 그 몸에 맞는 운동법으로 부상없이 운동을 꾸준히 할 수 있게 만드는 것, 그것이 백년운동이다.저자는 1부에서 ‘운동, 최고의 명약 그리고 딜레마’는 운동의 개론적인 내용과 장수(長壽)와 운동이 만날 때 필연적으로 마주하게 되는 딜레마를 다루었다. 과학적으로 증명된 운동 효과를 따져 보고, 건강한 몸을 만드는 운동의 양대 산맥인 유산소운동과 무산소운동을 원칙과 효과면에서 비교하였다. 100세까지 청춘으로 살기 위한 운동을 할 때 척추와 관절에 생기는 당혹스러운 문제와 이를 극복하는 과정을 실제 사례를 통해 설명하고 있다. 2부 ‘척추와 관절에 좋은 유산소운동’에서는 유산소운동을 하는 기본적인 방법을 알기 쉽게 제시하며, 각종 유산소운동이 척추와 관절에 미치는 좋은 영향과 나쁜 영향을 자세히 다루었다. 유산소 운동의 최고봉인 걷기운동에 대해 구체적인 방법을 자세히 기술하여 걷기 운동의 효과, 정확한 방법, 걸을 때 생기는 척추와 관절의 통 증 해석법과 대책을 설명하고 있다. 3부 ‘척추와 관절에 좋은 근력운동’에서는 척추와 관절에 부담을 줄이면서 근력운동을 하는 방법을 최신 연구 결과와 함께 단계적으로 설명한다. 튼튼한 척추와 관절로 100세를 맞기 위해 중요한 10개의 근육을 그 중요도(저자는 ‘가성비’라고 표현함) 순서로 소개하고 각 근육과 척추, 관절의 관계를 감안하여 근력강화운동의 동작을 안전도 순으로 나열하여 속속들이 보여준다. 4부 ‘내 몸에 꼭 맞는 백년운동’에서는 척추와 관절 부담은 줄이고 근력강화 효과는 최대로 늘리는 추천 근력운동의 20개 동작을 엄선하였다. 아홉 가지 맨몸운동과 열한 가지 기구 운동이다. 선택한 20가지 근력운동의 동작과 유산소운동을 종합하여 젊은이부터 노쇠하신 어르신까지, 허리 아픈 분부터 어깨 아픈 분까지, 여러 가지 상황에 맞는 최선의 운동 방법을 제시한다. 100세까지 살면서 생길 수 있는 갖가지 상황에 가장 적합한 운동 처방이다. 바로 백년운동이다. 저자가 에필로그에서 밝히는 아래 세가지 강조점은 100세까지 운동하기를 원하는 사람들 누구나 한 번씩 새겨 둘 필요가 있을 것이다.1.	운동 강도는 낮게 시작해 천천히 올리라. 척추와 관절이 아팠던 경험이 있다면 아주 천천히 올리라. 2.	운동할 때 반드시 풀레인지(FULL RANGE)로 운동할 필요는 없다. 관절의 전체 범위를 다 쓰지 않아도 된다는 말이다. 3.	운동하다 아프면 소나기 피하듯 피해서 가라. 운동 강도를 낮추고, 안전도가 높은 운동법으로 내려가는 것이 피하는 방법이다.","아티잔 대표 김영미2019.10.21백년허리, 백년목, 그리고 백년운동 : 척추와 관절이 운동을 만날 때 ! 운동, 잘하면 최고의 명약,  잘못하면 나를 괴롭히는 극약! 명약이 되는 운동법은? 척추와 관절을 보호할 뿐만 아니라 더 튼튼하게 하는 운동법! 이 운동법이 백년운동! 운동을 통해서 100세 인생을 건강하고 멋지게 살고 싶은 이들에게 서울대 의대 재활의학과 정선근 교수가 그 방법을 의학적으로 제시한 책! 운동! 이 단 한 가지 자극으로 30조(兆) 개가 넘는 온몸의 세포가 동시에 활성화된다. 이렇게 좋은 운동, 운동은 최고의 명약이지만, 운동의 가장 큰 적은 척추와 관절의 통증이다. 운동을 하면 아프고, 운동을 안하면 약해지는 이 딜레마를 어떻게 해결할지가 관건이다.사람들은 척추, 관절이 아프거나, 중년 이후 노화가 시작되면, 운동의 딜레마에 빠지게 된다. 건강에 좋은 운동을 하고 싶어도 자칫, 섣부른 운동이 몸의 회복 상태를 더 악화시키거나 부상을 동반할 수 있다는 두려움에 빠져 이러지도 저러지도 못하는 고민을 하게 되는 것이다. 그런 사람들의 고민을 해결하기 위해서 저자는 임상 경험과 연구를 토대로 방법을 제시하고 있다. 저자는 튼튼한 근육과 뼈 사이에서 이리 찢기고 저리 차이는 힘 받는 연부조직(연골, 힘줄, 인대)을 잘 보호하면서 꾸준히 운동할 수 있는 방법만 알게 되면 ‘척추, 관절을 다친 경험이 있는 사람들이 운동을 해야 할 지 말아야 할지’ 혹은 ‘나이가 들면서 운동을 해야 할지 말아야 할지’라는 딜레마에 빠질 필요가 없다고 말하고 있다. 책에서 제시하는 연부조직을 보호하는 구체적이고 단계적인 운동법은 척추와 관절을 잘 보호하는 운동법으로 이 책의 핵심적인 내용 중 하나이다. 첫 번째로, 자신의 척추와 관절 상태를 정확히 알고 자신의 몸에 맞는 운동을 찾는 것이며,  두 번째로, 그 몸에 맞는 운동법으로 부상없이 운동을 꾸준히 할 수 있게 만드는 것, 그것이 백년운동이다.저자는 1부에서 ‘운동, 최고의 명약 그리고 딜레마’는 운동의 개론적인 내용과 장수(長壽)와 운동이 만날 때 필연적으로 마주하게 되는 딜레마를 다루었다. 과학적으로 증명된 운동 효과를 따져 보고, 건강한 몸을 만드는 운동의 양대 산맥인 유산소운동과 무산소운동을 원칙과 효과면에서 비교하였다. 100세까지 청춘으로 살기 위한 운동을 할 때 척추와 관절에 생기는 당혹스러운 문제와 이를 극복하는 과정을 실제 사례를 통해 설명하고 있다. 2부 ‘척추와 관절에 좋은 유산소운동’에서는 유산소운동을 하는 기본적인 방법을 알기 쉽게 제시하며, 각종 유산소운동이 척추와 관절에 미치는 좋은 영향과 나쁜 영향을 자세히 다루었다. 유산소 운동의 최고봉인 걷기운동에 대해 구체적인 방법을 자세히 기술하여 걷기 운동의 효과, 정확한 방법, 걸을 때 생기는 척추와 관절의 통 증 해석법과 대책을 설명하고 있다. 3부 ‘척추와 관절에 좋은 근력운동’에서는 척추와 관절에 부담을 줄이면서 근력운동을 하는 방법을 최신 연구 결과와 함께 단계적으로 설명한다. 튼튼한 척추와 관절로 100세를 맞기 위해 중요한 10개의 근육을 그 중요도(저자는 ‘가성비’라고 표현함) 순서로 소개하고 각 근육과 척추, 관절의 관계를 감안하여 근력강화운동의 동작을 안전도 순으로 나열하여 속속들이 보여준다. 4부 ‘내 몸에 꼭 맞는 백년운동’에서는 척추와 관절 부담은 줄이고 근력강화 효과는 최대로 늘리는 추천 근력운동의 20개 동작을 엄선하였다. 아홉 가지 맨몸운동과 열한 가지 기구 운동이다. 선택한 20가지 근력운동의 동작과 유산소운동을 종합하여 젊은이부터 노쇠하신 어르신까지, 허리 아픈 분부터 어깨 아픈 분까지, 여러 가지 상황에 맞는 최선의 운동 방법을 제시한다. 특히, 저자는 언제 어디서나 맨몸으로 할 수 있는 4대 기본 맨몸 운동을 제시하면서, 습관화된 생활 속의 운동을 권장하고 있다. 더 나아가 각각의 독자들이 자신의 척추와 관절 상태를 정확히 알고 자신의 몸에 맞는 운동을 이 책을 통해서 찾기를 바라고 있다. 100세까지 살면서 생길 수 있는 갖가지 상황에 가장 적합한 운동 처방이다. 바로 백년운동이다. 저자가 에필로그에서 밝히는 아래 세가지 강조점은 100세까지 운동하기를 원하는 사람들 누구나 한 번씩 새겨 둘 필요가 있을 것이다..	운동 강도는 낮게 시작해 천천히 올리라. 척추와 관절이 아팠던 경험이 있다면 아주 천천히 올리라. .	운동할 때 반드시 풀레인지(full range)로 운동할 필요는 없다. 관절의 전체 범위를 다 쓰지 않아도 된다는 말이다. .	운동하다 아프면 소나기 피하듯 피해서 가라. 운동 강도를 낮추고, 안전도가 높은 운동법으로 내려가는 것이 피하는 방법이다. 끝으로, 저자는 대한민국 전 국민이 100세까지 매일 30분씩 걷고, 30분씩 근력운동을 하는 날이 오기를 기대하는 마음을 이 책을 펴낸다고 한다."
백년 허리 허리 보증 기간을 100년으로 늘리는 방법,정선근,8.76점, 81,건강,질병치료/예방,,"요통의 미스터리를 밝힌다!백년 허리 프로그램, 맥켄지 운동의 전도사, 정선근 서울대 의대 교수가 제안하는 요통과 디스크 치료의 새로운 패러다임『백년 허리』. 이 책은 요통과 허리 디스크의 비밀. 요통으로부터 해방되는 ‘백년 허리 프로젝트’를 제안한다. 서울대 의대 재활 의학과 주임 교수이며 요통, 경부통, 오십견, 관절 통증 등의 치료에 전문가인 정선근 교수는 이 책에서 20세기 후반이 되어서야 본격적으로 밝혀지기 시작한 요통의 미스터리를 해명한다.허리 디스크가 손상되는 메커니즘, 손상된 디스크에서 유출된 물질이 염증과 요통 또는 좌골신경통을 일으키는 기전은 물론이고, 과거 디스크를 치료한다고 해서 시행되었던 디스크 조영술 등의 침습적 시술이 허리 디스크를 망가뜨려 허리 디스크의 수명을 단축시킬 수 있음을 명쾌하게 보여 준다. 그리고 요통을 완화시키고 디스크를 치료하는 데 도움을 준다고 해서 병원에서 소개되고 교육되었던 윌리엄스 운동이나 허리 스트레칭 같은 재활 치료 운동들이 반대로 디스크 손상을 심화시키고 요통 치료에 방해가 될 수 있음을 생생하게 보여 준다. 이 책은 기존의 허리 디스크, 요통 관련 상식들을 깨뜨리는 충격적인 과학적, 의학적 사실들로 가득하다.","98%의 요통 환자는 수술 없이 완치될 수 있다!단 3주 만 따라하면 지긋지긋한 요통의 지옥에서 빠져나올 수 있다!백년 허리 프로그램, 맥켄지 운동의 전도사, 정선근 서울대 의대 교수가 제안하는 요통과 디스크 치료의 새로운 패러다임전 국민의 80퍼센트를 괴롭히는 요통지금 이 순간 오해와 무지가 국민의 허리를 망가뜨리고 있다!허리는 직립 보행을 하는 우리 인간 몸의 기둥이다. 놀라운 자연의 발명품인 허리는 원래 100년 이상 쓰도록 만들어져 있다. 그러나 우리가 무의식적으로 하는 나쁜 자세, 나쁜 운동이 100년 이상 쓸 허리를 매일매일 망가뜨리고 있다. 100년은 쓸 돈이 예금된 통장을 불과 40∼50년 만에 탕진해 버리는 꼴이다.하지만 허리에 좋은 자세, 좋은 운동을 알고 매일 한다면 요통에 빠지지 않고 허리를 100년 동안 건강하게 쓸 수 있다. 대한민국 제일의 요통 전문가 정선근 서울대 의대 재활의학과 주임 교수는 (주)사이언스북스에서 펴낸 『백년 허리: 허리 보증 기간을 100년으로 늘리는 방법』을 통해 요통과 허리 디스크의 비밀. 요통으로부터 해방되는 ‘백년 허리 프로젝트’를 제안한다.허리가 뻐근하고 묵직해지는 약한 통증에서한발자국만 떼어도 허리가 끊어질 것 같은 극심한 고통에서 해방되는요통 해방, ‘백년 허리 프로젝트’허리 통증에 대한 현대 의학의 과학적 이해는 매일매일 진화하고 있다. 하지만 일상생활을 붕괴시키는 요통의 고통 앞에 사람들은 쉽게 잘못된 치료법으로 기울어지고 만다. 그러나 98퍼센트의 요통 환자는 수술 없이 완치될 수 있다. 서울대 의대 재활 의학과 주임 교수이며 요통, 경부통, 오십견, 관절 통증 등의 치료에 전문가인 정선근 교수는 이 책에서 20세기 후반이 되어서야 본격적으로 밝혀지기 시작한 요통의 미스터리를 해명한다. 허리 디스크가 손상되는 메커니즘, 손상된 디스크에서 유출된 물질이 염증과 요통 또는 좌골신경통을 일으키는 기전은 물론이고, 과거 디스크를 치료한다고 해서 시행되었던 디스크 조영술 등의 침습적 시술이 허리 디스크를 망가뜨려 허리 디스크의 수명을 단축시킬 수 있음을 명쾌하게 보여 준다. 그리고 요통을 완화시키고 디스크를 치료하는 데 도움을 준다고 해서 병원에서 소개되고 교육되었던 윌리엄스 운동이나 허리 스트레칭 같은 재활 치료 운동들이 반대로 디스크 손상을 심화시키고 요통 치료에 방해가 될 수 있음을 생생하게 보여 준다. 이 책은 기존의 허리 디스크, 요통 관련 상식들을 깨뜨리는 충격적인 과학적, 의학적 사실들로 가득하다.두 가지를 하지 말고, 두 가지를 기억하라!수술하지 마라! 나쁜 자세, 나쁜 운동을 버리라!자연 복대를 만들라! 맥켄지 운동으로 허리 디스크를 보호하라!정선근 교수는 요통을 예방, 치료하고, 허리의 사용 기간을 늘리는 데 핵심이 수술이나 약물 같은 침습적 치료가 아니라 일상적 관리에 있음을 강조한다. 나쁜 자세, 나쁜 동작, 나쁜 운동이 무엇인지 정확하게 알아서 일상 생활 속에서 피하고, 좋은 자세, 좋은 동작, 좋은 운동이 무엇인지 배워 골라 하라는 말이다. 나쁜 자세, 나쁜 동작, 나쁜 운동의 예로는 최근 허리를 망가뜨린다고 해서 미군 체력 검사에서 배제된 윗몸 일으키기가 대표적이다. 뿐만 아니라 요통 치료 스트레칭으로 많이 권해지는 고양이 등 만들기, 누워서 다리 들기 같은 운동들이 허리 근육을 강화하는 데 도움이 되기는 하지만 일단 디스크 자체가 손상되어 요통이 시작된 30대 이후 중년 남녀에게는 요통이나 좌골신경통을 완화시키기는커녕 불난 집에 부채질하는 꼴로 디스크 손상을 악화시켜 요통과 좌골신경통을 심화시킨다고 날카롭게 비판한다.맥켄지 신전 운동, 자연 복대 훈련, 맥길의 빅 3 운동, 허리 살림 걷기 등 허리에 좋은 10가지 운동과허리 살리기 4단계 프로그램을 총망라한 21세기적 요통 해방 운동의 바이블그렇다면 어떤 것이 좋은 운동인가. 핵심은 목부터 허리까지 우리 몸의 기둥인 척추뼈가 이루는 자연스러운 곡선, 요추 전만 곡선을 유지하고 강화하는 것이다. 정선근 교수는 재활 의학 분야에서 제안되고 시행되는 다양한 운동들 중에서 요추 전만을 강화해 허리의 보증 기간을 늘릴 수 있는 운동들을 선별해 ‘백년 허리 만드는 좋은 운동 10’과 ‘백년 허리 만들기 4단계 프로그램’을 개발했다. 이 책에 소개되어 있는 맥켄지 신전 운동(앉아서 하는 맥켄지 신전 운동, 서서 하는 맥켄지 신전 운동, 엎드려 하는 맥켄지 신전 운동), 자연 복대 만들기 훈련, 엉덩이 관절 경첩 훈련, 세 가지 맥길의 빅 3 운동, 엉덩이 들어 버티기, 엉덩이 뒤로 쭉 빼는 스쿼트, 허리 살림 걷기 같은 운동들은 정선근 교수가 허리가 아픈 사람들, 특히 운동 능력이 퇴화되기 시작한 40대 이후의 환자들을 대상으로 기존의 운동을 개량한 것들이다. 상세한 운동 방법, 동작 자세, 주의 사항 등을 그래픽과 사진으로 세밀하게 소개하고 있다. 이 운동들은 요통과 디스크를 예방하고 치료하는 효과가 있을 뿐만 아니라 스마트폰 중독자들의 거북목 증후군을 막고 목 디스크를 예방하는 부수적인 효과를 가지고 있다.허리는 우리 몸의 기둥이요, 건강한 인생의 핵심이다. 2016년 병신년을 백년 허리 만들기의 원년으로 삼으면 어떨까. 전 대통령 주치의, 송인성 교수가 추천하는 요통, 디스크에서 해방되고 싶어 하는 모든 사람을 위한 책"
