title,author,score,num_reviewers,main genre,middle genre,subclass,introduction,review
설민석의 한국사 대모험 15 신라 편: 천년의 보물을 지켜라!,설민석,0.0점, 1,어린이,어린이(공통),교양/취미,"사라진 태학 3인방을 찾아 한국사 대모험 어벤저스가 뜬다!설쌤과 온달의 기막힌 구출 대작전이 시작됩니다!하늘이 내린 전설의 보물, ‘천사옥대’는 대체 어디에 있을까요?태학 3인방을 구출하려는 설쌤과 온달의 활약과 함께 신라 천 년의 보물을 알아보아요!고구려의 영광을 나타내는 신물을 찾는 과제를 수행하기 위해 길을 나선 태학 3인방. 사실 이들은 고구려 전성기를 열었던 광개토대왕의 유물인 ‘호우명 그릇’을 가져오겠다는 야심 찬 목표를 품고 신라로 몰래 건너간 것이었습니다. 하지만 이후 3인방의 행방이 묘연해지고, 고구려를 대표하는 귀족 가문의 자제들이 사라지자 고구려가 발칵 뒤집힙니다. 그들을 구하기 위해 설쌤과 온달, 그리고 로빈이 신라에 몰래 잠입하고, 황룡사에 붙잡혀 있는 태학 3인방을 찾아내는 데 성공합니다! 한편, 그즈음 신라에서는 진평왕의 뒤를 이어 왕위에 오를 인물이 없어 논쟁이 일었는데, 진평왕은 옥황상제가 내린 신라의 보물 ‘천사옥대’가 허리에 꼭 맞는 사람에게 왕위를 물려주겠다고 합니다. 그런데 이 천사옥대가 한순간에 사라지고, 태학 3인방이 천사옥대를 훔쳤다는 누명을 쓰게 됩니다!과연 천사옥대는 어디에 있는 걸까요? 설쌤과 온달, 로빈은 태학 3인방과 함께 무사히 고구려로 돌아갈 수 있을까요?흥미진진한 스토리로 지식과 재미, 감동과 교훈을 모두 담아내며 초등 학습만화 베스트셀러의 자리를 굳건히 지키고 있는 『설민석의 한국사 대모험』 시리즈가 드디어 15번째 이야기를 선보입니다!블록버스터 액션 영화를 방불케 하는 설쌤과 온달, 로빈의 태학 3인방 구출 작전! 그 과정에서 마주하게 된 신라 천 년의 보물들! 그중에서도 ‘천사옥대’는 신라의 3대 보물 가운데 하나로, 황룡사 장륙존상, 황룡사 구층목탑과 함께 신라를 수호하는 상징적 보물입니다. 또한 설쌤 일행은 신라 최고의 인기곡(?)이었던 〈서동요〉의 주인공들을 만나 그들의 이야기도 듣게 됩니다. 긴박하게 펼쳐지는 설쌤 일행의 모험, 그리고 신라와 백제의 찬란한 문화 이야기로 가득한 『설민석의 한국사 대모험 15』는 독자 여러분에게 신선한 재미와 유익한 지식을 선사할 것입니다.",
흔한남매 6,흔한남매 (원작),9.5점, 19,,,,"가을 하늘처럼 청량한 흔한남매의 웃음과 유머!으뜸이의 눈앞에 나타난 에이미의 도플갱어, 우당탕탕 캠핑 스토리, 데이지의 두근두근 짝사랑, 핼러윈 데이에 재밌게 노는 꿀팁, 흔한 사나이의 치열한 라면 요리 대결, 으뜸이와 에이미의 어릴 적 일기 등 웃음이 솔솔 불어오는 흔한남매의 일상을 만나 볼까요?유튜브 207만 구독 돌파! 인기 크리에이터 흔한남매‘흔한남매’는 유튜브 구독자 수가 207만 명, 누적 조회 수가 14억 회를 넘어서는 인기 크리에이터로, 흔한컴퍼니에 소속되어 있습니다. 상황극 콩트 등을 통해 어린이들에게 큰 사랑을 받고 있으며, 주로 남매 사이에서 일어날 수 있는 현실적인 에피소드를 코믹하게 그려 내어 웃음과 공감을 이끌어 내고 있습니다.흔한남매가 선사하는 유쾌한 우애와 순수한 웃음!《흔한남매 6》은 ‘흔한남매’ 유튜브 영상의 스토리를 앙증맞고 유머러스한 만화로 풀어 낸 코믹북입니다. 하루도 조용할 날이 없는 으뜸이와 에이미의 일상 스토리는 진짜 웃음이 필요한 어린이들에게 순수한 웃음과 유쾌한 우애를 선사할 것입니다.","웃음 폭탄 '에피소드'와 깨알 재미 '놀이'의 조합!어린이의 웃음 코드에 맞춰 엄선한 에피소드를 앙증맞고 유머러스한 만화로 풀어 냈습니다. 웃음을 유발하는 에이미와 으뜸이의 티격태격 일상은 물론이고, 남매의 우당탕탕 캠핑 스토리, 데이지의 두근두근 짝사랑, 흔한 사나이의 요리 대결, 웃음 터지는 2인 체육 대회, 셋이서 놀 때 공감되는 포인트 등 골라 읽는 재미가 가득한 에피소드 만화가 수록되어 있습니다. 또한 에피소드 만화 중간중간에는 유튜브에서는 만날 수 없었던 ‘줄줄이 끝말잇기’, ‘와글와글 진짜 흔한남매 찾기’, ‘완전 폭소! 나만의 핼러윈 분장 만들기’ 등 깨알 재미가 가득한 놀이 페이지가 수록되어 있습니다."
"그리스 로마 신화 19 스핑크스를 물리친 오이디푸스의 지혜,만화로 읽는 초등 인문학",박시연,0.0점, 2,어린이,,,"[줄거리]자식이 생기지 않아 고통받던 테베의 왕 라이오스는 아폴론 신전에 신탁을 구하러 갔다가 마른하늘에 날벼락 같은 말을 듣게 된다. 자기가 낳게 될 아들이 아버지를 죽이는 것도 모자라 어머니와 결혼까지 하게 될 운명이라는 것이다.일 년 후, 왕비 이오카스테는 아들을 낳는다. 끔찍한 신탁이 두려웠던 라이오스왕은 아기의 발목에 깊은 상처를 낸 뒤 부하를 시켜 깊은 산속에 버리게 한다. 생명의 불꽃이 거의 꺼져 갈 무렵, 운 좋게 한 목동이 아기를 발견해 낸다. 목동은 자식이 없어 걱정이던 코린토스의 왕과 왕비에게 귀한 포대기에 싸인 아기를 바친다. 왕비 메로페는 발이 부어올라 있는 아기를 오이디푸스라 부르며 정성껏 사랑으로 기른다.한편 세월이 흘러 늠름하고 용맹하게 자란 오이디푸스에게 큰 시련이 닥친다. 한 코린토스 사람에게 자신이 친아들이 아니라, 주워 온 자식이라는 이야기를 듣게 됐기 때문이다. 부모님에 대해 물으러 한달음에 달려갔던 아폴론 신전에서 오이디푸스는 답변 대신 뜻밖의 이야기를 듣게 된다. 자신이 아버지를 죽이고 어머니와 결혼하게 될 불운한 운명이라는 것! 그길로 오이디푸스는 사랑하는 부모님 곁을 떠나 머나먼 방랑길에 오른다.그러던 어느 날, 오이디푸스의 불운이 발동하기 시작한 것인지 길에서 우연히 만난 고귀한 신분의 사내를 시비 끝에 죽이게 된다. 오이디푸스는 낯선 사내에게 평생 속죄하기로 마음먹고 테베로 발길을 돌린다.하지만 테베로 가는 길목에는 상반신은 여자에 하반신은 사자인 괴물 스핑크스가 떡하니 기다리고 있다! 스핑크스는 아무도 풀지 못하는 수수께끼를 내며 인간들을 마구 잡아먹어 테베를 쑥대밭으로 만들고 있던 터였다. 사나운 스핑크스와 마주한 오이디푸스는 그 기세에 잠시 주춤하지만, 영웅답게 침착함을 되찾아 수수께끼를 당당히 풀어 낸다. 인간에게 졌다는 부끄러움 때문에 마침내 오만한 스핑크스는 사라지고, 오이디푸스는 테베인들의 신임을 얻어 새로운 왕이 된다.그러나 불운한 운명 탓인지 평화롭던 테베가 불길처럼 번지는 전염병으로 대위기를 맞이한다. 아폴론의 신탁에 따르면, 테베에 내린 재앙을 물리치기 위해서는 라이오스왕을 죽인 범인을 찾아야 한다는데???. 과연 지혜로운 왕 오이디푸스는 이 사건을 어떻게 해결해 나갈까?","을 잇는 아울북의 야심작지금까지 없던 새로운 ‘신화’가 시작된다!〈만화로 읽는 초등 인문학, 그리스 로마 신화〉의 새로운 장을 여는 영웅 신화!신과 인간 사이에서 태어난 영웅들이 펼치는 흥미진진한 대모험!“영웅들은 태어날 때부터 시련을 겪습니다. 하지만 시련을 이겨 낼 때, 영웅은 더욱 빛나지요. 우리도 어엿한 어른으로 홀로서기까지 여러 가지 힘든 시련과 변화를 겪어야 하지만, 지혜와 용기로 극복해 나간다면, 누구나 영웅처럼 빛날 수 있습니다.”               - 서울대학교 인문학연구원 HK교수 김헌 “그리스 로마 신화 신들의 이름이 낯설고 너무 많아서 헷갈리는데 아울북 〈만화로 읽는 어린이 인문학, 그리스 로마 신화〉는 외모의 특징을 잘 살린 만화 캐릭터로 이해하기 쉬웠어요.”- 인천정각초등학교 교사 김찬원 “아울북 〈만화로 읽는 어린이 인문학, 그리스 로마 신화〉 속 ‘신화 TALK’ 코너는 신화의 자극적이고 선정적인 내용을 아이들에게 어떻게 전달하고 지도해야 할지 도움을 줍니다. “- 인천부평남초등학교 교사 문새롬 〈만화로 읽는 초등 인문학, 그리스 로마 신화〉는 그리스 로마 신화의 이야기를 재미있는 만화로 풀어내고 신화 속 지식을 쉽게 구성한 책입니다. 그리스 로마 신화는 서양의 문화를 이해하는 원천이고, 신과 영웅들의 다양한 모습을 통해 삶의 지혜를 배울 수 있는 인류 최고의 고전입니다. 또한 수천 년 동안 무한히 펼쳐진 상상력의 세계를 담고 있기도 합니다. 이처럼 중요한 고전이지만 신화를 읽는 어린이들은 복잡하고 어렵게 느껴져 읽기 쉽지 않았습니다. 〈만화로 읽는 초등 인문학, 그리스 로마 신화〉는 신들의 왕 제우스를 중심으로 올림포스 십이 신들이 어떻게 이 세계를 이끌었는지를 시간의 흐름에 따라 재미난 이야기 형식으로 꾸몄습니다. 신화에 대한 쉽고 재미난 해석으로 어린이들이 신화에 친근감을 느끼고, 신화를 제대로 이해하는 데 큰 도움을 줍니다. 〈만화로 읽는 초등 인문학, 그리스 로마 신화〉의 새로운 장을 여는 영웅 신화에서는 그리스 로마 신화 속 다양한 영웅들의 박진감 넘치는 모험이 펼쳐집니다. 신과 인간 사이에서 태어난 영웅은 신의 혈통을 이어받았기에 특별한 능력을 갖추었지만, 인간의 자식이기 때문에 끊임없이 한계에 부딪히며 성장과 도전을 거듭합니다. 이렇듯 위기 속에서 더욱 빛나는 영웅들의 이야기는 어린이들의 가슴속에 깃든 영웅적인 기질을 일깨우고, 시련을 극복하는 용기와 지혜를 선물할 것입니다.*개성 강한 캐릭터와 역동적인 스토리로 쉽고 재미있습니다. 각양각색의 캐릭터들이 이끄는 매력적인 스토리텔링이 아이들의 눈을 먼저 사로잡습니다. 시간의 흐름에 따라 구성된 신화 이야기를 만나다 보면 어렵게만 느껴졌던 그리스 로마 신화가 머릿속에 쏙쏙 들어오며 재미있게 읽을 수 있습니다.*열 가지 테마의 교양 페이지로 신화에 대한 궁금증을 풀어 주었습니다.만화를 통해 신화에 흥미를 가졌다면, 만화 속 또 다른 책인 ‘똑똑해지는 신화 여행’을 통해 인문학적 지식을 얻을 수 있습니다. 그리스 로마 신화에서 꼭 알아야 할 지식들, 만화에서 깊이 있게 다루지 못한 지식들까지 알차게 다루었습니다. 갖가지 지식과 지혜가 담겨 있어서 어린이 인문 교양서로도 손색이 없습니다. *신화 전문가 서울대학교 김헌 교수의 감수를 거친 검증 받은 콘텐츠입니다.신화 관련 명화, 유물 등을 참고하고 고증을 거쳐 만화를 구성했습니다. 또 그리스 신화 전문가인 서울대학교 김헌 교수가 자문으로 참여해 수준 높은 내용을 선보입니다. *궁금한 지식을 해결하고, 깊이 생각해 볼 수 있는 진정한 학습만화입니다. ‘신화 TALK’ 코너에서는 김헌 교수가 직접 신화에 대해 궁금한 점을 되짚어 줍니다. 신화를 어떻게 읽혀야 할지 고민스러운 부모님과 선생님들이 신화 속 의미를 먼저 이해하고 아이들과 함께 생각해 볼 수 있도록 구성했습니다.*신화를 재미있게 익힐 수 있는 신화 캐릭터 카드가 들어있습니다.캐릭터가 가진 특징을 살펴보며 신화 속 여러 신과 영웅들을 쉽게 익힐 수 있고 카드를 활용해 다양한 놀이도 할 수 있습니다. 이 과정을 통해 아이들은 신화를 한층 친밀하게 느낄 것입니다."
고양이 지기의 행복한 비밀상담소,스테판 가르니에,0.0점, 4,어린이,초등3~4학년,교양/취미,"자유롭고, 자신감이 넘치며, 독립적이고, 참을성이 많고,평온하며 행복한 고양이 지기가 어린이들의 고민을 들어주고 따뜻한 조언과 따끔한 충고를 해주며 행복한 어린이로 자랄 수 있도록 도와줘요!프랑스 아마존 베스트 셀러의 어린이판 『고양이 지기의 행복한 비밀상담소』는 자유롭고, 자신감 넘치며, 독립적이고, 참을성 많고, 평온하며 행복한 고양이 지기가 어린이들의 고민을 들어주고 따뜻한 조언과 따끔한 충고를 해주며 행복한 어린이로 자랄 수 있도록 도와주는 이야기를 담고 있어요.고양이 지기는 길고양이 혈통에 다리 하나가 없지만, 친절과 사랑이 넘치고 명민한 두뇌를 가졌답니다.마을 광장에서 놀던 아이들의 고민을 귀 기울여 듣던 지기는 그 아이들에게 도움을 주기로 결심합니다.고양이가 잘 사는 비결이 무엇인지? 행복의 비밀은 무엇인지? 삶의 비밀은 무엇인지? 알려주고 아이들의 삶을 좀 더 행복하게 변화시켜 주고 싶었어요.고양이를 통해 세상을 두려워하지 않고, 나와 다른 사람들에게 귀 기울이고, 나 자신을 드러내고, 내가 좋아하는 일을 하고, 필요할 땐 도움을 요청하고, 나 자신을 믿고, 내일의 내 삶에 대해 생각하는 법을 배워 나가는 아이들의 이야기를 통해서 이 글을 읽는 어린이들도 함께 성장해 나갈 수 있어요.","프랑스 아마존 베스트셀러의 어린이판으로 출간된『고양이 지기의 행복한 비밀상담소』는 작가가 15년 동안 반려묘를 관찰하며 쓴 책이에요. 억지로 꾸미지 않아도 그 자체로 사랑받는 고양이의 모습을 통해 우리가 배울 수 있는 것들을 재미있는 에피소드들을 통해 알려주고 있어요. 각자의 고민을 가지고 있는 어린이 친구들을 고양이 지기가 찾아가서 고민을 들어주고 스스로 해결할 수 있도록 도와주는 각 에피소드 뒤에는 고양이와의 대화를 통해 이 책을 읽는 어린이들이 같이 생각 할 수 있는 부분을 만들어 놨어요. 고양이를 통해 세상을 두려워하지 않고, 나와 다른 사람들에게 귀 기울이고, 나 자신을 드러내고, 내가 좋아하는 일을 하고, 필요할 땐 도움을 요청하고, 나 자신을 믿고, 내일의 내 삶에 대해 생각하는 법을 배워 나가는 아이들의 이야기를 통해서 이 글을 읽는 어린이들도 함께 성장해 나갈 수 있어요.다른 사람들에게 인정받고 싶나요?멋지게 보이고 싶나요?안정감을 느끼고 싶나요?누구에게나 사랑받는 고양이처럼요?똑똑하고 유쾌하며 지혜로운 고양이 지기와 함께라면 여러분도 삶의 주인이 될 수 있어요.평온과 믿음을 찾아서! 더 많은 자유를 찾아서!어떻게 하면 부모님 앞에서 발톱을 감출 수 있는지 고양이 지기가 여러분에게 알려줄 거예요. (쉿, 이건 비밀이에요!)고양이처럼 행복하게 사는 방법을 알려줄게요. 고양이는 아주 특별한 존재니까요. 여러분처럼요!"
좀비고등학교 코믹스 21 원정의 끝,유대영,0.0점, 0,,,,"좀비에게 붙잡혀 기절했던 유리는 뜻밖에 아람이를 마주하게 되고, 둘은 친구들에게 자신들의 위치를 알리려고 노력한다.경비 삼대장에게 쫓기던 용규, 예슬, 준범은 몸을 숨기려 건우의 원예부실을 찾아가고, 건우는 이들을 거부하지만 예슬의 이야기에 이내 마음이 움직여 숨겨 주기로 한다.한편 현지는 무의식 상태인 윤슬을 구하려다가 불새 재단의 새로운 실험체가 될 위기에 놓인다.무기를 찾기 위해 제로의 은신처에 들어선 나래, 산하, 준형은 갑작스레 좀비들과 맞닥뜨리게 되고, 그 사이 최후의 방어선에서 홀로 싸우던 동석은 점점 힘이 빠져 가는데….1차 원정이 끝나고 다시 모인 좀비고등학교 비밀 원정대.아직 싸움은 끝나지 않았다!",
밍꼬발랄 코믹스 6,김혜련,0.0점, 0,,,,"눈을 떠 보니 온통 자신과 똑같은 얼굴들로 가득한 세상에 떨어진 밍꼬!과연 밍꼬는 원래 세상으로 돌아갈 수 있을까?책 속 세상에 적응하면서 현실 세상에 대한 기억을 점점 잃어가는 밍꼬.의문의 할머니는 밍꼬에게 책은 틀림없이 밍꼬의 주변에 있을 거라는 말을 남기고 사라진다.그러던 중 밍꼬는 거리에서 풍선을 보고 표식으로 착각해 쫓아가고, 황수빈은 그 모습을 몰래 지켜본다.한편, 친구들은 밍꼬와 웅이 사이가 전보다 더 가까워진 것을 보고 둘을 미행하다가 웅이와 사촌인 황수빈까지 밍꼬네 앞집에 산다는 것을 알게 된다.밍꼬와 웅이의 사이를 돕는다는 핑계로 친구들은 황수빈을 만나기 위해 밍꼬의 집에서 막무가내로 기다리게 되는데….",
흔한남매의 흔한 호기심. 1 일상에서 만나는 과학 상식,흔한남매 (원작),10.0점, 17,,,,"궁금한 게 너~무 많은 호기심 꿈나무들 모여라!흔한남매가 어린이들의 호기심 해결을 위해 출동했다!구독자 수 206만 명의 인기 유튜브 크리에이터, 흔한남매의 과학 학습 만화!. 학습 만화라서 어렵고 딱딱할 것이라는 생각은 금물! 이 책은 유머러스한 에피소드 '만화'와 말랑말랑한 과학 '정보' 페이지, 핵심 키워드를 담은 '퀴즈', 그리고 마지막으로 성취감을 길러 줄 '특별 칭찬 상장'까지 지루할 틈 없는 흥미로운 구성으로 가득하다. 이 책을 통해 으로 배꼽 잡는 재미와 과학 호기심을 동시에 잡아보자.『흔한남매의 흔한 호기심』제1권. 우리 일상 속에도 다양한 과학 원리가 숨어 있다?  우리가 주변에서 흔히 듣는 ‘땅에 떨어진 음식을 3초 안에 주워 먹으면 괜찮다’는 속설에도 박테리아의 이동 속도와 관련된 과학 원리가 숨어 있다. 이 책에서는 ‘매운 걸 먹으면 스트레스가 풀릴까?’, ‘라면 면발은 왜 꼬불꼬불할까?’ 등 일상에서 한 번쯤은 궁금증을 느껴 봤을 18개의 호기심을 모았다.","궁금해 죽겠지? 궁금해 죽겠네!일상에서 만나는 과학 호기심 18개 수록우리 일상 속에도 다양한 과학 원리가 숨어 있다는 것, 알고 계셨나요? 우리가 주변에서 흔히 듣는 ‘땅에 떨어진 음식을 3초 안에 주워 먹으면 괜찮다’는 속설에도 박테리아의 이동 속도와 관련된 과학 원리가 숨어 있답니다.  〈흔한남매의 흔한 호기심〉 1권에서는 ‘매운 걸 먹으면 스트레스가 풀릴까?’, ‘라면 면발은 왜 꼬불꼬불할까?’ 등 일상에서 한 번쯤은 궁금증을 느껴 봤을 18개의 호기심을 모았습니다. 초등 과학 교과 완벽 연계! 알찬 정보 페이지를 통해 호기심 해결!각 화 에피소드의 마지막에 삽입되는 정보 페이지를 통해 초등 과학 교과 내용과 관련된 다양한 과학 지식을 익힐 수 있습니다. 뿐만 아니라 호기심 주제와 관련된 기본 과학 개념을 설명하는 ‘흔한 과학 상식’, 실생활에 관련된 꿀팁을 소개하는 ‘짤막 호기심’ 등의 짧은 코너를 통해 더욱 다채로운 정보를 제공합니다. 과학 지식이 머릿속에 쏙쏙!흔한남매와 함께라면 나도 호기심 박사!단순히 과학 정보를 나열하는 것이 아니라, 어린이 독자들이 다양한 활동을 즐기며 핵심 개념을 자연스럽게 익힐 수 있도록 구성했습니다. 6화마다 한 번씩 삽입되는 ‘몸풀기 퀴즈’ 코너에서는 초성 퀴즈, OX 퀴즈, 줄 잇기 퀴즈 등 간단한 퀴즈를 풀면서 본문에서 배운 핵심 개념을 익힐 수 있으며, 책 말미에 삽입되는  ‘호기심 레벨 업’ 코너에서는 4지선다로 이루어진 재미있는 문제를 풀면서 본문에서 배운 내용을 전체적으로 복습할 수 있습니다. 만화를 읽고 문제를 풀다 보면 굳이 외우지 않아도 본문 속의 과학 정보가 머릿속에 쏙쏙 들어올 것입니다.이 세상에 단 하나뿐인 상장!냐하 호기심 해결단 특별 칭찬 상장도서 말미에는 이 세상에서 단 하나뿐인 상장이 수록되어 있습니다. 바로 냐하 호기심 해결단이 수여하는 특별 칭찬 상장이지요. 〈흔한남매의 흔한 호기심〉을 통해 호기심 18개를 모두 해결하고 나면, 독자 여러분의 이름을 써 넣으며 성취감을 쑥쑥 길러 보세요."
