title,author,score,num_reviewers,main genre,middle genre,subclass,introduction,review"놓지 마 초등 영단어 1 만화로 재미있게, 단어가 쏙쏙, 영어가 술술~",신태훈,10.0점, 108,어린이,초등3~4학년,학습/학습만화,"『놓지 마 과학!』에 이어 〈놓지 마 정신줄!〉이재미있는 영어책으로 찾아왔다!2009~2019년 연재된 웹툰 〈놓지 마 정신줄!〉 은 조회수 28억 뷰가 넘는 초인기 웹툰으로 초등학생들의 절대적인 지지와 사랑을 받으며 애니메이션으로까지 만들어졌으며 현재 드라마로도 제작중이다. 2016년 〈놓지 마 정신줄!〉의 캐릭터들이 등장하여 생활 속에서 생기는 과학적 질문들을 엉뚱하고도 기발하게 풀어낸 『놓지 마 과학!』 학습만화 시리즈가 출시되었다. 출간되자마자 베스트셀러에 오르며 열 번 넘게 반복해서 읽었다는 리뷰와 더불어, 다음 권 출간을 기다리는 독자들의 독촉이 쇄도할 만큼 반응이 뜨거웠다. 2016년 8월 첫 권 출간 후 2020년 6월까지 13권이 출간되었는데 총 65만 부 이상 판매되었으며 시리즈는 앞으로 지속할 예정이다. ‘과학’에 이어 이번에는 ‘영어’를 소재로 한 학습물 『놓지 마 초등 영단어』가 출간되었다. 이 책은 국내에서 처음으로 시도되는 4컷 만화 형식의 영단어 책으로, 기존의 영단어 책들과는 확연히 차별화된다. 기존 책들에서 그림이 단어나 예문을 설명하기 위한 삽화의 개념으로 사용되었다면, 이 책은 만화라는 형식 안에 단어와 예문을 녹여내어 재미와 학습적 효과 두 가지를 완벽하게 만족하게 한다.정신이네 가족의 엉뚱 발랄한 일상을 담은 만화를 보면서 아이들은 스스로 즐거운 영어 경험을 시작하게 된다. 외워도 금방 잊어버리고 또다시 반복하는 따분한 단어 암기는 이제 그만! 만화를 보며 웃다 보면 단어가 머릿속에 쏙쏙 기억되고, 상황에 딱 맞는 영어 문장이 저절로 기억나는 『놓지 마 초등 영단어』로 영어 공부도 재미있게 시작해 보자!  교육부 권장 초등 필수 단어 800개로 구성된 초등 영어 완벽 대비만화 내용을 연상하며 단어와 문장을 기억하는 최상의 학습법『놓지 마 초등 영단어』는 초등 교육과정 어휘를 반영한 총 800개 단어를 1, 2권에 나누어 담았다. 하나의 단어를 4컷 만화로 재미있게 풀어놓았는데 단어와 문장이 사용되는 상황과 맥락을 만화로 재미있고 이해하기 쉽게 구성하였다. 단어를 떠올리면 해당 만화의 내용이 자연스럽게 떠올라 연상 작용을 통해 단어와 예문을 기억하게 함으로써 개별 단어로만 학습한 것보다 더 효과적으로 오랫동안 단어를 기억할 수 있다.또한 ‘FRUITS’ ‘JOBS’ ‘THE KITCHEN’ ‘SEA ANIMALS’ ‘TRANSPORTATION’ ‘THE CLASSROOM’ 등 생활 속에서 자주 접하는 기본적인 어휘들을 주제별로 묶어 총 22개 주제, 350여 개 단어를 그림 사전 형식으로 구성한 PICTURE WORDS 코너를 추가로 수록하였다.본책에 수록된 단어와 예문을 원어민의 정확한 발음으로 들을 수 있는 QR 코드가 삽입된 소책자 형태의 단어장도 함께 구성되어 있다. 단어장만 있어도 언제 어디서나 간편하게 단어와 문장을 듣고 말해 볼 수 있기에 상당히 유용하다.영어 단어 암기에 힘들어하는 아이들, 돌아서면 까먹고 쉽게 잊어버리는 아이들, 영어 공부에 흥미를 갖지 못한 아이들이 재미있는 만화를 통해 어느새 영어와 친해지고 영어에 자신감이 생기는 마법 같은 책이 될 것이다. 정신이네 가족의 일상은 아이들의 일상과 비슷해서 공감하며 즐겁게 만화를 읽다 보면 만화 속 생동감 넘치는 영어 문장들이 저절로 팡팡 터져 나와 말하기 실력도 함께 쑥쑥 자랄 것이다. 페이지 번호가 영어로도 표기되어 있으며, 표지를 색칠할 수 있는 컬러링까지 포함되어 있어 처음부터 끝까지 재미 요소를 놓치지 않았다.","교육부 권장 초등 필수 단어 800개로 구성된 초등 영어 완벽 대비만화 내용을 연상하며 단어와 문장을 기억하는 최상의 학습법단어만 반복 암기하는 따분한 학습은 No! 간결하고 생동감 넘치는 문장을 통해 단어를 배우고 말하기 실력도 함께 쑥쑥 키워보자. 『놓지 마 초등 영단어』에는 초등 교육과정 어휘를 반영한 총 800개 단어를 1,2권에 나누어 담았다. 하나의 단어를 4컷 만화로 재미있게 풀어놓았는데 단어와 문장이 사용되는 상황과 맥락을 만화로 재미있고 이해하기 쉽게 구성하였다. 단어를 떠올리면 해당 만화의 내용이 자연스럽게 떠올라 기억하게 함으로써 재미와 학습을 동시에 잡았다. 또한 ‘Fruits’ ‘Jobs’ ‘The Kitchen’ ‘Sea Animals’ ‘Transportation’ ‘The Classroom’ 등등 어휘를 학습할 수 있는 22개 주제의 주제별 그림 단어가 수록되어 있다.원어민의 정확한 발음으로 단어와 문장을 들을 수 있는 QR 코드가 수록된 단어장이 함께 들어 있다. 단어장만 있어도 언제 어디서나 간편하게 단어와 문장을 듣고 말해 볼 수 있기에 상당히 유용하다.영어 단어 암기에 힘들어 하는 아이들, 돌아서면 까먹고 쉽게 잊어버리는 아이들, 영어 공부에 흥미를 갖지 못한 아이들에게 만화를 재미있게 보다 보면 어느새 영어 단어를 익히게 되는 마법같은 책이 될 것이다."
Write Right 1,BUILD&GROW; 편집부,9.4점, 7,해외도서,유아청소년/교육,,"- 독자대상: 기본적인 READING과 GRAMMAR를 학습하여 간단한 문장쓰기가 가능한 학생, 초등 3~6학년 또는 어학원 2~3년차 학생- 특징① 문법 위주의 단일 문장 쓰기가 아닌 문단 쓰기를 훈련 ② GRAPHIC ORGANIZER를 통해 글을 구성, 완성하는 능력 향상 ③ WRITING 초급 학생의 흥미와 수준을 고려한 내용 구성 ④ GUIDED WRITING에서 INDEPENDENT WRITING으로의 단계별 학습 ⑤ 다양하고 흥미로운 WRITING PROJECT PAGE 제공 ⑥ 온라인 무료 제공: 정답 및 해설, 교사용 첨삭 가이드, 단어장",
READING FOR VOCABULARY LEVEL A A,JAKE MURRAY,9.94점, 41,어린이,어린이영어,영어학습교재,"『READING FOR VOCABULARY』시리즈 LEVEL A. 《READING FOR VOCABULARY》시리즈는 기초적인 영어 학습 과정을 마친 초등 고학년, 중학교 저학년 학생들을 위한 READING 교재이다. 현재 미국 교과과정에서 사용되고 있는 교과서 수준의 지문을 이용하여 기초 단계에서 한 걸음 더 나아가려는 학생들의 요구를 충족시킬 수 있도록 하였다.","Reading for Vocabulary 시리즈는 기초적인 영어 학습 과정을 마친 초등 고학년, 중학교 저학년 학생들을 위한 Reading 교재이다. 현재 미국 교과과정에서 사용되고 있는 교과서 수준의 지문을 이용하여 기초 단계에서 한 걸음 더 나아가려는 학생들의 요구를 충족시킬 수 있도록 하였다. 지문은 다양한 분야의 재미있는 주제로 구성되어 학생들의 흥미를 유발할 수 있도록 하였으며, 지문의 독해 과정에서 자연스럽게 어휘의 뜻과 쓰임을 이해할 수 있도록 하였다. 매 lesson마다 다양한 형태의 문제풀이를 통해 어휘와 지문 전체에 대한 이해 정도를 점검할 수 있다. 1. 재미있고 유익한 지문들로 수업시간이 즐거워진다과학, 인문, 사회, 예술 등 다양한 주제의 재미있는 영어 지문이 수록되어, 영어 학습과 동시에 폭넓은 정보와 지식의 습득이 이루어질 수 있도록 하였다. 2. 한 주제를 여러 차원에서 접근해 보자하나의 주제에 대해 Level에 따라 2~3개의 영역별 지문이 제시되어 학생들이 한 주제에 대해 입체적으로 사고할 수 있도록 하였다. 예를 들어 ‘인간의 신체(Human Body)’라는 주제에 대해 ‘뼈의 신비(Science)’, ‘세계에서 가장 키 큰 사람(Social Studies)’, ‘건강 유지하기(Health)’라는 세가지 영역별 지문을 학습함으로써 해당 주제에 대한 다양한 이해와 흥미 유발이 가능하도록 하였다. 3. 영어 어휘가 자연스럽게 이해된다영어 지문을 읽으며 자연스럽게 어휘의 의미가 이해되도록 함으로써, 어휘의 뜻만 단순히 암기하는데 그치지 않고 전체 문맥상의 의미를 이해할 수 있도록 하였다.4. 배운 내용은 확실히 내 것으로 만들자빈칸 채우기, 크로스워드 퍼즐 등 다양한 형태의 exercise 문제를 3 페이지에 걸쳐 풀어봄으로써 학습한 어휘를 확실하게 자기 것으로 만들 수 있도록 하였다. 또한 comprehension 문제를 통해 학습한 지문의 내용 이해 정도를 확인할 수 있도록 하였다."
초등코치 천일문 Sentence 3 1001개 통문장 암기로 완성하는 영어의 기초,김기훈,0.0점, 2,학습/참고서,초등학교,초등3학년,"▶ 내신, 수능, 말하기∙듣기, 공인인증, 회화! 목적은 달라도 영어의 시작은 “초등코치 천일문”▶ 1,001개 통문장 암기로 초등학생 때 모든 영어 학습의 기초를 완성한다!  1. 영어를 공부하는 목표가 무엇이든 가장 중요한 것은 영어의 기초를 다지는 것이다!한 번 제대로 다져놓은 영어 기초는 학년이 올라갈수록 어려워지는 영어를 대처하는 근간이 되고, 나아가 수능과 성인영어를 정복할 수 있는 단단한 기둥이 된다. 그렇기 때문에 본격적으로 영어를 접하기 전인 초등학생의 영어 기초 다지기는 매우 중요하다. 2. 영어 기초 다지기를 위한 가장 효율적인 방법 ‘통문장 암기’통문장 암기가 왜 필요할까? 문법 공부를 예로 들어 보자. ‘사역동사 let 뒤에는 목적어가 오고 그뒤에는 목적격보어로 원형부정사가 온다.’ 듣기만 해도 어려운 문법 용어와 규칙인데, 시험을 위해서는 무조건 암기해야 한다. 그런데 내 머릿속에 이미 ‘Let me go home. (초등코치 천일문 SENTENCE 870번 문장)’이라는 문장이 저장되어 언제든 튀어나올 준비가 되어 있다면? 1,001개 문장만 외워두면 문법, 독해, 어휘, 말하기•듣기, 쓰기 등 무엇을 공부하든 이해가 훨씬 쉬워져 영어 공부에 들어가는 시간은 확 줄이고 효과는 더욱 높일 수 있다. 3. ‘통문장 암기’의 최적화 <초등코치 천일문 SENTENCE><초등코치 천일문 SENTENCE>는 1,001개의 통문장 암기를 통해 초등학생의 영어 기초를 완성하자는 목적으로 기획되었다. 문장을 더욱 쉽게 이해하고 기억할 수 있도록 귀엽고 재미있는 일러스트를 삽입하고 5권으로 책을 분권화해 부담스럽지 않도록 구성했다. 4. <초등코치 천일문 SENTENCE> 왜 좋을까?무작정 1,001개 문장을 외우는 것이 아니라, 꼭 알아야 할 패턴 112개와 실생활에 유용한 표현들로 분류된 문장을 여러 방법을 통해 재미있게 공부하는 것이다. 미국 현지 초등학생 원어민 성우들이 직접 문장을 녹음해 듣고, 말하는 연습에 생동감을 더하고 워크북을 통해 외운 문장과 단어를 반복해 학습할 수 있다. <초등코치 천일문 SENTENCE>를 통해 다져놓은 탄탄한 영어 기초는 앞으로 만나게 될 모든 영어 영역에 쉽고 빠른 길을 제시해 줄 것이다. 아이들이 영어의 꽃길만 걸을 수 있도록 지금 <초등코치 천일문 SENTENCE>를 시작해보자!","▶ 내신, 수능, 말하기?듣기, 공인인증, 회화! 목적은 달라도 영어의 시작은 “초등코치 천일문”▶ 1,001개 통문장 암기로 초등학생 때 모든 영어 학습의 기초를 완성한다!  1. 영어를 공부하는 목표가 무엇이든 가장 중요한 것은 영어의 기초를 다지는 것이다!한 번 제대로 다져놓은 영어 기초는 학년이 올라갈수록 어려워지는 영어를 대처하는 근간이 되고, 나아가 수능과 성인영어를 정복할 수 있는 단단한 기둥이 된다. 그렇기 때문에 본격적으로 영어를 접하기 전인 초등학생의 영어 기초 다지기는 매우 중요하다. 2. 영어 기초 다지기를 위한 가장 효율적인 방법 ‘통문장 암기’통문장 암기가 왜 필요할까? 문법 공부를 예로 들어 보자. ‘사역동사 let 뒤에는 목적어가 오고 그뒤에는 목적격보어로 원형부정사가 온다.’ 듣기만 해도 어려운 문법 용어와 규칙인데, 시험을 위해서는 무조건 암기해야 한다. 그런데 내 머릿속에 이미 ‘Let me go home. (초등코치 천일문 SENTENCE 870번 문장)’이라는 문장이 저장되어 언제든 튀어나올 준비가 되어 있다면? 1,001개 문장만 외워두면 문법, 독해, 어휘, 말하기?듣기, 쓰기 등 무엇을 공부하든 이해가 훨씬 쉬워져 영어 공부에 들어가는 시간은 확 줄이고 효과는 더욱 높일 수 있다. 3. ‘통문장 암기’의 최적화 《초등코치 천일문 SENTENCE》《초등코치 천일문 SENTENCE》는 1,001개의 통문장 암기를 통해 초등학생의 영어 기초를 완성하자는 목적으로 기획되었다. 문장을 더욱 쉽게 이해하고 기억할 수 있도록 귀엽고 재미있는 일러스트를 삽입하고 5권으로 책을 분권화해 부담스럽지 않도록 구성했다. 4. 《초등코치 천일문 SENTENCE》 왜 좋을까?무작정 1,001개 문장을 외우는 것이 아니라, 꼭 알아야 할 패턴 112개와 실생활에 유용한 표현들로 분류된 문장을 여러 방법을 통해 재미있게 공부하는 것이다. 미국 현지 초등학생 원어민 성우들이 직접 문장을 녹음해 듣고, 말하는 연습에 생동감을 더하고 워크북을 통해 외운 문장과 단어를 반복해 학습할 수 있다. 《초등코치 천일문 SENTENCE》를 통해 다져놓은 탄탄한 영어 기초는 앞으로 만나게 될 모든 영어 영역에 쉽고 빠른 길을 제시해 줄 것이다. 아이들이 영어의 꽃길만 걸을 수 있도록 지금 《초등코치 천일문 SENTENCE》를 시작해보자![출판사 서평]Step1. 대표 문장과 패턴을 확인합니다.- 미국 도서관 협회 추천 영어 동화책을 분석하여 가장 많이 쓰이던 패턴 11가지를 쉽고 간략한 설명과 함께 여러 예문으로 제시했습니다. Step2. 미국 현지 초등학생 원어민 성우들이 읽는 문장들을 듣고 그림과 연결합니다.- 귀로 듣고 눈으로 보면서 직접 패턴과 청크들을 연결합니다. 보기와 듣기까지 동시에 함으로써 학습 내용을 오래 기억할 수 있습니다. Step3. 단어와 청크를 집중적으로 연습합니다. - 단어와 청크 뜻에 맞는 그림을 연결해 보면서 문장을 완성합니다. 실생활에서 자주 쓸 수 있는 유용한 표현들을 익힐 수 있습니다. Step4. 각 그림 상황에 알맞은 문장을 완성합니다. - 앞에서 배운 패턴과 청크를 사용하여 완전한 문장을 써 봅니다. 재미있는 그림을 통해 문장이 실제로 사용되는 상황을 알 수 있습니다. Step5. 각 대화 상황에 알맞은 문장을 넣어 봅니다.- 학습한 문장이 실제로 어떤 대화 상황에서 쓰일 수 있는지 확실하게 알 수 있습니다. Step6. 워크북으로 단어 및 청크, 문장을 마스터합니다. Step7. 무료 부가 서비스 자료로 완벽하게 복습합니다. - 어휘리스트, 어휘테스트, 본문 해석 연습지, 본문 말하기?영작 연습지, MP3파일 *각 교재에는 부록 MP3 CD가 들어 있습니다.▶ <초등코치 천일문> 학습자료 다운로드: cafe.naver.com/1001moon카페 회원 가입시 초등코치 천일문 Sentence 마스터북 증정 (~기간한정)"
"초등 영어, 구문이 독해다 1 저절로 Reading이 되는 단어, 문장의 구문 독해",키 영어학습방법연구소,10.0점, 2,학습/참고서,초등학교,초등1학년,"초등 독해, 제대로 구문으로!!이제 『구문이 독해다』로 빠르고 정확하게 영어 독해를 한다. 초등 독해 3단계 훈련 ①주제별 단어+단어 덩어리 훈련 ②문법 규칙에 따라 직독직해로 문장 끊어 읽기 훈련 ③문장 해석, 문장 쓰기, 본문 복습의 촘촘한 복습 훈련","1. 단어와 문장에 대한 훈련으로 영어 읽기를 해요!단어와 우리말 뜻만을 수없이 반복하여 외우는 것이 아니라 서로 연관성 있고 의미로 연상되는 단어끼리 〈단어+단어〉로 훈련하여 읽기가 더 쉬워집니다. 그리고 문장의 특징인 문장 규칙을 배우고 연습하여 읽기에 바로바로 적용시키면 쉽게 읽기를 할 수 있습니다.  워크북에서도 단어 덩어리와 문장을 우리말로 그리고 영어로 쓰는 연습을 할 수 있게 하여 초등 어떤 문장이 나와도 읽기가 가능해집니다.2. 끊어 읽기, 직독직해로 문장을 바로바로 해석해요!전체 Reading을 읽고 내용을 파악하는 기본기와 함께 좀더 정확하게 읽기 위해서 앞에서 배운 문장의 규칙에 따라 끊어 읽고 해석합니다. 이를 통해 빠르고 어려운 지문을 정확하게 읽을 수 있습니다. 문장을 정확하게 이해했는지는 워크북으로 주어진 단어들을 문장으로 배열하고 다시 우리말에 맞게 영문장을 쓰면서 읽기뿐만 아니라 말하기, 쓰기까지 확인할 수 있습니다! ★★★ 이런 학생에게 좋아요!*단어와 문장의 기본기가 필요한 학생 *문장에 대한 이해와 정확한 해석이 필요한 학생★★★ 다양한 소재와 주제의 글감으로 읽기의 재미를 주는 책!!과학, 사회, 언어, 역사, 예술 등의 nonfiction과 우화, 소설 등의 fiction의 다채로운 글감으로 읽기의 재미를 주는 책★★★ 직독직해로 꼼꼼하게 읽을 수 있게 구성된 참신한 책!!!다채로운 글감으로 읽기의 재미를 주는 책이면서 동시에 정확하고 꼼꼼하게 글을 읽을 수 있게 직독직해로 해석하며 독해 실력 향상"
"초등 영단어, 단어가 읽기다 LEVEL 4 Words for Reading, 워드 포 리딩",키 영어학습방법연구소,10.0점, 4,어린이,초등1~2학년,학습/학습만화,"초등 교육과정을 완벽 분석하여 하루 10단어만 익히면 ‘어휘’, ‘읽기’까지 저절로 되는 구성이다. '단어가 읽기다' 시리즈는 총 4권으로 구성되어 있으며, 교육부 권장 초등 필수 영단어 800개, 교과서에 나오는 초등 핵심 문장 100문장, 쉽고 재미있는 90개의 리딩을 마스터할 수 있다. LEVEL 1은 초등학교 3학년 과정, LEVEL 2는 4학년 과정, LEVEL 3는 5학년 과정, LEVEL 4는 6학년 과정으로 구성되어 있어 아주 쉬운 단어와 리딩부터 시작하여 점차 누적되어 어려운 지문까지 마스터하게 할 수 있게 단계적으로 촘촘하게 구성하였다.★ 본 책의 음원 제공 방식이 변경됩니다. (CD → 표지와 내지의 QR 코드 스캔) 재고 상황에 따라 랜덤으로 발송될 수 있는 점 참고 바랍니다. ★","출간 즉시 영단어 베스트셀러, [단어가 읽기다]“분명 단어 공부를 했는데 문장이 저절로 외워졌어요! 배운 단어들로 어떤 스토리가 나올지 기대돼요!”“앞서 나온 단어가 반복되어 나오니 쉽게 느껴져서 너무 좋아요!”“초등필수영단어를 익히려고 샀는데, 영어 교과서 내신까지 완전히 대비한 느낌이에요!”[단어가 읽기다 Level 1, 2]을 접한 독자의 반응이다. [단어가 읽기다 Level 3, 4]에서는 초등 영단어를 익혔더니 픽션, 논픽션, 스토리, 퀴즈 등 폭넓은 리딩이 저절로 가능하도록 구성했다. 특히 자기소개 글 쓰기, 나의 경험 쓰기, 주어진 단어 배열하기 등 쓰기 문제를 강화하여 초중등 서술형을 대비하는 데도 효과적이다.초등 영단어, 읽을 수 있어야 진짜 단어다! ""단어를 배우면 읽기가 저절로 된다! 그게 진짜 단어다!""단어를 익혔더니 단어를 보면 뜻이 떠오른다? 단어를 익혔더니 단어는 물론 스토리가 술술 읽힌다? 무엇이 진짜 실력일까? 당연히 후자다. 이제 '단어' 따로, '읽기' 따로가 아니라 단어와 문장을 익혔으면 읽기로 확장되어야 한다. [단어가 읽기다]에서는 누적 방식으로, 앞서 외운 단어와 문장 패턴이 확장되어 리딩 지문에 그대로 나와 반복학습의 효과를 극대화할 수 있다.처음부터 어려운 단어로 엄청나게 많은 단어를 외우겠다고 욕심내지 말자! 하루 12단어씩 단어, 문장, 리딩으로 확장하여 ‘제대로’ 쌓는 실력, 그게 무서운거다. 단어를 익힌 후에는 ‘쓰기훈련노트’로 쓰기까지 마스터하자! 이제, 단어가 읽기다!단어가 단어다? No! 단어가 읽기다!단어를 배우면 읽기가 저절로! 초등 영단어 Words for Reading초등 교육과정을 완벽 분석하여 하루 12단어만 익히면 ‘어휘’, ‘읽기’까지 저절로 되는 구성!1. 초등학교 교과서를 완벽 분석했어요!교육부 권장 초등 필수 영단어 800개, 교과서 필수 영단어 200개 [총 1000개의 영단어 학습], 교과서에 나오는 초등 핵심 문장 100문장, 쉽고 재미있는 90개의 리딩을 마스터할 수 있습니다. [단어가 읽기다]는 총 4권으로 구성되어 있어요. Level 1은 초등학교 3학년 과정, Level 2는 4학년 과정, Level 3는 5학년 과정, Level 4는 6학년 과정으로 구성되어 있어, 아주 쉬운 단어와 리딩부터 시작하여, 점차 누적되어 어려운 지문까지 마스터하게 할 수 있게 단계적으로 촘촘하게 구성하였어요.2. 하루에 주제별로 딱 12단어만 외우면 돼요!단어는 주제별로 관련 있는 단어와 묶어서 외우는 게 기억에 오래 남습니다. [단어가 읽기다]는 주제별로 하루에 12단어씩 외울 수 있게 구성되어 있습니다. ‘단어를 좀 더 많이 외워야 하지 않을까?’ 욕심내지 마세요! 하루에 12단어면 충분합니다. 단, 보고, 듣고, 읽고, 쓰면서 반복학습해서 단어를 완전히 ‘내 것’으로 만드는 게 중요합니다.3. 단어와 문장 패턴을 외우면, 읽기로 그대로 연결돼요!‘단어’ 따로, ‘읽기’ 따로가 아니라, 단어와 문장을 익혔으면 읽기로 확장되어야 합니다. [단어와 읽기다]에서는 누적 방식으로, 앞서 외운 단어와 문장 패턴이 확장되어 리딩 지문에 그대로 나와 반복학습의 효과를 극대화할 수 있어요! 예를 들어, 동물 관련 ‘단어’를 배웠다면, 동물을 묘사하는 ‘문장 패턴’을 익힌 후, 단어와 문장 패턴이 그대로 확장된 ‘읽기’를 통해 영어에 자신감을 갖게 됩니다.4. 쓰기노트로 쓰기까지 대비할 수 있어요!보고 듣고 읽으면서 단어를 익혔다면, 쓰기훈련노트로 쓰기까지 끝낼 수 있습니다. [쓰기훈련노트]는 단어 쓰기를 특화한 노트로, 단어를 큰 소리로 읽고 의미를 생각하면서 충분히 따라 써보며 하루 12단어를 완벽하게 내 것으로 만들 수 있습니다. [REVIEW BOX]에서는 앞서 3권에서 배운 내용을 짝꿍 단어(collocation)으로 복습할 수 있어 1, 2, 3권과 연계하여 학습하면 더욱 좋습니다."
